text,created_at,retweet_count,favorite_count
.@JimRenacci has worked so hard on Tax Reductions Illegal Immigration the Border and Crime. I need Jim very badly to help our agenda and to keep MAKING AMERICA GREAT AGAIN! He will be a fantastic Senator for the Great State of Ohio and has my full endorsement!,4/24/18,14847,59884
.@JimRenacci has worked so hard on Tax Reductions Illegal Immigration the Border and Crime. I need Jim very badly to help our agenda and to keep MAKING AMERICA GREAT AGAIN! He will be a fantastic  Senator for the Great State of Ohio and has my full endorsement!,4/24/18,8,10
“President Trump Calls the U.S.-France Relationship ‘Unbreakable.’ History Shows He’s Right.” https://t.co/L0gT4rvaJO,4/24/18,10729,54984
Arizona please get out today and vote @DebbieLesko for Congress in #AZ08. Strong on Border Immigration and Crime. Great on the Military. Time is ticking down - get out and VOTE today. We need Debbie in Congress!,4/24/18,16650,60869
Americans stand with you and all of Canada Prime Minister @JustinTrudeau. Our thoughts and prayers are with you all. #TorontoStrong https://t.co/Xo3Cn962z8,4/24/18,7037,39641
Having great meetings and discussions with my friend President @EmmanuelMacron of France. We are in the midst of meetings on Iran Syria and Trade. We will be holding a joint press conference shortly here at the @WhiteHouse. 🇺🇸🇫🇷 https://t.co/ju1FXhgjaD,4/24/18,10395,51605
Here’s a great stat - since January 2017 the number of people forced to use food stamps is down 1.9 million. The American people are finally back to work!,4/23/18,32487,153557
Mexico whose laws on immigration are very tough must stop people from going through Mexico and into the U.S. We may make this a condition of the new NAFTA Agreement. Our Country cannot accept what is happening! Also we must get Wall funding fast.,4/23/18,25412,106206
Despite the Democrat inspired laws on Sanctuary Cities and the Border being so bad and one sided I have instructed the Secretary of Homeland Security not to let these large Caravans of people into our Country. It is a disgrace. We are the only Country in the World so naive! WALL,4/23/18,25812,103828
Hard to believe Obstructionists May vote against Mike Pompeo for Secretary of State. The Dems will not approve hundreds of good people including the Ambassador to Germany. They are maxing out the time on approval process for all never happened before. Need more Republicans!,4/23/18,22940,89895
Thank you to the incredible Law Enforcement Officers from the Palm Beach County Sheriff’s Office. They keep us safe and are very cool about it! https://t.co/NlhxpPwmzT,4/22/18,17457,94385
Kim Strassel of the WSJ just said after reviewing the dumb Comey Memos “you got to ask what was the purpose of the Special Counsel? There’s no there there.” Dan Henninger of the WSJ said Memos would show that this would be one of the weakest obstruction cases ever brought!,4/22/18,24359,95011
Funny how all of the Pundits that couldn’t come close to making a deal on North Korea are now all over the place telling me how to make a deal!,4/22/18,28474,121404
A complete Witch Hunt!,4/22/18,20160,96490
“I can die happy now with Trump Job performance” stated Mary Matalin. “A great overall President stunning!” Thank you Mary.,4/22/18,16995,91081
....We are a long way from conclusion on North Korea maybe things will work out and maybe they won’t - only time will tell....But the work I am doing now should have been done a long time ago!,4/22/18,22150,106161
Sleepy Eyes Chuck Todd of Fake News NBC just stated that we have given up so much in our negotiations with North Korea and they have given up nothing. Wow we haven’t given up anything &amp; they have agreed to denuclearization (so great for World) site closure &amp; no more testing!,4/22/18,25871,102315
“GOP Lawmakers asking Sessions to Investigate Comey and Hillary Clinton.” @FoxNews   Good luck with that request!,4/22/18,20686,88624
“At least two Memos Comey shared with a friend contained Classified Information.”  Wall Street Journal,4/21/18,22217,89167
The Washington Post said I refer to Jeff Sessions as “Mr. Magoo” and Rod Rosenstein as “Mr. Peepers.” This is “according to people with whom the president has spoken.” There are no such people and don’t know these characters...just more Fake &amp; Disgusting News to create ill will!,4/21/18,17773,68920
James Comey’s Memos are Classified I did not Declassify them. They belong to our Government! Therefore he broke the law! Additionally he totally made up many of the things he said I said and he is already a proven liar and leaker. Where are Memos on Clinton Lynch &amp; others?,4/21/18,20807,76182
Sylvester Stallone called me with the story of heavyweight boxing champion Jack Johnson. His trials and tribulations were great his life complex and controversial. Others have looked at this over the years most thought it would be done but yes I am considering a Full Pardon!,4/21/18,20946,99627
So funny the Democrats have sued the Republicans for Winning. Now he R’s counter and force them to turn over a treasure trove of material including Servers and Emails!,4/21/18,23722,96367
Heading to the Southern White House to watch the Funeral Service of Barbara Bush. First Lady Melania has arrived in Houston to pay our respects. Will be a beautiful day!,4/21/18,12051,78580
Today my thoughts and prayers are with the entire Bush family. In memory of First Lady Barbara Bush there is a remembrance display located at her portrait in the Center Hall of the @WhiteHouse. https://t.co/AuJ3RLZyax,4/21/18,13088,78985
Fantastic crowd and great people yesterday in Key West Florida. Thank you! https://t.co/HqOUFgmbQS,4/21/18,14259,68675
Join me in Washington Michigan on Saturday April 28 2018 at 7:00pm! #MAGA Tickets: https://t.co/DISosdqBuu https://t.co/gHdTgHw5FU,4/21/18,10915,41148
....non-existent “sources” and a drunk/drugged up loser who hates Michael a fine person with a wonderful family. Michael is a businessman for his own account/lawyer who I have always liked &amp; respected. Most people will flip if the Government lets them out of trouble even if....,4/21/18,10795,49503
....it means lying or making up stories. Sorry I don’t see Michael doing that despite the horrible Witch Hunt and the dishonest media!,4/21/18,11372,53280
The New York Times and a third rate reporter named Maggie Haberman known as a Crooked H flunkie who I don’t speak to and have nothing to do with are going out of their way to destroy Michael Cohen and his relationship with me in the hope that he will “flip.” They use....,4/21/18,14573,59973
The New York Times and a third rate reporter named Maggie Habberman known as a Crooked H flunkie who I don’t speak to and have nothing to do with are going out of their way to destroy Michael Cohen and his relationship with me in the hope that he will “flip.” They use....,4/21/18,3574,12690
....non-existent “sources” and a drunk/drugged up loser who hates Michael a fine person with a wonderful family. Michael is a businessman for his own account/lawyer who I have always liked &amp; respected. Most people will flip if the Government lets them out of trouble even if....,4/21/18,2671,10374
....it means lying or making up stories. Sorry I don’t see Michael doing that despite the horrible Witch Hunt and the dishonest media!,4/21/18,2802,11432
A message from Kim Jong Un: “North Korea will stop nuclear tests and launches of intercontinental ballistic missiles.”Also will “Shut down a nuclear test site in the country’s Northern Side to prove the vow to suspend nuclear tests.” Progress being made for all!,4/21/18,32170,142849
James Comey illegally leaked classified documents to the press in order to generate a Special Council? Therefore the Special Council was established based on an illegal act? Really does everybody know what that means?,4/21/18,28786,106428
Just heard the Campaign was sued by the Obstructionist Democrats. This can be good news in that we will now counter for the DNC Server that they refused to give to the FBI the Debbie Wasserman Schultz Servers and Documents held by the Pakistani mystery man and Clinton Emails.,4/20/18,31576,111546
North Korea has agreed to suspend all Nuclear Tests and close up a major test site. This is very good news for North Korea and the World - big progress! Look forward to our Summit.,4/20/18,47068,186635
Just heard the Campaign was sued by the Obstructionist Democrats. This can be good news in that we will now counter for the DNC Server that they refused to give to the FBI the Wendy Wasserman Schultz Servers and Documents held by the Pakistani mystery man and Clinton Emails.,4/20/18,8794,27084
Can you believe that despite 93% bad stories from the Fake News Media (should be getting good stories) today we had just about our highest Poll Numbers including those on Election Day? The American public is wise to the phony an dishonest press. Make America Great Again!,4/20/18,32021,131814
Looks like OPEC is at it again. With record amounts of Oil all over the place including the fully loaded ships at sea Oil prices are artificially Very High! No good and will not be accepted!,4/20/18,24013,98516
Nancy Pelosi is going absolutely crazy about the big Tax Cuts given to the American People by the Republicans...got not one Democrat Vote! Here’s a choice. They want to end them and raise your taxes substantially. Republicans are working on making them permanent and more cuts!,4/20/18,28986,110478
So exciting! I have agreed to be the Commencement Speaker at our GREAT Naval Academy on May 25th in Annapolis Maryland. Looking forward to being there.,4/20/18,19924,116724
So General Michael Flynn’s life can be totally destroyed while Shadey James Comey can Leak and Lie and make lots of money from a third rate book (that should never have been written). Is that really the way life in America is supposed to work? I don’t think so!,4/20/18,30399,109491
James Comey Memos just out and show clearly that there was NO COLLUSION and NO OBSTRUCTION. Also he leaked classified information. WOW! Will the Witch Hunt continue?,4/20/18,25596,102289
James Comey just threw Andrew McCabe “under the bus.” Inspector General’s Report on McCabe is a disaster for both of them! Getting a little (lot) of their own medicine?,4/19/18,21804,85311
Sanctuary Cities released at least 142 Gang Members across the United States making it easy for them to commit all forms of violent crimes where none would have existed. We are doing a great job of law enforcement but things such as this make safety in America difficult!,4/19/18,20391,74265
My thoughts prayers and condolences are with the families friends and colleagues of the two @GCSOFlorida deputies (HEROES) who lost their lives in the line of duty today.,4/19/18,14458,65890
Mike Pompeo is outstanding. First in his class at West Point. A top student at Harvard Law School. A success at whatever he has done. We need the Senate to approve Mike ASAP. He will be a great Secretary of State!,4/19/18,22576,91256
...Hopefully the Senate will not leave Washington until our Ambassadors Judges and the people who make Washington work are approved. The Democrats are Obstructing the process and we need these people approved for the good of our Country!,4/19/18,19050,73600
Democrats are obstructing good (hopefully great) people wanting to give up a big portion of their life to work for our Government hence the American People. They are “slow walking” all of my nominations - hundreds of people. At this rate it would take 9 years for all approvals!,4/19/18,26579,96971
.@MarshaBlackburn is a wonderful woman who has always been there when we have needed her. Great on the Military Border Security and Crime. Loves and works hard for the people of Tennessee. She has my full endorsement and I will be there to campaign with her!,4/19/18,15076,60475
THANK YOU #JIATFSouth @Norad_Northcom @southcomwatch and @DHSgov. Keep up the GREAT work! https://t.co/3v2uG6Jp1T,4/19/18,6663,31574
Just arrived @NASKeyWest! Heading to a briefing with the Joint Interagency Task Force South NORTHCOM and SOUTHCOM. https://t.co/r906IXnBcG,4/19/18,9194,44839
Governor Jerry Brown announced he will deploy “up to 400 National Guard Troops” to do nothing. The crime rate in California is high enough and the Federal Government will not be paying for Governor Brown’s charade. We need border security and action not words!,4/19/18,20309,84456
Thank you San Diego County for defending the rule of law and supporting our lawsuit against California's illegal and unconstitutional 'Sanctuary' policies. California's dangerous policies release violent criminals back into our communities putting all Americans at risk.,4/19/18,20044,86533
Great meeting with Prime Minister Abe of Japan who has just left Florida. Talked in depth about North Korea Military and Trade. Good things will happen!,4/19/18,14185,71412
It was my great honor to host my friend @JPN_PMO @AbeShinzo and his delegation at Mar-a-Lago for the past two days. Lots accomplished thank you! #Success🇺🇸🇯🇵 https://t.co/2NnItfwfBl,4/19/18,14662,65149
Great working luncheon with U.S. and Japanese Delegations this afternoon! https://t.co/ywU2CEih8b,4/18/18,12621,64968
Prime Minister @AbeShinzo of Japan and myself this morning building an even deeper and better relationship while playing a quick round of golf at Trump International Golf Club. https://t.co/YqU7pHiFoU,4/18/18,15309,75781
Best wishes to Prime Minister @Netanyahu and all of the people of Israel on the 70th Anniversary of your Great Independence. We have no better friends anywhere. Looking forward to moving our Embassy to Jerusalem next month!,4/18/18,23897,102082
Slippery James Comey the worst FBI Director in history was not fired because of the phony Russia investigation where by the way there was NO COLLUSION (except by the Dems)!,4/18/18,22580,96478
Mike Pompeo met with Kim Jong Un in North Korea last week. Meeting went very smoothly and a good relationship was formed. Details of Summit are being worked out now. Denuclearization will be a great thing for World but also for North Korea!,4/18/18,25827,101034
A sketch years later about a nonexistent man. A total con job playing the Fake News Media for Fools (but they know it)! https://t.co/9Is7mHBFda,4/18/18,17869,61945
There is a Revolution going on in California. Soooo many Sanctuary areas want OUT of this ridiculous crime infested &amp; breeding concept. Jerry Brown is trying to back out of the National Guard at the Border but the people of the State are not happy. Want Security &amp; Safety NOW!,4/18/18,29045,115384
While Japan and South Korea would like us to go back into TPP I don’t like the deal for the United States. Too many contingencies and no way to get out if it doesn’t work. Bilateral deals are far more efficient profitable and better for OUR workers. Look how bad WTO is to U.S.,4/18/18,18159,78191
Pastor Andrew Brunson a fine gentleman and Christian leader in the United States is on trial and being persecuted in Turkey for no reason. They call him a Spy but I am more a Spy than he is. Hopefully he will be allowed to come home to his beautiful family where he belongs!,4/18/18,20638,84836
It is my great honor to host @JPN_PMO @AbeShinzo! https://t.co/QxMpCGRycF,4/18/18,9760,42306
.@FLOTUS Melania and I join the Nation in celebrating the life of Barbara Bush: https://t.co/4OW72iddQx,4/18/18,8841,45176
.@FLOTUS Melania and I join the Nation in celebrating the life of Barbara Bush: https://t.co/4NzyjxqAFM,4/18/18,10206,39641
States and Cities throughout our Country are being cheated and treated so badly by online retailers. Very unfair to traditional tax paying stores!,4/17/18,14227,70002
Today’s Court decision means that Congress must close loopholes that block the removal of dangerous criminal aliens including aggravated felons. This is a public safety crisis that can only be fixed by....,4/17/18,15804,66855
....Congress – House and Senate must quickly pass a legislative fix to ensure violent criminal aliens can be removed from our society. Keep America Safe!,4/17/18,13120,55653
Welcome Prime Minister Abe! https://t.co/538EYyfWDq,4/17/18,14549,58345
Rasmussen just came out at 51% Approval despite the Fake News Media. They were one of the three most accurate on Election Day. Just about the most inaccurate were CNN and ABC News/Washington Post and they haven’t changed (get new pollsters). Much of the media is a Scam!,4/17/18,18409,77972
Getting ready to meet Prime Minister Abe of Japan a truly fine gentleman!,4/17/18,10438,67802
Looks like Jerry Brown and California are not looking for safety and security along their very porous Border. He cannot come to terms for the National Guard to patrol and protect the Border. The high crime rate will only get higher. Much wanted Wall in San Diego already started!,4/17/18,15332,64910
So many people are seeing the benefits of the Tax Cut Bill. Everyone is talking really nice to see!,4/17/18,15379,85300
I am in Florida and looking forward to my meeting with Prime Minister Abe of Japan. Working on Trade and Military Security.,4/17/18,11779,63836
Employment is up Taxes are DOWN. Enjoy!,4/17/18,24896,124448
Russia and China are playing the Currency Devaluation game as the U.S. keeps raising interest rates. Not acceptable!,4/16/18,21561,97741
Comey drafted the Crooked Hillary exoneration long before he talked to her (lied in Congress to Senator G) then based his decisions on her poll numbers. Disgruntled he McCabe and the others committed many crimes!,4/16/18,28889,112636
Just hit 50% in the Rasmussen Poll much higher than President Obama at same point. With all of the phony stories and Fake News it’s hard to believe! Thank you America we are doing Great Things.,4/15/18,29754,141548
Slippery James Comey a man who always ends up badly and out of whack (he is not smart!) will go down as the WORST FBI Director in history by far!,4/15/18,22407,99162
Attorney Client privilege is now a thing of the past. I have many (too many!) lawyers and they are probably wondering when their offices and even homes are going to be raided with everything including their phones and computers taken. All lawyers are deflated and concerned!,4/15/18,24019,103035
I never asked Comey for Personal Loyalty. I hardly even knew this guy. Just another of his many lies. His “memos” are self serving and FAKE!,4/15/18,22395,102330
The Syrian raid was so perfectly carried out with such precision that the only way the Fake News Media could demean was by my use of the term “Mission Accomplished.” I knew they would seize on this but felt it is such a great Military term it should be brought back. Use often!,4/15/18,24048,115575
Comey throws AG Lynch “under the bus!” Why can’t we all find out what happened on the tarmac in the back of the plane with Wild Bill and Lynch? Was she promised a Supreme Court seat or AG in order to lay off Hillary. No golf and grandkids talk (give us all a break)!,4/15/18,26569,102051
The big questions in Comey’s badly reviewed book aren’t answered like how come he gave up Classified Information (jail) why did he lie to Congress (jail) why did the DNC refuse to give Server to the FBI (why didn’t they TAKE it) why the phony memos McCabe’s $700000 &amp; more?,4/15/18,27729,101235
Unbelievably James Comey states that Polls where Crooked Hillary was leading were a factor in the handling (stupidly) of the Clinton Email probe. In other words he was making decisions based on the fact that he thought she was going to win and he wanted a job. Slimeball!,4/15/18,27603,106702
So proud of our great Military which will soon be after the spending of billions of fully approved dollars the finest that our Country has ever had. There won’t be anything or anyone even close!,4/14/18,30430,160818
A perfectly executed strike last night. Thank you to France and the United Kingdom for their wisdom and the power of their fine Military. Could not have had a better result. Mission Accomplished!,4/14/18,43580,200070
https://t.co/6VLQYAlcto,4/14/18,36601,103684
DOJ just issued the McCabe report - which is a total disaster. He LIED! LIED! LIED! McCabe was totally controlled by Comey - McCabe is Comey!! No collusion all made up by this den of thieves and lowlifes!,4/13/18,36632,126817
We are bringing back our factories we are bringing back our jobs and we are bringing back those four beautiful words: MADE IN THE USA! https://t.co/grABSrYUBX,4/13/18,25345,111025
....untruthful slime ball who was as time has proven a terrible Director of the FBI. His handling of the Crooked Hillary Clinton case and the events surrounding it will go down as one of the worst “botch jobs” of history. It was my great honor to fire James Comey!,4/13/18,35266,143118
James Comey is a proven LEAKER &amp; LIAR. Virtually everyone in Washington thought he should be fired for the terrible job he did-until he was in fact fired. He leaked CLASSIFIED information for which he should be prosecuted. He lied to Congress under OATH. He is a weak and.....,4/13/18,33432,127321
Tremendous pressure is building like never before for the Border Wall and an end to crime cradling Sanctuary Cities. Started the Wall in San Diego where the people were pushing really hard to get it. They will soon be protected!,4/13/18,23145,108689
Would only join TPP if the deal were substantially better than the deal offered to Pres. Obama. We already have BILATERAL deals with six of the eleven nations in TPP and are working to make a deal with the biggest of those  nations Japan who has hit us hard on trade for years!,4/13/18,16759,78686
America’s greatest treasure is our people – and my Administration HEARS YOUR VOICE and HAS YOUR BACK. We are fighting to give every American a future of dignity purpose and pride. AMERICAN SPIRIT is back! #TaxCuts https://t.co/oSGZe0irBf,4/12/18,19953,81129
Thank you to all of the American workers who travelled here today! This event is dedicated to YOU: the hardworking Americans who make this nation run. You love your country you provide for your family you have PRIDE in your work and you cherish our GREAT AMERICAN FLAG! #TaxCuts https://t.co/RwaLpCRPh5,4/12/18,14277,65421
Just had an Agricultural Roundtable with memembers of Congress and Governors.I will be making remarks on the large scale TAX CUTS given to American families and workers at 1:45 P.M. from the Rose Garden. Join me live: https://t.co/XAchZ3zUSe https://t.co/Dqe8QhpDAZ,4/12/18,7045,30968
I have agreed with the historically cooperative disciplined approach that we have engaged in with Robert Mueller (Unlike the Clintons!). I have full confidence in Ty Cobb my Special Counsel and have been fully advised throughout each phase of this process.,4/12/18,16722,82895
On Yom HaShoah we remember the six million Jews slaughtered in the Holocaust. With each passing year our duty to remember this atrocity increases as we pledge #NeverAgain. #HolocaustRemembranceDay https://t.co/tyga4VtjLT,4/12/18,16854,65767
Good luck to Mike Pompeo during his Confirmation Hearing today. He will be a great Secretary of State!,4/12/18,12413,62486
Never said when an attack on Syria would take place. Could be very soon or not so soon at all! In any event the United States under my Administration has done a great job of ridding the region of ISIS. Where is our “Thank you America?”,4/12/18,25626,113966
California Governor Jerry Brown is doing the right thing and sending the National Guard to the Border. Thank you Jerry good move for the safety of our Country!,4/12/18,14804,86130
If I wanted to fire Robert Mueller in December as reported by the Failing New York Times I would have fired him. Just more Fake News from a biased newspaper!,4/12/18,19214,87391
Big show tonight on @seanhannity! 9:00 P.M. on @FoxNews,4/12/18,11142,55637
Honored to have Republican Congressional Leadership join me at the @WhiteHouse this evening. Lots to discuss as we continue MAKING AMERICA GREAT AGAIN! https://t.co/b9z5Nfdkcl,4/11/18,11140,57916
“Trump just took a giant step towards actual welfare reform” https://t.co/LQlACDDLug,4/11/18,16360,69453
The @WhiteHouse is partnering with @Interior and @NatlParkService to bring the @NSCsafety's “Prescribed to Death” Opioid Memorial to the Ellipse - beginning tomorrow April 12th to April 18th. More information: https://t.co/z4FPQxt4Bl https://t.co/XvScPqvAkQ,4/11/18,8589,35788
Speaker Paul Ryan is a truly good man and while he will not be seeking re-election he will leave a legacy of achievement that nobody can question. We are with you Paul!,4/11/18,9909,61655
Much of the bad blood with Russia is caused by the Fake &amp; Corrupt Russia Investigation headed up by the all Democrat loyalists or people that worked for Obama. Mueller is most conflicted of all (except Rosenstein who signed FISA &amp; Comey letter). No Collusion so they go crazy!,4/11/18,26720,97922
Our relationship with Russia is worse now than it has ever been and that includes the Cold War. There is no reason for this. Russia needs us to help with their economy something that would be very easy to do and we need all nations to work together. Stop the arms race?,4/11/18,32551,125691
Russia vows to shoot down any and all missiles fired at Syria. Get ready Russia  because they will be coming nice and new and “smart!” You shouldn’t be partners with a Gas Killing Animal who kills his people and enjoys it!,4/11/18,66753,173428
