text,created_at,retweet_count,favorite_count
“John Solomon: As Russia Collusion fades Ukrainian plot to help Clinton emerges.” @seanhannity  @FoxNews,3/21/19,3661,10296
“The reason we have the Special Counsel investigation is that James Comey (a dirty cop) leaked his memos to a friend who leaked them to the press on purpose.” @KennedyNation Totally illegal!,3/21/19,6278,21813
https://t.co/UhTjBuWY2h,3/21/19,5080,17185
Leaving the GREAT STATE of OHIO for the @WhiteHouse. A really great day!,3/21/19,7851,44786
https://t.co/ssJNhlTMzy,3/20/19,9555,32962
ISIS Caliphate two years ago in red vs. ISIS Caliphate TODAY. (Was even worse in November 2016 before I took office). https://t.co/MUgfex4rCj,3/20/19,13338,42826
Really beautiful to see! https://t.co/DKq2TIeiSs,3/20/19,20621,89766
Great news from @Ford! They are investing nearly $1 BILLION in Flat Rock Michigan for auto production on top of a $1 BILLION investment last month in a facility outside of Chicago. Companies are pouring back into the United States - they want to be where the action is!,3/20/19,16339,62403
I am thrilled to be here in Ohio with the hardworking men and women of the Lima Army Tank Plant! We are here today to celebrate a resounding victory for all of you for Northwest Ohio for our GREAT MILITARY and for our entire Country...https://t.co/ZWbjX0Be9m,3/20/19,15351,60480
George Conway often referred to as Mr. Kellyanne Conway by those who know him is VERY jealous of his wife’s success &amp; angry that I with her help didn’t give him the job he so desperately wanted. I barely know him but just take a look a stone cold LOSER &amp; husband from hell!,3/20/19,22654,105096
The Democrats are getting very “strange.” They now want to change the voting age to 16 abolish the Electoral College and Increase significantly the number of Supreme Court Justices. Actually you’ve got to win it at the Ballot Box!,3/20/19,28625,111089
Not a good situation! https://t.co/uaMcSrX4yM,3/20/19,21304,72520
....just the large States - the Cities would end up running the Country. Smaller States &amp; the entire Midwest would end up losing all power - &amp; we can’t let that happen. I used to like the idea of the Popular Vote but now realize the Electoral College is far better for the U.S.A.,3/20/19,26929,111279
Campaigning for the Popular Vote is much easier &amp; different than campaigning for the Electoral College. It’s like training for the 100 yard dash vs. a marathon. The brilliance of the Electoral College is that you must go to many States to win. With the Popular Vote you go to....,3/20/19,21888,84401
Thank you @JesseBWatters could not have said it any better myself! https://t.co/HirL10zwZl,3/19/19,33598,103134
Amazingly CNN just released a poll at 71% saying that the economy is in the best shape since 2001 18 years! WOW is CNN becoming a believer?,3/19/19,34347,159521
https://t.co/95I4towyEP,3/19/19,17495,54532
I will be looking into this! #StopTheBias https://t.co/ZTWQolvmdM,3/19/19,22141,72173
Facebook Google and Twitter not to mention the Corrupt Media are sooo on the side of the Radical Left Democrats. But fear not we will win anyway just like we did before! #MAGA,3/19/19,38450,151614
“You can’t dispel this mood of positive energy.”  @Varneyco  The Economy is Great!,3/19/19,15832,72639
A total loser! https://t.co/vm3Vv2f9jf,3/19/19,15422,65934
The Fake News Media has NEVER been more Dishonest or Corrupt than it is right now. There has never been a time like this in American History. Very exciting but also very sad! Fake News is the absolute Enemy of the People and our Country itself!,3/19/19,33410,126865
https://t.co/h2bZ1p3UlY,3/19/19,19224,58720
https://t.co/QxJBMTAZqG,3/19/19,23886,69627
Rep. Devin Nunes Files $250M Defamation Lawsuit Against Twitter Two Anonymous Twitter Accounts https://t.co/fT9ZXdWg7z via @thedailybeast,3/19/19,21949,71671
While the press doesn’t like writing about it nor do I need them to I donate my yearly Presidential salary of $400000.00 to different agencies throughout the year this to Homeland Security. If I didn’t do it there would be hell to pay from the FAKE NEWS MEDIA! https://t.co/xqIGUOwh4x,3/18/19,46384,169580
https://t.co/precsXDarx,3/18/19,17677,56556
Our prayers are with the great people of South Dakota. We are staying in close contact with @GovKristiNoem and all the State and Local leaders during and after these devastating floods. Everyone be safe! https://t.co/9CNcPJZ3qi,3/18/19,12375,55322
My team is staying in close contact with Governor Kim Reynolds (@IAGovernor) of Iowa and the local officials managing these floods. We support you and thank all of the first responders working long hours to help the great people of Iowa! https://t.co/mZ4grxQ1Sa,3/18/19,10811,50526
https://t.co/sb4UfYkFWI,3/18/19,17014,51664
GDP growth during the four quarters of 2018 was the fastest since 2005. This Administration is the first on record to have experienced economic growth that meets or exceeds its own forecasts in each of its first two years in office. GROWTH is beating MARKET EXPECTATIONS!,3/18/19,21363,85104
Wow! A Suffolk/USA Today Poll just out states “50% of Americans AGREE that  Robert Mueller’s investigation is a Witch Hunt.” @MSNBC  Very few think it is legit! We will soon find out?,3/18/19,21717,90413
The Fake News Media is working overtime to blame me for the horrible attack in New Zealand. They will have to work very hard to prove that one. So Ridiculous!,3/18/19,29215,133824
Joe Biden got tongue tied over the weekend when he was unable to properly deliver a very simple line about his decision to run for President. Get used to it another low I.Q. individual!,3/18/19,22373,113026
93% Approval Rating in the Republican Party. Thank you!,3/18/19,30808,187274
....are all coming back to the U.S. So is everyone else. We now have the best Economy in the World the envy of all. Get that big beautiful plant in Ohio open now. Close a plant in China or Mexico where you invested so heavily pre-Trump but not in the U.S.A. Bring jobs home!,3/18/19,18489,85335
General Motors and the UAW are going to start “talks” in September/October. Why wait start them now! I want jobs to stay in the U.S.A. and want Lordstown (Ohio) in one of the best economies in our history opened or sold to a company who will open it up fast! Car companies.....,3/18/19,17156,77822
MAKE AMERICA GREAT AGAIN!,3/18/19,47372,216976
What the Democrats have done in trying to steal a Presidential Election first at the “ballot box” and then after that failed with the “Insurance Policy” is the biggest Scandal in the history of our Country!,3/17/19,35770,125852
Just spoke to Mary Barra CEO of General Motors about the Lordstown Ohio plant. I am not happy that it is closed when everything else in our Country is BOOMING. I asked her to sell it or do something quickly. She blamed the UAW Union — I don’t care I just want it open!,3/17/19,24115,111407
Those Republican Senators who voted in favor of Strong Border Security (and the Wall) are being uniformly praised as they return to their States. They know there is a National Emergency at the Southern Border and they had the courage to ACT. Great job!,3/17/19,21426,90431
Were @FoxNews weekend anchors @ArthelNeville and @LelandVittert trained by CNN prior to their ratings collapse? In any event that’s where they should be working along with their lowest rated anchor Shepard Smith!,3/17/19,20933,78967
Democrat UAW Local 1112 President David Green ought to get his act together and produce. G.M. let our Country down but other much better car companies are coming into the U.S. in droves. I want action on Lordstown fast. Stop complaining and get the job done! 3.8% Unemployment!,3/17/19,15147,63429
https://t.co/yvJpMzy3R4,3/17/19,13699,47315
....to the people that got you there. Keep fighting for Tucker and fight hard for @JudgeJeanine. Your competitors are jealous - they all want what you’ve got - NUMBER ONE. Don’t hand it to them on a silver platter. They can’t beat you you can only beat yourselves!,3/17/19,32121,112058
https://t.co/gj32A6PowS,3/17/19,942,2774
....must stay strong and fight back with vigor. Stop working soooo hard on being politically correct which will only bring you down and continue to fight for our Country. The losers all want what you have don’t give it to them. Be strong &amp; prosper be weak &amp; die! Stay true....,3/17/19,26452,103243
Bring back @JudgeJeanine Pirro. The Radical Left Democrats working closely with their beloved partner the Fake News Media is using every trick in the book to SILENCE a majority of our Country. They have all out campaigns against @FoxNews hosts who are doing too well. Fox .....,3/17/19,33904,105122
Happy St. Patrick’s Day! ☘️ https://t.co/WmuNzJSRr8,3/17/19,13628,68804
So it was indeed (just proven in court papers) “last in his class” (Annapolis) John McCain that sent the Fake Dossier to the FBI and Media hoping to have it printed BEFORE the Election. He &amp; the Dems working together failed (as usual). Even the Fake News refused this garbage!,3/17/19,33211,121517
So it was indeed (just proven in court papers) “last in his class” (Annapolis) John McCain that sent the Fake Dossier to the FBI and Media hoping to have it printed BEFORE the Election. He &amp; the Dems working together  failed (as usual). Even the Fake News refused this garbage!,3/17/19,1435,4488
Report: Christopher Steele backed up his Democrat &amp; Crooked Hillary paid for Fake &amp; Unverified Dossier with information he got from “send in watchers” of low ratings CNN. This is the info that got us the Witch Hunt!,3/17/19,19025,70234
....Should Federal Election Commission and/or FCC look into this? There must be Collusion with the Democrats and of course Russia! Such one sided media coverage most of it Fake News. Hard to believe I won and am winning. Approval Rating 52% 93% with Republicans. Sorry!  #MAGA,3/17/19,19269,80972
It’s truly incredible that shows like Saturday Night Live not funny/no talent can spend all of their time knocking the same person (me) over &amp; over without so much of a mention of “the other side.” Like an advertisement without consequences. Same with Late Night Shows......,3/17/19,19517,100256
How is the Paris Environmental Accord working out for France? After 18 weeks of rioting by the Yellow Vest Protesters I guess not so well! In the meantime the United States has gone to the top of all lists on the Environment.,3/16/19,25321,103835
Google is helping China and their military but not the U.S. Terrible! The good news is that they helped Crooked Hillary Clinton and not Trump....and how did that turn out?,3/16/19,25859,101690
Because the economy is so good General Motors must get their Lordstown Ohio plant open maybe in a different form or with a new owner FAST! Toyota is investing 13.5 $Billion in U.S. others likewise. G.M. MUST ACT QUICKLY. Time is of the essence!,3/16/19,15627,69518
Spreading the fake and totally discredited Dossier “is unfortunately a very dark stain against John McCain.” Ken Starr Former Independent Counsel. He had far worse “stains” than this including thumbs down on repeal and replace after years of campaigning to repeal and replace!,3/16/19,25972,96293
This is a National Emergency...https://t.co/AAKBuNW2ro,3/16/19,31400,103293
Mark Morgan Former Border Patrol Chief with great experience in Law Enforcement really understands the subjects of Immigration and the Border. Thank you Mark!  @foxandfriends,3/16/19,12905,60995
https://t.co/WQThgHWcg4,3/16/19,13815,42440
Veto Message to the House of Representatives for H.J. Res. 46: https://t.co/9Z5JHAUv6N https://t.co/lA4RSYTZo0,3/16/19,14286,54262
https://t.co/oCPqP4v1fH,3/16/19,12056,41419
On the recent non-binding vote (420-0) in Congress about releasing the Mueller Report I told leadership to let all Republicans vote for transparency. Makes us all look good and doesn’t matter. Play along with the game!,3/16/19,16446,74725
https://t.co/lopau8H33l,3/16/19,11188,43561
https://t.co/B6NgsZuJdy,3/16/19,11296,39309
Just spoke w/ @GovRicketts. The people of Nebraska &amp; across the Midwest especially the Farmers &amp; Ranchers are feeling the impacts from severe weather. The first responders &amp; emergency response teams have done a great job dealing w/ record flooding high winds &amp; road closures.,3/15/19,15785,75250
https://t.co/tEgQFkcMs1,3/15/19,20003,74862
Just spoke with Jacinda Ardern the Prime Minister of New Zealand regarding the horrific events that have taken place over the past 24 hours. I informed the Prime Minister....,3/15/19,16521,102464
....that we stand in solidarity with New Zealand – and that any assistance the U.S.A. can give we stand by ready to help. We love you New Zealand!,3/15/19,16722,111523
I’d like to thank all of the Great Republican Senators who bravely voted for Strong Border Security and the WALL. This will help stop Crime Human Trafficking and Drugs entering our Country. Watch when you get back to your State they will LOVE you more than ever before!,3/15/19,29368,131863
.....THIS SHOULD NEVER HAPPEN TO A PRESIDENT AGAIN!,3/15/19,29507,146236
....should never have been appointed and there should be no Mueller Report. This was an illegal &amp; conflicted investigation in search of a crime. Russian Collusion was nothing more than an excuse by the Democrats for losing an Election that they thought they were going to win.....,3/15/19,26763,109628
So if there was knowingly &amp; acknowledged to be “zero” crime when the Special Counsel was appointed and if the appointment was made based on the Fake Dossier (paid for by Crooked Hillary) and now disgraced Andrew McCabe (he &amp; all stated no crime) then the Special Counsel.......,3/15/19,22613,88394
“New evidence that the Obama era team of the FBI DOJ &amp; CIA were working together to Spy on (and take out) President Trump all the way back in 2015.” A transcript of Peter Strzok’s testimony is devastating. Hopefully the Mueller Report will be covering this. @OANN @foxandfriends,3/15/19,33242,109768
The ‘Jexodus’ movement encourages Jewish people to leave the Democrat Party. Total disrespect! Republicans are waiting with open arms. Remember Jerusalem (U.S. Embassy) and the horrible Iran Nuclear Deal! @OANN  @foxandfriends,3/15/19,21074,80574
My warmest sympathy and best wishes goes out to the people of New Zealand after the horrible massacre in the Mosques. 49 innocent people have so senselessly died with so many more seriously injured. The U.S. stands by New Zealand for anything we can do. God bless all!,3/15/19,31571,164020
Breitbart News Network https://t.co/HdGfwuASWC via @BreitbartNews,3/15/19,6035,19585
https://t.co/884dpZi52P,3/15/19,12398,49752
I look forward to VETOING the just passed Democrat inspired Resolution which would OPEN BORDERS while increasing Crime Drugs and Trafficking in our Country. I thank all of the Strong Republicans who voted to support Border Security and our desperately needed WALL!,3/14/19,41827,174493
VETO!,3/14/19,38934,169799
Congratulations @Toyota! BIG NEWS for U.S. Auto Workers! The USMCA is already fixing the broken NAFTA deal. https://t.co/f9iHprPk5B,3/14/19,18015,72816
A vote for today’s resolution by Republican Senators is a vote for Nancy Pelosi Crime and the Open Border Democrats!,3/14/19,23254,91912
....If at a later date Congress wants to update the law I will support those efforts but today’s issue is BORDER SECURITY and Crime!!! Don’t vote with Pelosi!,3/14/19,20055,95024
Prominent legal scholars agree that our actions to address the National Emergency at the Southern Border and to protect the American people are both CONSTITUTIONAL and EXPRESSLY authorized by Congress....,3/14/19,23108,104219
Happy National Ag Day! https://t.co/hNkOh0TqvW,3/14/19,13448,61376
The three very weak and untalented late night “hosts” are “fighting over table scraps. Carson did a great job it wasn’t political. I don’t know what they’re going to do in 2024 when he’s no longer President?  Will be wacky in the unemployment line.” Michael Loftus @foxandfriends,3/14/19,14017,67750
The Democrats are “Border Deniers.” They refuse to see or acknowledge the Death Crime Drugs and Human Trafficking at our Southern Border!,3/14/19,22281,89172
My Administration looks forward to negotiating a large scale Trade Deal with the United Kingdom. The potential is unlimited!,3/14/19,19231,86573
A big National Emergency vote today by The United States Senate on Border Security &amp; the Wall (which is already under major construction). I am prepared to veto if necessary. The Southern Border is a National Security and Humanitarian Nightmare but it can be easily fixed!,3/14/19,20567,87096
“Democrats are frantic to throw something else at the President. That’s why you saw those 81 subpoenas. It’s ridiculous. Just because your still upset over an election that happened 2 1/2 years ago you should not be allowed to ruin people’s lives like this.” Lara Trump @FoxNews,3/14/19,21355,89302
I agree with Rand Paul. This is a total disgrace and should NEVER happen to another President! https://t.co/czcUbee9x7,3/13/19,24765,88681
“The Lisa Page (FBI) transcript also confirms earlier reporting that Page testified Russian Collusion was still unproven when Special Counsel Robert Mueller was appointed.” Catherine Herridge @FoxNews  In other words they appointed someone when there was (and is) no crime. Bad!,3/13/19,22264,77546
“Double Standard - Former FBI lawyer (Lisa Page) admits being told to go easy on Clinton.”  Very unfair!  @FoxNews,3/13/19,24501,93519
https://t.co/2qWkPuFDL6,3/13/19,13486,50406
Republican Senators are overthinking tomorrow’s vote on National Emergency. It is very simply Border Security/No Crime - Should not be thought of any other way. We have a MAJOR NATIONAL EMERGENCY at our Border and the People of our Country know it very well!,3/13/19,30312,115992
Democrats will have a unanimous vote on a 20% issue in opposing Republican Senators tomorrow. The Dems are for Open Borders and Crime!,3/13/19,17356,68711
Comey testified (under oath) that it was a “unanimous” decision on Crooked Hillary. Lisa Page transcripts show he LIED. @jasoninthehouse,3/13/19,22909,78527
The Fake News photoshopped pictures of Melania then propelled conspiracy theories that it’s actually not her by my side in Alabama and other places. They are only getting more deranged with time!,3/13/19,23286,98166
The just revealed FBI Agent Lisa Page transcripts make the Obama Justice Department look exactly like it was a broken and corrupt machine. Hopefully justice will finally be served. Much more to come!,3/13/19,35954,121550
Defying voters the Governor of California will halt all death penalty executions of 737 stone cold killers. Friends and families of the always forgotten VICTIMS are not thrilled and neither am I!,3/13/19,20598,80173
KEEP AMERICA GREAT!,3/13/19,20953,95395
MAKE AMERICA GREAT AGAIN!,3/13/19,23510,104677
“Jay Leno points out that comedy (on the very boring late night shows) is totally one-sided. It’s tough when there’s only one topic.” @foxandfriends  Actually the one-sided hatred on these shows is incredible and for me unwatchable. But remember WE are number one - President!,3/13/19,17845,91408
....a man who is considered by many to be the President with the most successful first two years in history especially when he has done nothing wrong and impeachment is for “high crimes and misdemeanors”?,3/13/19,22179,124430
I greatly appreciate Nancy Pelosi’s statement against impeachment but everyone must remember the minor fact that I never did anything wrong the Economy and Unemployment are the best ever Military and Vets are great - and many other successes! How do you impeach....,3/13/19,29559,153480
So many records being set with respect to our Economy. Unemployment numbers among BEST EVER. A beautiful thing to watch!,3/13/19,17913,86231
All part of the Witch Hunt Hoax. Started by little Eric Schneiderman &amp; Cuomo. So many leaving New York! https://t.co/5HCCNFZXFN,3/13/19,14564,54210
All part of the Witch Hunt Hoax. Started by little Eric Schneiderman &amp; Coumo. So many leaving New York! https://t.co/5HCCNFZXFN,3/13/19,1285,3804
All part of the Witch Hunt! https://t.co/5HCCNFZXFN,3/13/19,2776,8805
New York State and its Governor Andrew Cuomo are now proud members of the group of PRESIDENTIAL HARASSERS. No wonder people are fleeing the State in record numbers. The Witch Hunt continues!,3/12/19,21948,93851
....needed and the complexity creates danger. All of this for great cost yet very little gain. I don’t know about you but I don’t want Albert Einstein to be my pilot. I want great flying professionals that are allowed to easily and quickly take control of a plane!,3/12/19,17346,80970
Airplanes are becoming far too complex to fly. Pilots are no longer needed but rather computer scientists from MIT. I see it all the time in many products. Always seeking to go one unnecessary step further when often old and simpler is far better. Split second decisions are....,3/12/19,24564,116829
Patrick Moore co-founder of Greenpeace: “The whole climate crisis is not only Fake News it’s Fake Science. There is no climate crisis there’s weather and climate all around the world and in fact carbon dioxide is the main building block of all life.” @foxandfriends  Wow!,3/12/19,33839,105616
“Jewish people are leaving the Democratic Party. We saw a lot of anti Israel policies start under the Obama Administration and it got worsts &amp; worse. There is anti-Semitism in the Democratic Party. They don’t care about Israel or the Jewish people.” Elizabeth Pipko Jexodus.,3/12/19,28315,105164
Republican Senators have a very easy vote this week. It is about Border Security and the Wall (stopping Crime Drugs etc.) not Constitutionality and Precedent. It is an 80% positive issue. The Dems are 100% United as usual on a 20% issue Open Borders and Crime. Get tough R’s!,3/11/19,31150,121948
Making Daylight Saving Time permanent is O.K. with me!,3/11/19,32490,185610
At a recent round table meeting of business executives &amp; long after formally introducing Tim Cook of Apple I quickly referred to Tim + Apple as Tim/Apple as an easy way to save time &amp; words. The Fake News was disparagingly all over this &amp; it became yet another bad Trump story!,3/11/19,21533,105804
“There’s not one shred of evidence that President Trump has done anything wrong.” @GrahamLedger One America News.  So true a total Witch Hunt - All started illegally by Crooked Hillary Clinton the DNC and others!,3/10/19,24528,100961
More people are working today in the United States 158000000 than at any time in our Country’s history. That is a Big Deal!,3/10/19,26622,123957
Despite the most hostile and corrupt media in the history of American politics the Trump Administration has accomplished more in its first two years than any other Administration. Judges biggest Tax &amp; Regulation Cuts V.A. Choice Best Economy Lowest Unemployment &amp; much more!,3/10/19,30793,136683
“Donald Trump’s Approval Rating is at or near his highest level ever. The media is not being honest about what is happening in this Country.” Jesse Watters,3/10/19,27591,123998
Will soon be 145 Judges! https://t.co/LoTbT4RFJj,3/10/19,17583,72382
This is just the beginning! https://t.co/PYwFGVGUxX,3/9/19,20177,76916
The Witch Hunt continues! https://t.co/9W1iUgE0d6,3/9/19,15508,56874
....and renovated with MUCH MORE to follow shortly. Tens of thousands of illegals are being apprehended (captured) at the Border and NOT allowed into our Country. With another President millions would be pouring in. I am stopping an invasion as the Wall gets built. #MAGA,3/9/19,21026,90972
Wacky Nut Job @AnnCoulter who still hasn’t figured out that despite all odds and an entire Democrat Party of Far Left Radicals against me (not to mention certain Republicans who are sadly unwilling to fight) I am winning on the Border. Major sections of Wall are being built...,3/9/19,23206,97547
I hope the grandstanding Governor of California is able to spend his very highly taxed citizens money on asylum holds more efficiently than money has been spent on the so-called Fast Train which is $Billions over budget &amp; in total disarray. Time to reduce taxes in California!,3/9/19,23092,103159
Border Patrol and Law Enforcement has apprehended (captured) large numbers of illegal immigrants at the Border. They won’t be coming into the U.S. The Wall is being built and will greatly help us in the future and now!,3/9/19,28524,131924
https://t.co/QUuEBfFo44,3/9/19,21030,80743
.@RepMikeTurner  “The only time that Michael Cohen told the truth is when he pled that he is guilty.”  Also when he said no collusion and I did not tell him to lie!”,3/8/19,16019,71298
Unimaginable loss - Such great people! https://t.co/AV9oi8XuaE,3/8/19,23662,98526
Sessions didn’t have a clue! https://t.co/XlLpnINOBv,3/8/19,13401,45490
Aluminum prices are down 12% since I instituted Tariffs on Aluminum Dumping - and the U.S. will be taking in Billions plus jobs. Nice!,3/8/19,17574,80520
Congratulations to Heather Wilson who is the sole finalist to become the next President of University of Texas at El Paso effective September 1 2019. Heather has done an absolutely fantastic job...,3/8/19,11723,71818
....as Secretary of the Air Force and I know she will be equally great in the very important world of higher education. A strong thank you to Heather for her service.,3/8/19,9773,62848
