text,created_at,retweet_count,favorite_count
Bad lawyer and fraudster Michael Cohen said under sworn testimony that he never asked for a Pardon. His lawyers totally contradicted him. He lied! Additionally he directly asked me for a pardon. I said NO. He lied again! He also badly wanted to work at the White House. He lied!,3/8/19,19899,80930
Heading now to the Great State of Alabama!,3/8/19,11468,74843
On International Women’s Day we honor women worldwide for their vital role in shaping and strengthening our communities families governments and businesses...https://t.co/VVnkuBPmhA,3/8/19,12460,53240
Women’s unemployment rate is down to 3.6% - was 7.9% in January 2011. Things are looking good!,3/8/19,15651,75362
We are apprehending record numbers of illegal immigrants - but we need the Wall to help our great Border Patrol Agents!,3/8/19,17344,80443
“This is as good a time as I can remember to be an American Worker. We have the strongest economy in the world.”  Stuart Varney @foxandfriends  So true!,3/8/19,13196,64333
Both the Judge and the lawyer in the Paul Manafort case stated loudly and for the world to hear that there was NO COLLUSION with Russia. But the Witch Hunt Hoax continues as you now add these statements to House &amp; Senate Intelligence &amp; Senator Burr. So bad for our Country!,3/8/19,16803,70286
PRESIDENTIAL HARASSMENT!,3/8/19,18891,84215
I cannot believe the level of dishonesty in the media. It is totally out of control but we are winning!,3/8/19,27515,140857
Thank you @foxandfriends. Great show!,3/8/19,7722,49748
The Wall is being built and is well under construction. Big impact will be made. Many additional contracts are close to being signed. Far ahead of schedule despite all of the Democrat Obstruction and Fake News!,3/8/19,26421,109551
Breaking News @MSNBC: “Cohen’s lawyer contradicts Cohen’s testimony about never seeking a Presidential Pardon.”,3/7/19,19691,80942
We are on track to APPREHEND more than one million people coming across the Southern Border this year. Great job by Border Patrol (and others) who are working in a Broken System. Can be fixed by Congress so easily and quickly if only the Democrats would get on board!,3/7/19,30458,126242
It was not a campaign contribution and there were no violations of the campaign finance laws by me. Fake News!,3/7/19,21502,104543
Democrats just blocked @FoxNews from holding a debate. Good then I think I’ll do the same thing with the Fake News Networks and the Radical Left Democrats in the General Election debates!,3/7/19,44016,183821
Wall Street Journal: “More migrant families crossing into the U.S. illegally have been arrested in the first five months of the federal fiscal year than in any prior full year.” We are doing a great job at the border but this is a National Emergency!,3/7/19,25976,106959
Congressman Chris Stewart: “No one is accusing the President of a crime and yet they (the Democrats) are issuing hundreds of subpoenas. This is unprecedented.” They are desperately trying to find anything they can even a punctuation mistake in a document!,3/6/19,26744,99823
American Workforce Policy Advisory Board Meeting at the @WhiteHouse! https://t.co/izb2tTrINB,3/6/19,11777,48241
It is shameful that House Democrats won’t take a stronger stand against Anti-Semitism in their conference. Anti-Semitism has fueled atrocities throughout history and it’s inconceivable they will not act to condemn it!,3/6/19,30821,117519
Senate Republicans are not voting on constitutionality or precedent they are voting on desperately needed Border Security &amp; the Wall. Our Country is being invaded with Drugs Human Traffickers &amp; Criminals of all shapes and sizes. That’s what this vote is all about. STAY UNITED!,3/6/19,31827,123380
Weirdo Tom Steyer doesn’t have the “guts” or money to run for President. He’s all talk! https://t.co/klmVsCmeNE,3/6/19,15734,64933
Hans Von Spakovsky “I haven’t seen any evidence of actual violations of the law which is usually a basis before you start an investigation. Adam Schiff seems to be copying Joseph McCarthy in wanting to open up investigations when they don’t have any evidence of wrongdoing.”,3/6/19,28212,106296
Presidential Harassment! https://t.co/AHz6kLliaC,3/6/19,23,63
“(Crooked) Hillary Clinton confirms she will not run in 2020 rules out a third bid for White House.” Aw-shucks does that mean I won’t get to run against her again? She will be sorely missed!,3/5/19,34299,169524
Scott Gottlieb who has done an absolutely terrific job as Commissioner of the FDA plans to leave government service sometime next month....,3/5/19,12067,67926
....Scott has helped us to lower drug prices get a record number of generic drugs approved and onto the market and so many other things. He and his talents will be greatly missed!,3/5/19,12334,72844
Just a few moments ago I signed an EO addressing one of our nation’s most heartbreaking tragedies: VETERANS SUICIDE. To every Veteran—I want you to know that you have an entire nation of more than 300 million people behind you. You will NEVER be forgotten.https://t.co/DKxiV5Ku3B,3/5/19,27252,101631
Our great First Lady (@FLOTUS) will be doing a LIVE show TODAY at 1:00 PM PT with the terrific @EricBolling at the @WestgateVegas Resort. She’s on her #BeBest Tour helping address the #OpioidCrisis. Free admission for the first 1500 people!,3/5/19,12494,63330
Republican Approval Rating just hit 93%. Sorry Haters! MAKE AMERICA GREAT AGAIN!,3/5/19,37382,160548
PRESIDENTIAL HARASSMENT!,3/5/19,27338,116131
The greatest overreach in the history of our Country. The Dems are obstructing justice and will not get anything done. A big fat fishing expedition desperately in search of a crime when in fact the real crime is what the Dems are doing and have done!,3/5/19,26679,106158
“HIV Is Cured In 2nd Patient Doctors Report.” @nytimes  Such great news for so many. Tremendous progress being made!,3/5/19,28112,119317
Now that they realize the only Collusion with Russia was done by Crooked Hillary Clinton &amp; the Democrats Nadler Schiff and the Dem heads of the Committees have gone stone cold CRAZY. 81 letter sent to innocent people to harass them. They won’t get ANYTHING done for our Country!,3/5/19,27922,104162
@StarParker is indeed a “Star!” Thank you. Center for Urban Renewal &amp; Ed. @JesseBWatters @LauraIngram,3/5/19,980,4827
Representative Ilhan Omar is again under fire for her terrible comments concerning Israel. Jewish groups have just sent a petition to Speaker Pelosi asking her to remove Omar from Foreign Relations Committee. A dark day for Israel!,3/5/19,30621,123307
“We the people will now be subjected to the biggest display of modern day McCarthyism....which is the widest fishing net expedition....every aspect of the presidents life....all in order to get power back so they can institute Socialism.” @seanhannity,3/5/19,30584,113663
“We the people will now be subjected to the biggest display of modern day McCathyism....which is the widest fishing net expedition....every aspect of the presidents life....all in order to get power back so they can institute Socialism.” @seanhannity,3/5/19,2534,8019
.... Amazon like the Washington Post. It’s hard to remember that not so long ago America had prestige media outlets but not anymore.” @TuckerCarlson   The Fake News Media is the true Enemy of the People!,3/5/19,18109,73526
“The American Media has changed forever. News organizations that seemed like a big deal are now extinct.  Those that remain have now degraded themselves beyond recognition like the New Yorker - or they’ve been purchased by Jeff Bezos to conduct unregistered lobbying for.........,3/5/19,23295,95861
Presidential Harassment! https://t.co/2Cz5ckERcs,3/5/19,19543,62719
“There is no Collusion. All of these investigations are in search of a crime. Democrats have no evidence to impeach President Trump. Ridiculous!” @DevinNunes @FoxNews,3/4/19,19884,84107
“Now that the Dems are going to try &amp; switch from Collusion to some other reason it makes them continue to look like sore losers who didn’t accept the WILL OF THE PEOPLE in the last election - they will do anything to get rid of the President.” @AriFleischer It will never work!,3/4/19,26056,102879
The military drills or war games as I call them were never even discussed in my mtg w/ Kim Jong Un of NK—FAKE NEWS! I made that decision long ago because it costs the U.S. far too much money to have those “games” especially since we are not reimbursed for the tremendous cost!,3/4/19,19280,87588
FEMA has been told directly by me to give the A Plus treatment to the Great State of Alabama and the wonderful people who have been so devastated by the Tornadoes. @GovernorKayIvey one of the best in our Country has been so informed. She is working closely with FEMA (and me!).,3/4/19,16597,78045
FEMA has been told directly by me to give the A Plus treatment to the Great State of Alabama and the wonderful people who have been so devastated by the Tornadoes. @GovIvey one of the best in our Country has been so informed. She is working closely with FEMA (and me!).,3/4/19,7124,31575
To the great people of Alabama and surrounding areas: Please be careful and safe. Tornadoes and storms were truly violent and more could be coming. To the families and friends of the victims and to the injured God bless you all!,3/4/19,19707,105263
And also illegally leaking to Fake News CNN &amp; others? https://t.co/GAItdhWniB,3/4/19,19891,69790
Schumer &amp; the Democrats are hurting our Country. Senate Republicans must take BOLD ACTION! https://t.co/QFqCaYmVPJ,3/4/19,20682,72317
For the Democrats to interview in open hearings a convicted liar &amp; fraudster at the same time as the very important Nuclear Summit with North Korea is perhaps a new low in American politics and may have contributed to the “walk.” Never done when a president is overseas. Shame!,3/4/19,24298,97973
....President. We are WINNING big the envy of the WORLD but just think what it could be?,3/4/19,21420,114993
Presidential Harassment by “crazed” Democrats at the highest level in the history of our Country. Likewise the most vicious and corrupt Mainstream Media that any president has ever had to endure - Yet the most successful first two years for any,3/4/19,24774,101051
The reason I do not want military drills with South Korea is to save hundreds of millions of dollars for the U.S. for which we are not reimbursed. That was my position long before I became President. Also reducing tensions with North Korea at this time is a good thing!,3/3/19,24228,118663
My wonderful daughter Ivanka will be interviewed tonight by Steve Hilton on “The Next Revolution.” @FoxNews 9:00 P.M. She works so hard and has achieved so much for the U.S.A.(and gets so little credit!). Then watch Mark Levin at 10:00 P.M. a great show!,3/3/19,17496,89149
“Look how they’re acting now and how we act when we’re in the majority. What the Democrats are doing is an abuse of power. They couldn’t find anything...they took a Fake Dossier &amp; couldn’t find any Collusion. Now they have a fake witness in Cohen.” Congressman Mark Green (R-TN).,3/3/19,21540,88423
After more than two years of Presidential Harassment the only things that have been proven is that Democrats and other broke the law. The hostile Cohen testimony given by a liar to reduce his prison time proved no Collusion! His just written book manuscript showed what he.....,3/3/19,20846,88182
...said was a total lie but Fake Media won’t show it. I am an innocent man being persecuted by some very bad conflicted &amp; corrupt people in a Witch Hunt that is illegal &amp; should never have been allowed to start - And only because I won the Election! Despite this great success!,3/3/19,26612,123319
https://t.co/PTLqvZNwqY,3/3/19,19297,72093
We’ve got NASA “rocking” again. Great activity and success. Congrats to SPACEX and all!,3/3/19,24583,169551
The brand new manuscript for a new book by failed lawyer Michael Cohen shows his testimony was a total lie! Pundits should only use it.,3/3/19,15367,74877
Virtually everything failed lawyer Michael Cohen said in his sworn testimony last week is totally contradicted in his just released manuscript for a book about me. It’s a total new love letter to “Trump” and the pols must now use it rather than his lies for sentence reduction!,3/3/19,21423,101588
Thank you @marklevinshow!https://t.co/dwQR11genG,3/2/19,21274,80583
@TeamCavuto  It was a 3 day train ride to Vietnam not 3 hours!,3/2/19,1971,6899
Will be speaking at CPAC at 11:30 this morning. Record crowd live broadcast. Enjoy!,3/2/19,13702,75778
Very proud of perhaps the greatest golf course anywhere in the world. Also furthers U.K. relationship! https://t.co/3xTzzJH6Iq,3/2/19,11054,60625
I have asked China to immediately remove all Tariffs on our agricultural products (including beef pork etc.) based on the fact that we are moving along nicely with Trade discussions....,3/1/19,23067,123713
....and I did not increase their second traunch of Tariffs to 25% on March 1st. This is very important for our great farmers - and me!,3/1/19,18165,104688
....for Otto’s mistreatment and death. Most important Otto Warmbier will not have died in vain. Otto and his family have become a tremendous symbol of strong passion and strength which will last for many years into the future. I love Otto and think of him often!,3/1/19,20585,107916
I never like being misinterpreted but especially when it comes to Otto Warmbier and his great family. Remember I got Otto out along with three others. The previous Administration did nothing and he was taken on their watch. Of course I hold North Korea responsible....,3/1/19,25398,123235
Michael Cohen’s book manuscript shows that he committed perjury on a scale not seen before. He must have forgotten about his book when he testified. What does Hillary Clinton’s lawyer Lanny Davis say about this one. Is he being paid by Crooked Hillary. Using her lawyer?,3/1/19,23642,95142
...and the fraudulent and dishonest statements he made on Wednesday. No way it’s time to stop this corrupt and illegally brought Witch Hunt. Time to start looking at the other side where real crimes were committed. Republicans have been abused long enough. Must end now!,3/1/19,29612,122249
Oh’ I see! Now that the 2 year Russian Collusion case has fallen apart there was no Collusion except bye Crooked Hillary and the Democrats they say “gee I have an idea let’s look at Trump’s finances and every deal he has ever done. Let’s follow discredited Michael Cohen.....,3/1/19,30590,125420
Congress must demand the transcript of Michael Cohen’s new book given to publishers a short time ago. Your heads will spin when you see the lies misrepresentations and contradictions  against his Thursday testimony. Like a different person! He is totally discredited!,3/1/19,21177,84170
Wow just revealed that Michael Cohen wrote a “love letter to Trump” manuscript for a new book that he was pushing. Written and submitted long after Charlottesville and Helsinki his phony reasons for going rogue. Book is exact opposite of his fake testimony which now is a lie!,3/1/19,19470,82393
Great to be back from Vietnam an amazing place. We had very substantive negotiations with Kim Jong Un - we know what they want and they know what we must have. Relationship very good let’s see what happens!,3/1/19,18319,92937
Today in Alaska it was my great honor to visit with our brave men and women of the United States Military at Joint Base Elmendorf-Richardson. We are forever grateful for their service and sacrifice. THANK YOU! https://t.co/4REVxKUsHT,3/1/19,18756,93071
https://t.co/ywNk8EhOh0,3/1/19,11000,52452
https://t.co/hUK9dSBM3M,3/1/19,11157,52331
I will be interviewed by @seanhannity at 9:00 P.M. on @FoxNews. Enjoy!,3/1/19,10893,61879
Everyone MUST watch the opening to @TuckerCarlson - A Classic! @foxnews,3/1/19,13551,74595
THANK YOU to our generous hosts in Hanoi this week: President Trong Prime Minister Phuc and the wonderful people of Vietnam! https://t.co/AMqF0dfRhP,2/28/19,27255,141417
Great meeting and dinner with Kim Jong Un in Hanoi Vietnam tonight. Looking forward to continuing our discussions tomorrow! #HanoiSummit https://t.co/J3x6lUGzjS,2/27/19,23375,100193
Great meetings and dinner tonight in Vietnam with Kim Jong Un of North Korea. Very good dialogue. Resuming tomorrow!,2/27/19,22872,129034
All false reporting (guessing) on my intentions with respect to North Korea. Kim Jong Un and I will try very hard to work something out on Denuclearization &amp; then making North Korea an Economic Powerhouse. I believe that China Russia Japan &amp; South Korea will be very helpful!,2/27/19,22822,102320
Fiat Chrysler will be adding more than 6500 JOBS in Michigan (Detroit area) doubling its hourly workforce as part of a 4.5 Billion Dollar investment. Thank you Fiat Chrysler. They are all coming back to the USA it’s where the action is!,2/27/19,26707,123442
Michael Cohen was one of many lawyers who represented me (unfortunately). He had other clients also. He was just disbarred by the State Supreme Court for lying &amp; fraud. He did bad things unrelated to Trump. He is lying in order to reduce his prison time. Using Crooked’s lawyer!,2/27/19,32876,133251
I have now spent more time in Vietnam than Da Nang Dick Blumenthal the third rate Senator from Connecticut (how is Connecticut doing?). His war stories of his heroism in Vietnam were a total fraud - he was never even there. We talked about it today with Vietnamese leaders!,2/27/19,38710,161425
The Democrats should stop talking about what I should do with North Korea and ask themselves instead why they didn’t do “it” during eight years of the Obama Administration?,2/27/19,42692,189691
Vietnam is thriving like few places on earth. North Korea would be the same and very quickly if it would denuclearize. The potential is AWESOME a great opportunity like almost none other in history for my friend Kim Jong Un. We will know fairly soon - Very Interesting!,2/27/19,22716,108716
Just arrived in Vietnam. Thank you to all of the people for the great reception in Hanoi. Tremendous crowds and so much love!,2/26/19,27335,171114
....This will be remembered as one of the most shocking votes in the history of Congress. If there is one thing we should all agree on it’s protecting the lives of innocent babies.,2/26/19,53459,206222
Senate Democrats just voted against legislation to prevent the killing of newborn infant children. The Democrat position on abortion is now so extreme that they don’t mind executing babies AFTER birth....,2/26/19,66176,204023
If a deal is made with China our great American Farmers will be treated better than they have ever been treated before!,2/26/19,21743,112352
Heading over to Vietnam for my meeting with Kim Jong Un. Looking forward to a very productive Summit!,2/25/19,18877,109575
China Trade Deal (and more) in advanced stages. Relationship between our two Countries is very strong. I have therefore agreed to delay U.S. tariff hikes. Let’s see what happens?,2/25/19,16168,80147
...our foreign partners. Recovering American hostages is a priority of my Admin and with Danny’s release we have now secured freedom for 20 American captives since my election victory. We will not rest as we continue our work to bring the remaining American hostages back home!,2/25/19,17712,97114
...Danny’s recovery reflects the best of what the United States &amp; its partners can accomplish.We work every day to bring Americans home. We maintain constant and intensive diplomatic intelligence and law enforcement cooperation within the United States Government and with...,2/25/19,14845,87824
It is my honor today to announce that Danny Burch a United States citizen who has been held hostage in Yemen for 18 months has been recovered and reunited with his wife and children. I appreciate the support of the United Arab Emirates in bringing Danny home...,2/25/19,31754,156485
Congratulations to @DJohnsonPGA on his 20th PGA Tour WIN. Not only is Dustin a truly great golfer he is a wonderful guy. Big year ahead for Dustin!,2/25/19,9410,66761
Since my election as President the Dow Jones is up 43% and the NASDAQ Composite almost 50%. Great news for your 401(k)s as they continue to grow. We are bringing back America faster than anyone thought possible!,2/25/19,26129,121223
“Why on earth would any Republican vote not to put up a Wall or against Border Security. Please explain that to me?” @Varneyco,2/25/19,22711,107831
I hope our great Republican Senators don’t get led down the path of weak and ineffective Border Security. Without strong Borders we don’t have a Country - and the voters are on board with us. Be strong and smart don’t fall into the Democrats “trap” of Open Borders and Crime!,2/25/19,29708,120334
Former Senator Harry Reid (he got thrown out) is working hard to put a good spin on his failed career. He led through lies and deception only to be replaced by another beauty Cryin’ Chuck Schumer. Some things just never change!,2/25/19,23709,102930
Meeting for breakfast with our Nation’s Governors - then off to Vietnam for a very important Summit with Kim Jong Un. With complete Denuclearization North Korea will rapidly become an Economic Powerhouse. Without it just more of the same. Chairman Kim will make a wise decision!,2/25/19,16066,77225
Oil prices getting too high. OPEC please relax and take it easy. World cannot take a price hike - fragile!,2/25/19,18096,87773
Be nice if Spike Lee could read his notes or better yet not have to use notes at all when doing his racist hit on your President who has done more for African Americans (Criminal Justice Reform Lowest Unemployment numbers in History Tax Cutsetc.) than almost any other Pres!,2/25/19,31575,156269
We have a State of Emergency at our Southern Border. Border Patrol our Military and local Law Enforcement are doing a great job but without the Wall which is now under major construction you cannot have Border Security. Drugs Gangs and Human Trafficking must be stopped!,2/25/19,20007,92859
....productive talks I will be delaying the U.S. increase in tariffs now scheduled for March 1. Assuming both sides make additional progress we will be planning a Summit for President Xi and myself at Mar-a-Lago to conclude an agreement. A very good weekend for U.S. &amp; China!,2/24/19,22146,106824
I am pleased to report that the U.S. has made substantial progress in our trade talks with China on important structural issues including intellectual property protection technology transfer agriculture services currency and many other issues. As a result of these very......,2/24/19,22514,111030
So funny to watch people who have failed for years they got NOTHING telling me how to negotiate with North Korea. But thanks anyway!,2/24/19,36087,163071
The only Collusion with the Russians was with Crooked Hillary Clinton and the Democratic National Committee...And where’s the Server that the DNC refused to give to the FBI?  Where are the new Texts between Agent Lisa Page and her Agent lover Peter S? We want them now!,2/24/19,35109,136164
93% Approval Rating in the Republican Party. 52% Approval Rating overall! Not bad considering I get the most unfair (BAD) press in the history of presidential politics! And don’t forget the Witch Hunt!,2/24/19,37781,176378
Poll: Suburban women are coming back into the Republican Party in droves “because of the Wall and Border Security. 70% support Border Security and the Wall.” Not believing the Walls are immoral line. Beverly Hallberg Independent Women’s Forum @KatiePavlich  A great USA issue!,2/24/19,24467,111293
Chairman Kim realizes perhaps better than anyone else that without nuclear weapons his country could fast become one of the great economic powers anywhere in the World. Because of its location and people (and him) it has more potential for rapid growth than any other nation!,2/24/19,16960,77534
President Xi of China has been very helpful in his support of my meeting with Kim Jong Un. The last thing China wants are large scale nuclear weapons right next door. Sanctions placed on the border by China and Russia have been very helpful. Great relationship with Chairman Kim!,2/24/19,16884,83874
Very productive talks yesterday with China on Trade. Will continue today! I will be leaving for Hanoi Vietnam early tomorrow for a Summit with Kim Jong Un of North Korea where we both expect a continuation of the progress made at first Summit in Singapore. Denuclearization?,2/24/19,18647,93035
HOLD THE DATE! We will be having one of the biggest gatherings in the history of Washington D.C. on July 4th. It will be called “A Salute To America” and will be held at the Lincoln Memorial. Major fireworks display entertainment and an address by your favorite President me!,2/24/19,45512,203526
So great being with you both in the Oval Office! https://t.co/9VoIV3NahE,2/24/19,24577,120849
“There’s not one shred of evidence that this president’s done anything Constitutionally (or anything else) wrong.” Graham Ledger.  Thank you Graham so true!,2/24/19,27512,133240
The people of Venezuela stand at the threshold of history ready to reclaim their country – and their future.... https://t.co/ajxd1EN64c,2/23/19,33036,107205
There is far more ENERGY on the Right than there is on the Left. That’s why we just won the Senate and why we will win big in 2020. The Fake News just doesn’t want to report the facts. Border Security is a big factor. The under construction Wall will stop Gangs Drugs and Crime!,2/23/19,28101,121704
God Bless the people of Venezuela!,2/23/19,59854,205587
