text,created_at,retweet_count,favorite_count
Without a Wall our Country can never have Border or National Security. With a powerful Wall or Steel Barrier Crime Rates (and Drugs) will go substantially down all over the U.S. The Dems know this but want to play political games. Must finally be done correctly. No Cave!,1/22/19,24644,106491
“The Democrats are playing politics with Border Security.”  @foxandfriends,1/22/19,16540,78953
Nick Sandmann and the students of Covington have become symbols of Fake News and how evil it can be. They have captivated the attention of the world and I know they will use it for the good - maybe even to bring people together. It started off unpleasant but can end in a dream!,1/22/19,38014,162047
Looking like Nick Sandman &amp; Covington Catholic students were treated unfairly with early judgements proving out to be false - smeared by media. Not good but making big comeback! “New footage shows that media was wrong about teen’s encounter with Native American” @TuckerCarlson,1/22/19,43866,166276
Democrats are kidding themselves (they don’t really believe it!) if they say you can stop Crime Drugs Human Trafficking and Caravans without a Wall or Steel Barrier. Stop playing games and give America the Security it deserves. A Humanitarian Crisis!,1/21/19,36667,161116
Four people in Nevada viciously robbed and killed by an illegal immigrant who should not have been in our Country. 26 people killed on the Border in a drug and gang related fight. Two large Caravans from Honduras broke into Mexico and are headed our way. We need a powerful Wall!,1/21/19,40389,153112
If Nancy Pelosi thinks that Walls are “immoral” why isn’t she requesting that we take down all of the existing Walls between the U.S. and Mexico even the new ones just built in San Diego at their very strong urging. Let millions of unchecked “strangers” just flow into the U.S.,1/21/19,29631,128855
China posts slowest economic numbers since 1990 due to U.S. trade tensions and new policies. Makes so much sense for China to finally do a Real Deal and stop playing around!,1/21/19,20519,100978
Today it was my great honor to visit the Martin Luther King Jr. Memorial with @VP Mike Pence in honor of #MLKDay https://t.co/YsDEA3kygd,1/21/19,19885,98554
Democrats campaigned on working within Washington and “getting things done!” How is that working out? #2020TAKEBACKTHEHOUSE,1/21/19,23843,93823
Today we celebrate Dr. Martin Luther King Jr. for standing up for the self-evident truth Americans hold so dear that no matter what the color of our skin or the place of our birth we are all created equal by God. #MLKDay https://t.co/pEaVpCB8M4,1/21/19,23194,101651
Last year was the best year for American Manufacturing job growth since 1997 or 21 years. The previous administration said manufacturing will not come back to the U.S. “you would need a magic wand.” I guess I found the MAGIC WAND - and it is only getting better!,1/21/19,26899,113479
“No President in modern times has kept more promises than Donald Trump!” Thank you Bill Bennett @SteveHiltonx,1/21/19,19810,100028
Curt Schilling deserves to be in the Baseball Hall of Fame. Great record especially when under pressure and when it mattered most. Do what everyone in Baseball knows is right! @marklevinshow,1/21/19,14383,78360
Congratulations to Bob Kraft Bill Belichick Tom Brady and the entire New England Patriots team on a great game and season. Will be a fantastic Super Bowl!,1/21/19,22086,124234
To all of the great people who are working so hard for your Country and not getting paid I say THANK YOU - YOU ARE GREAT PATRIOTS! We must now work together after decades of abuse to finally fix the Humanitarian Criminal &amp; Drug Crisis at our Border. WE WILL WIN BIG!,1/21/19,39614,190695
A truly great First Lady who doesn’t get the credit she deserves! https://t.co/Wc9bYtoLKq,1/21/19,30114,164293
Thanks James! https://t.co/iTdCEEiiRv,1/21/19,20850,94304
Will do a fantastic job! https://t.co/YkcenJhzsK,1/21/19,8097,39465
https://t.co/yQkCrpooIT,1/20/19,26653,91174
The Media is not giving us credit for the tremendous progress we have made with North Korea. Think of where we were at the end of the Obama Administration compared to now. Great meeting this week with top Reps. Looking forward to meeting with Chairman Kim at end of February!,1/20/19,23374,102505
Thank you David! https://t.co/zsmNfTjEDR,1/20/19,17319,73726
Don’t forget we are building and renovating big sections of Wall right now. Moving quickly and will cost far less than previous politicians thought possible. Building after all is what I do best even when money is not readily available!,1/20/19,28516,138281
Wow just heard that my poll numbers with Hispanics has gone up 19% to 50%. That is because they know the Border issue better than anyone and they want Security which can only be gotten with a Wall.,1/20/19,34445,160643
Nancy I am still thinking about the State of the Union speech there are so many options - including doing it as per your written offer (made during the Shutdown security is no problem) and my written acceptance. While a contract is a contract I’ll get back to you soon!,1/20/19,21950,101326
Nancy Pelosi has behaved so irrationally &amp; has gone so far to the left that she has now officially become a Radical Democrat. She is so petrified of the “lefties” in her party that she has lost control...And by the way clean up the streets in San Francisco they are disgusting!,1/20/19,41539,162528
No Amnesty is not a part of my offer. It is a 3 year extension of DACA. Amnesty will be used only on a much bigger deal whether on immigration or something else. Likewise there will be no big push to remove the 11000000 plus people who are here illegally-but be careful Nancy!,1/20/19,22734,94501
Nancy Pelosi and some of the Democrats turned down my offer yesterday before I even got up to speak. They don’t see crime &amp; drugs they only see 2020 - which they are not going to win. Best economy! They should do the right thing for the Country &amp; allow people to go back to work.,1/20/19,29386,124486
Be careful and try staying in your house. Large parts of the Country are suffering from  tremendous amounts of snow and near record setting cold. Amazing how big this system is. Wouldn’t be bad to have a little of that good old fashioned Global Warming right now!,1/20/19,28079,127415
Always heard that as President “it’s all about the economy!” Well we have one of the best economies in the history of our Country. Big GDP lowest unemployment companies coming back to the U.S. in BIG numbers great new trade deals happening &amp; more. But LITTLE media mention!,1/20/19,23838,109033
https://t.co/bJ81QkOObW,1/19/19,27222,98271
I will be live from the White House at 4:00 P.M.,1/19/19,21314,111545
Mexico is doing NOTHING to stop the Caravan which is now fully formed and heading to the United States. We stopped the last two - many are still in Mexico but can’t get through our Wall but it takes a lot of Border Agents if there is no Wall. Not easy!,1/19/19,32692,139239
Many people are saying that the Mainstream Media will have a very hard time restoring credibility because of the way they have treated me over the past 3 years (including the election lead-up) as highlighted by the disgraceful Buzzfeed story &amp; the even more disgraceful coverage!,1/19/19,35402,167833
The Economy is one of the best in our history with unemployment at a 50 year low and the Stock Market ready to again break a record (set by us many times) - &amp; all you heard yesterday based on a phony story was Impeachment. You want to see a Stock Market Crash Impeach Trump!,1/19/19,26918,116885
.@newtgingrich just stated that there has been no president since Abraham Lincoln who has been treated worse or more unfairly by the media than your favorite President me! At the same time there has been no president who has accomplished more in his first two years in office!,1/19/19,30420,149464
Will be leaving for Dover to be with the families of 4 very special people who lost their lives in service to our Country!,1/19/19,18434,105860
Fake News is truly the ENEMY OF THE PEOPLE!,1/19/19,46042,172399
Remember it was Buzzfeed that released the totally discredited “Dossier” paid for by Crooked Hillary Clinton and the Democrats (as opposition research) on which the entire Russian probe is based! A very sad day for journalism but a great day for our Country!,1/19/19,38231,144494
https://t.co/wjqVvTqeky,1/19/19,19761,74412
Just a son who loves his Dad. Nice! https://t.co/ZI4012Ld7S,1/19/19,28388,114592
I will be making a major announcement concerning the Humanitarian Crisis on our Southern Border and the Shutdown tomorrow afternoon at 3 P.M. live from the @WhiteHouse.,1/18/19,41856,161963
https://t.co/6xciJ0ubp0,1/18/19,20507,77007
AMERICA FIRST!,1/18/19,35734,158534
MAKE AMERICA GREAT AGAIN!,1/18/19,34608,159734
Never seen the Republican Party so unified. No “Cave” on the issue of Border and National Security. A beautiful thing to see especially when you hear the new rhetoric spewing from the mouths of the Democrats who talk Open Border High Taxes and Crime. Stop Criminals &amp; Drugs now!,1/18/19,32531,140217
Kevin Corke @FoxNews “Don’t forget Michael Cohen has already been convicted of perjury and fraud and as recently as this week the Wall Street Journal has suggested that he may have stolen tens of thousands of dollars....”  Lying to reduce his jail time! Watch father-in-law!,1/18/19,20369,83246
Another big Caravan heading our way. Very hard to stop without a Wall!,1/18/19,23788,104105
“It’s the Democrats keeping everything closed.” @JimInhofe  So true!,1/18/19,16689,77689
Why would Nancy Pelosi leave the Country with other Democrats on a seven day excursion when 800000 great people are not getting paid. Also could somebody please explain to Nancy &amp; her “big donors” in wine country that people working on farms (grapes) will have easy access in!,1/18/19,28125,110106
Border rancher: “We’ve found prayer rugs out here. It’s unreal.”  Washington Examiner   People coming across the Southern Border from many countries some of which would be a big surprise.,1/18/19,25898,95083
Gregg Jarrett: “Mueller’s prosecutors knew the “Dossier” was the product of bias and deception.” It was a Fake just like so much news coverage in our Country. Nothing but a Witch Hunt from beginning to end!,1/18/19,29088,118676
“In 2018 alone 20000 illegal aliens with criminal records were apprehended trying to cross the Border and there was a 122% increase in fentanyl being smuggled between ports of entry. Last month alone more than 20000 minors were smuggled into the U.S.” @seanhannity,1/18/19,29868,104448
Thank you to Amy Kremer Women for Trump Co-Founder for doing such a great interview with Martha MacCallum...and by the way women have the lowest unemployment numbers in many decades - at the highest pay ever. Proud of that!,1/18/19,21762,103329
So funny to watch Schumer groveling. He called for the firing of bad cop James Comey many times - UNTIL I FIRED HIM!,1/17/19,32491,146739
The Left has become totally unhinged. They no longer care what is Right for our Countrty!,1/17/19,43617,195656
It is becoming more and more obvious that the Radical Democrats are a Party of open borders and crime. They want nothing to do with the major Humanitarian Crisis on our Southern Border. #2020!,1/16/19,43212,179254
There are now 77 major or significant Walls built around the world with 45 countries planning or building Walls. Over 800 miles of Walls have been built in Europe since only 2015. They have all been recognized as close to 100% successful. Stop the crime at our Southern Border!,1/16/19,47144,187763
Great being with the National Champion Clemson Tigers last night at the White House. Because of the Shutdown I served them massive amounts of Fast Food (I paid) over 1000 hamburgers etc. Within one hour it was all gone. Great guys and big eaters!,1/15/19,28283,165428
Congratulations @ClemsonFB! https://t.co/w8viax0OWY,1/15/19,16513,88812
Why is Nancy Pelosi getting paid when people who are working are not?,1/15/19,50770,213885
Great being with the National Champion Clemson Tigers last night at the White House. Because of the Shutdown I served them massive amounts of Fast Food (I paid) over 1000 hamberders etc. Within one hour it was all gone. Great guys and big eaters!,1/15/19,11161,56829
Polls are now showing that people are beginning to understand the Humanitarian Crisis and Crime at the Border. Numbers are going up fast over 50%. Democrats will soon be known as the Party of Crime. Ridiculous that they don’t want Border Security!,1/15/19,28283,113629
A big new Caravan is heading up to our Southern Border from Honduras. Tell Nancy and Chuck that a drone flying around will not stop them. Only a Wall will work. Only a Wall or Steel Barrier will keep our Country safe! Stop playing political games and end the Shutdown!,1/15/19,30178,117897
Volkswagen will be spending 800 million dollars in Chattanooga Tennessee. They will be making Electric Cars. Congratulations to Chattanooga and Tennessee on a job well done. A big win!,1/15/19,23751,114354
Just announced that Veterans unemployment has reached an 18 year low really good news for our Vets and their families. Will soon be an all time low! Do you think the media will report on this and all of the other great economic news?,1/15/19,25948,119641
The rank and file of the FBI are great people who are disgusted with what they are learning about Lyin’ James Comey and the so-called “leaders” of the FBI. Twelve have been fired or forced to leave. They got caught spying on my campaign and then called it an investigation. Bad!,1/15/19,27189,111263
....I am doing exactly what I pledged to do and what I was elected to do by the citizens of our great Country. Just as I promised I am fighting for YOU!,1/14/19,36237,168050
For decades politicians promised to secure the border fix our trade deals bring back our factories get tough on China move the Embassy to Jerusalem make NATO pay their fair share and so much else - only to do NOTHING (or worse)....,1/14/19,32094,140767
Spoke w/ President Erdogan of Turkey to advise where we stand on all matters including our last two weeks of success in fighting the remnants of ISIS and 20 mile safe zone. Also spoke about economic development between the U.S. &amp; Turkey - great potential to substantially expand!,1/14/19,17783,89579
Getting ready to go on stage at the #AFBF100 in New Orleans - packed house! I will try and match the great game played yesterday by the New Orleans Saints and their incredible QB Drew Brees. People here are very excited by the team. Going on stage now! https://t.co/ytZv0HLYun,1/14/19,12594,63653
https://t.co/w5X8jqvtiS,1/14/19,19494,80338
The Fake News gets crazier and more dishonest every single day. Amazing to watch as certain people covering me and the tremendous success of this administration have truly gone MAD! Their Fake reporting creates anger and disunity. Take two weeks off and come back rested. Chill!,1/14/19,28710,129205
“Dems in Puerto Rico as Shutdown hits day 24.” @foxandfriends,1/14/19,19176,74444
Getting ready to address the Farm Convention today in Nashville Tennessee. Love our farmers love Tennessee - a great combination! See you in a little while.,1/14/19,711,3080
Nancy and Cryin’ Chuck can end the Shutdown in 15 minutes. At this point it has become their and the Democrats fault!,1/14/19,23907,106866
I’ve been waiting all weekend. Democrats must get to work now. Border must be secured!,1/14/19,22202,106458
“Gas prices drop across the United States because President Trump has deregulated Energy and we are now  producing a great deal more oil than ever before.” @foxandfriends  But this is bad news for Russia why would President Trump do such a thing? Thought he worked for Kremlin?,1/14/19,19471,85458
....Border is eventually going to be militarized and defended or the United States as we have known it is going to cease to exist...And Americans will not go gentle into that good night. Patrick Buchanan.  The great people of our Country demand proper Border Security NOW!,1/14/19,33180,132485
The Trump portrait of an unsustainable Border Crisis is dead on. “In the last two years ICE officers made 266000 arrests of aliens with Criminal Records including those charged or convicted of 100000 assaults 30000 sex crimes &amp; 4000 violent killings.” America’s Southern....,1/14/19,21646,81412
Best line in the Elizabeth Warren beer catastrophe is to her husband “Thank you for being here. I’m glad you’re here” It’s their house he’s supposed to be there!,1/14/19,27230,138159
If Elizabeth Warren often referred to by me as Pocahontas did this commercial from Bighorn or Wounded Knee instead of her kitchen with her husband dressed in full Indian garb it would have been a smash! https://t.co/D5KWr8EPan,1/14/19,21358,98727
If Elizabeth Warren often referred to by me as Pocahontas did this commercial from Bighorn or Wounded Knee instead of her kitchen with her husband dressed in full Indian garb it would have been a smash! https://t.co/paf1CvesBa,1/14/19,7831,30764
So sorry to hear the news about Jeff Bozo being taken down by a competitor whose reporting I understand is far more accurate than the reporting in his lobbyist newspaper the Amazon Washington Post. Hopefully the paper will soon be placed in better &amp; more responsible hands!,1/14/19,22538,105739
....Likewise do not want the Kurds to provoke Turkey. Russia Iran and Syria have been the biggest beneficiaries of the long term U.S. policy of destroying ISIS in Syria - natural enemies. We also benefit but it is now time to bring our troops back home. Stop the ENDLESS WARS!,1/13/19,20677,91899
Starting the long overdue pullout from Syria while hitting the little remaining ISIS territorial caliphate hard and from many directions. Will attack again from existing nearby base if it reforms. Will devastate Turkey economically if they hit Kurds. Create 20 mile safe zone....,1/13/19,29222,119839
Wish I could share with everyone the beauty and majesty of being in the White House and looking outside at the snow filled lawns and Rose Garden. Really is something - SPECIAL COUNTRY SPECIAL PLACE!,1/13/19,32115,186443
Thousands of illegal aliens who have committed sexual crimes against children are right now in Texas prisons. Most came through our Southern Border. We can end this easily - We need a Steel Barrier or Wall. Walls Work! John Jones Texas Department of Public Safety.  @FoxNews,1/13/19,29084,116225
The damage done to our Country from a badly broken Border - Drugs Crime and so much that is bad - is far greater than a Shutdown which the Dems can easily fix as soon as they come back to Washington!,1/13/19,28995,130259
I’m in the White House waiting. The Democrats are everywhere but Washington as people await their pay. They are having fun and not even talking!,1/13/19,28838,115626
The building of the Wall on the Southern Border will bring down the crime rate throughout the entire Country!,1/13/19,23972,113051
Democrats are saying that DACA is not worth it and don’t want to include in talks. Many Hispanics will be coming over to the Republican side watch!,1/13/19,25815,103285
I will be interviewed by Jeanine Pirro at 9:00 P.M. on @FoxNews. Watch @JesseBWatters before and @greggutfeld after. All terrific people. I am in the White House waiting for Cryin’ Chuck and Nancy to call so we can start helping our Country both at the Border and from within!,1/13/19,20078,102802
https://t.co/3IH1yW2eTg,1/12/19,26493,104869
We have a massive Humanitarian Crisis at our Southern Border. We will be out for a long time unless the Democrats come back from their “vacations” and get back to work. I am in the White House ready to sign!,1/12/19,28316,117777
....I do have a plan on the Shutdown. But to understand that plan you would have to understand the fact that I won the election and I promised safety and security for the American people. Part of that promise was a Wall at the Southern Border. Elections have consequences!,1/12/19,41234,182846
I just watched a Fake reporter from the Amazon Washington Post say the White House is “chaotic there does not seem to be a strategy for this Shutdown. There is no plan.” The Fakes always like talking Chaos there is NONE. In fact there’s almost nobody in the W.H. but me and...,1/12/19,23082,105970
Democrats could solve the Shutdown in 15 minutes! Call your Dem Senator or Congresswoman/man. Tell them to get it done! Humanitarian Crisis.,1/12/19,26227,111933
23% of Federal inmates are illegal immigrants. Border arrests are up 240%. In the Great State of Texas between 2011 &amp; 2018 there were a total of 292000 crimes by illegal aliens 539 murders 32000 assaults 3426 sexual assaults and 3000 weapons charges. Democrats come back!,1/12/19,30482,102797
Democrats should come back to Washington and work to end the Shutdown while at the same time ending the horrible humanitarian crisis at our Southern Border. I am in the White House waiting for you!,1/12/19,24113,102061
Lyin’ James Comey Andrew McCabe Peter S and his lover agent Lisa Page &amp; more all disgraced and/or fired and caught in the act. These are just some of the losers that tried to do a number on your President. Part of the Witch Hunt. Remember the “insurance policy?” This is it!,1/12/19,27269,110175
I have been FAR tougher on Russia than Obama Bush or Clinton. Maybe tougher than any other President. At the same time &amp; as I have often said getting along with Russia is a good thing not a bad thing. I fully expect that someday we will have good relations with Russia again!,1/12/19,20503,100231
.....who is being totally protected by his best friend Bob Mueller &amp; the 13 Angry Democrats - leaking machines who have NO interest in going after the Real Collusion (and much more) by Crooked Hillary Clinton her Campaign and the Democratic National Committee. Just Watch!,1/12/19,19477,85444
....the FBI was in complete turmoil (see N.Y. Post) because of Comey’s poor leadership and the way he handled the Clinton mess (not to mention his usurpation of powers from the Justice Department). My firing of James Comey was a great day for America. He was a Crooked Cop......,1/12/19,21913,94976
...Funny thing about James Comey. Everybody wanted him fired Republican and Democrat alike. After the rigged &amp; botched Crooked Hillary investigation where she was interviewed on July 4th Weekend not recorded or sworn in and where she said she didn’t know anything (a lie)....,1/12/19,21529,89295
Wow just learned in the Failing New York Times that the corrupt former leaders of the FBI almost all fired or forced to leave the agency for some very bad reasons opened up an investigation on me for no reason &amp; with no proof after I fired Lyin’ James Comey a total sleaze!,1/12/19,30589,125463
.@CNN called a San Diego news station (@KUSINews) for negative reports on the Wall. When the station said that Walls work CNN no longer had interest. #FakeNews https://t.co/IDyXqmDsPq,1/11/19,29413,94350
Drug prices declined in 2018 the first time in nearly half a century. During the first 19 months of my Administration Americans saved $26 Billion on prescription drugs. Our policies to get cheaper generic drugs to market are working!,1/11/19,25338,115390
I look forward to hosting right out of the great State of South Carolina the 2019 NCAA Football Champion Clemson Tigers at the White House on Monday January 14th. What a game what a coach what a team!,1/11/19,16657,94051
The Fake News Media keeps saying we haven’t built any NEW WALL. Below is a section just completed on the Border. Anti-climbing feature included. Very high strong and beautiful! Also many miles already renovated and in service! https://t.co/UAAGXl5Byr,1/11/19,29454,106690
...The Steel Barrier or Wall should have been built by previous administrations long ago. They never got it done - I will. Without it our Country cannot be safe. Criminals Gangs Human Traffickers Drugs &amp; so much other big trouble can easily pour in. It can be stopped cold!,1/11/19,32648,142836
Humanitarian Crisis at our Southern Border. I just got back and it is a far worse situation than almost anyone would understand an invasion! I have been there numerous times - The Democrats Cryin’ Chuck and Nancy don’t know how bad and dangerous it is for our ENTIRE COUNTRY....,1/11/19,30463,130060
H1-B holders in the United States can rest assured that changes are soon coming which will bring both simplicity and certainty to your stay including a potential path to citizenship. We want to encourage talented and highly skilled people to pursue career options in the U.S.,1/11/19,30969,133923
I often said during rallies with little variation that “Mexico will pay for the Wall.” We have just signed a great new Trade Deal with Mexico. It is Billions of Dollars a year better than the very bad NAFTA deal which it replaces. The difference pays for Wall many times over!,1/11/19,28752,129907
When I took the Oath of Office.... https://t.co/GDhIqteKpv,1/11/19,28602,102790
We lose 300 Americans a week 90% of which comes through the Southern Border. These numbers will be DRASTICALLY REDUCED if we have a Wall!,1/11/19,24715,115417
Will be interviewed at the Border by @seanhannity on @FoxNews tonight at 9:00. Enjoy!,1/11/19,11518,67631
Dear Diary... https://t.co/NAuMaQW6fl,1/11/19,45849,177910
From the Southern Border.... https://t.co/Vgsf5nEZUH,1/10/19,33539,129711
