text,created_at,retweet_count,favorite_count
Georgia Secretary of State Brian Kemp will be a great governor. He has been successful at whatever he has done and has prepared for this very difficult and complex job for many years. He has my Strong Endorsement. His opponent is totally unqualified. Would destroy a great state!,10/20/18,17070,66334
If the Democrats would stop being obstructionists and come together we could write up and agree to new immigration laws in less than one hour. Look at the needless  pain and suffering that they are causing. Look at the horrors taking place on the Border. Chuck &amp; Nancy call me!,10/20/18,32030,110699
Beautiful evening in Mesa Arizona with GREAT PATRIOTS - thank you! https://t.co/0pWiwCq4MH #MAGARally🇺🇸replay: https://t.co/6vHEaB37VH https://t.co/pHmU6pMKh7,10/20/18,11754,50064
This was outside of the massive totally full hangar tonight in Mesa Arizona! https://t.co/0pWiwCq4MH #MAGA🇺🇸 https://t.co/7mx98y515I,10/20/18,24115,91331
On my way - see you all shortly! https://t.co/0pWiwCq4MH https://t.co/ahDmLiwPZi,10/20/18,11615,54655
WOW - Mesa Arizona! Look forward to joining everyone soon. Something’s happening!! #MAGA🇺🇸 https://t.co/z6LNGYoICO,10/20/18,16335,67517
This is what it is all about for the Republican Party! #JobsNotMobs https://t.co/8OabccPec5,10/19/18,23141,84582
#JobsNotMobs! https://t.co/U1suRW5j6G,10/19/18,21237,73712
Beto O’Rourke is a total lightweight compared to Ted Cruz and he comes nowhere near representing the values and desires of the people of the Great State of Texas. He will never be allowed to turn Texas into Venezuela!,10/19/18,27178,99454
Secretary of State Mike Pompeo was never given or shown a Transcript or Video of the Saudi Consulate event. FAKE NEWS!,10/19/18,32297,80294
When referring to the USA I will always capitalize the word Country!,10/19/18,19967,108497
Congressman Andy Biggs is doing a great job for Arizona and our Country! https://t.co/V561vXRpzx,10/19/18,11308,46774
#JobsNotMobs!,10/19/18,29518,99009
Jon Tester says one thing to voters and does the EXACT OPPOSITE in Washington. Tester takes his orders form Pelosi &amp; Schumer. Tester wants to raise your taxes take away your 2A open your borders and deliver MOB RULE. Retire Tester &amp; Elect America-First Patriot Matt Rosendale!,10/19/18,22422,77524
Thank you Missoula Montana. Get out and VOTE for @MattForMontana and @GregForMontana!! #MAGA🇺🇸https://t.co/6XgaceUu1e https://t.co/nEndInSOhw,10/19/18,11691,46496
The only thing keeping Tester alive is he has millions and millions of dollars from outside liberals and leftists who couldn’t care less about our Country!,10/19/18,17698,70271
Will be landing soon. Looking forward to seeing our next Senator from Montana Matt Rosendale. He will represent our Country well far better than Jon Tester who will vote with Cryin’ Chuck Schumer and Nancy Pelosi - never with us!,10/19/18,13560,62640
Prime Minister @AbeShinzo of Japan has been working with me to help balance out the one-sided Trade with Japan. These are some of the investments they are making in our Country - just the beginning! https://t.co/ib2yB3Akkt,10/18/18,14243,49094
Thank you Mexico we look forward to working with you! https://t.co/wf7sE0DHFT,10/18/18,22170,79234
Look forward to being there. Something’s happening! #MAGA https://t.co/Cev7giQexE,10/18/18,13930,53314
Can you believe this and what Democrats are allowing to be done to our Country? https://t.co/4aDpASkjIU,10/18/18,26523,68403
All Republicans support people with pre-existing conditions and if they don’t they will after I speak to them. I am in total support. Also Democrats will destroy your Medicare and I will keep it healthy and well!,10/18/18,28187,100413
See you tonight Missoula Montana! #MAGARally🇺🇸https://t.co/2HZ66y4BS7,10/18/18,9772,41583
.@StateDept @SecPompeo outside of the West Wing after our meeting this morning in the Oval Office... https://t.co/4GrmMdOhS1,10/18/18,8768,36030
Secretary of State Mike Pompeo returned last night from Saudi Arabia and Turkey. I met with him this morning wherein the Saudi situation was discussed in great detail including his meeting with...,10/18/18,9078,44145
...the Crown Prince. He is waiting for the results of the investigations being done by the Saudis and Turkey and just gave a news conference to that effect.,10/18/18,7626,37354
Congressman @DaveBratVA7th is one of the hardest working and smartest people in Washington. He is strong on the Border Crime the Military our Vets and the 2nd Amendment. He is a powerful vote for MAGA and loves the Great State of Virginia. Dave has my Total Endorsement!,10/18/18,13909,54007
....The assault on our country at our Southern Border including the Criminal elements and DRUGS pouring in is far more important to me as President than Trade or the USMCA. Hopefully Mexico will stop this onslaught at their Northern Border. All Democrats fault for weak laws!,10/18/18,24107,90065
....In addition to stopping all payments to these countries which seem to have almost no control over their population I must in the strongest of terms ask Mexico to stop this onslaught - and if unable to do so I will call up the U.S. Military and CLOSE OUR SOUTHERN BORDER!..,10/18/18,39817,150942
I am watching the Democrat Party led (because they want Open Borders and existing weak laws) assault on our country by Guatemala Honduras and El Salvador whose leaders are doing little to stop this large flow of people INCLUDING MANY CRIMINALS from entering Mexico to U.S.....,10/18/18,23266,85238
Ever since his vicious and totally false statements about Admiral Ron Jackson the highly respected White House Doctor for Obama Bush &amp; me Senator John Tester looks to be in big trouble in the Great State of Montana! He behaved worse than the Democrat Mob did with Justice K!,10/18/18,23979,89908
This afternoon it was my great honor to present @USMC Sergeant Major John Canley the Medal of Honor in the East Room of the @WhiteHouse! https://t.co/EI1DD4AkC9 https://t.co/6JJm1SRcQ9,10/17/18,11683,56327
Congressman Neal Dunn (@DunnCampaign) of Florida has done an outstanding job at everything having to do with #MAGA. Now working hard on hurricane relief and rebuild. Strong on Crime strong on Borders loves our Military and our Vets. Neal has my highest Endorsement!,10/17/18,12253,47578
College educated women want safety security and healthcare protections – very much along with financial and economic health for themselves and our Country. I supply all of this far better than any Democrat (for decades actually). That’s why they will be voting for me!,10/17/18,22981,101102
https://t.co/mNkDYgu5sr,10/17/18,9506,38114
https://t.co/MadlgNheSe,10/17/18,8571,34457
https://t.co/CMxxW2fEDq,10/17/18,10806,39554
https://t.co/afqHydsMB5,10/17/18,8307,34063
“President Donald J. Trump is Following Through on His Promise to Cut Burdensome Red Tape and Unleash the American Economy”Read more: https://t.co/SrBaQzpq4E https://t.co/zF8fEsw3in,10/17/18,8878,35943
Republicans must make the horrendous weak and outdated immigration laws and the Border a part of the Midterms!,10/17/18,17319,66398
Hard to believe that with thousands of people from South of the Border walking unimpeded toward our country in the form of large Caravans that the Democrats won’t approve legislation that will allow laws for the protection of our country. Great Midterm issue for Republicans!,10/17/18,25401,85614
“Network News gave Zero coverage to the Big Day the Stock Market had yesterday.” @foxandfriends,10/17/18,14039,58839
August job openings hit a record 7.14 million. Congratulations USA!,10/17/18,16936,75826
AP headline was very different from my quote and meaning in the story. They just can’t help themselves. FAKE NEWS!,10/17/18,13921,59262
Ted Cruz has done so much for Texas including massive cuts in taxes and regulations - which has brought Texas to the best jobs numbers in the history of the state. He watches carefully over your 2nd Amendment. O’Rourke would blow it all! Ted has long had my Strong Endorsement!,10/17/18,20115,80076
Watched the debate last night &amp; Beto O’Rourke who wants higher taxes and far more regulations is not in the same league with Ted Cruz &amp; what the great people of Texas stand for &amp; want. Ted is strong on Crime Border &amp; 2nd A loves our Military Vets Low Taxes. Beto is a Flake!,10/17/18,20321,78161
“Trump could be the most honest president in modern history. When you look at the real barometer of presidential truthfulness which is promise keeping he is probably the most honest president in American history. He’s done exactly what he said he would do.” Marc Thiessen WPost,10/17/18,22603,87996
Stock Market up 548 points today. Also GREAT jobs numbers!,10/17/18,13600,70215
Elizabeth Warren is being hammered even by the Left. Her false claim of Indian heritage is only selling to VERY LOW I.Q. individuals!,10/17/18,20544,91859
Anybody entering the United States illegally will be arrested and detained prior to being sent back to their country!,10/17/18,42553,170768
We have today informed the countries of Honduras Guatemala and El Salvador that if they allow their citizens or others to journey through their borders and up to the United States with the intention of entering our country illegally all payments made to them will STOP (END)!,10/17/18,36164,134998
I will be interviewed tonight by Trish Regan on @FoxBusiness at 8:00 P.M. right after the great Lou Dobbs!,10/16/18,8215,44908
WOW John James is making headway in Michigan. We are bringing jobs back to the State and the People of Michigan appreciate it. Debbie Stabenow has been no help if anything a major hindrance. John James is a star I hope the voters see it. Polls are tightening!,10/16/18,27033,97159
...during the call and told me that he has already started and will rapidly expand a full and complete investigation into this matter. Answers will be forthcoming shortly.,10/16/18,10273,44451
Just spoke with the Crown Prince of Saudi Arabia who totally denied any knowledge of what took place in their Turkish Consulate. He was with Secretary of State Mike Pompeo...,10/16/18,13828,52922
REGISTER TO https://t.co/0pWiwCHGbh! #MAGA🇺🇸 https://t.co/ACTMe53TZU,10/16/18,12848,43910
Is it really possible that Bruce Ohr whose wife Nellie was paid by Simpson and GPS Fusion for work done on the Fake Dossier and who was used as a Pawn in this whole SCAM (WITCH HUNT) is still working for the Department of Justice????? Can this really be so?????,10/16/18,24807,82900
“Conflict between Glen Simpson’s testimony to another House Panel about his contact with Justice Department official Bruce Ohr. Ohr was used by Simpson and Steele as a Back Channel to get (FAKE) Dossier to FBI. Simpson pleading Fifth.” Catherine Herridge. Where is Jeff Sessions?,10/16/18,12973,46688
“Federal Judge throws out Stormy Danials lawsuit versus Trump. Trump is entitled to full legal fees.” @FoxNews Great now I can go after Horseface and her 3rd rate lawyer in the Great State of Texas. She will confirm the letter she signed! She knows nothing about me a total con!,10/16/18,28414,122638
Incredible number just out 7036000 job openings. Astonishing - it’s all working! Stock Market up big on tremendous potential of USA. Also Strong Profits. We are Number One in World by far!,10/16/18,22836,89441
For the record I have no financial interests in Saudi Arabia (or Russia for that matter). Any suggestion that I have is just more FAKE NEWS (of which there is plenty)!,10/16/18,20394,77598
“8X more new manufacturing jobs now than with Obama.” @FoxNews  @cvpayne,10/16/18,15776,68976
The United States has strongly informed the President of Honduras that if the large Caravan of people heading to the U.S. is not stopped and brought back to Honduras no more money or aid will be given to Honduras effective immediately!,10/16/18,42070,143613
“Op-Ed praises Trump Administrations efforts at the Border.” @FoxNews  The  Washington Examiner States “Finally the government has taken steps to stop releasing unaccompanied minors to criminals and traffickers.” This was done by the Obama Administration!,10/16/18,13410,52994
Thank you to the Cherokee Nation for revealing that Elizabeth Warren sometimes referred to as Pocahontas is a complete and total Fraud!,10/16/18,29846,122783
Now that her claims of being of Indian heritage have turned out to be a scam and a lie Elizabeth Warren should apologize for perpetrating this fraud against the American Public. Harvard called her “a person of color” (amazing con) and would not have taken her otherwise!,10/16/18,22831,91857
Pocahontas (the bad version) sometimes referred to as Elizabeth Warren is getting slammed. She took a bogus DNA test and it showed that she may be 1/1024 far less than the average American. Now Cherokee Nation denies her “DNA test is useless.” Even they don’t want her. Phony!,10/16/18,28140,121754
TOGETHER WE WILL PREVAIL! https://t.co/C1TLMVkDmt,10/16/18,18861,85114
Open enrollment starts today on lower-priced Medicare Advantage plans so loved by our great seniors. Crazy Bernie and his band of Congressional Dems will outlaw these plans. Disaster!,10/15/18,20232,76165
Just arrived in Florida. Also thinking about our GREAT Alabama farmers and our many friends in North and South Carolina today. We are with you!,10/15/18,12979,71582
On our way to Florida and Georgia!,10/15/18,9396,64737
Just spoke to the King of Saudi Arabia who denies any knowledge of whatever may have happened “to our Saudi Arabian citizen.” He said that they are working closely with Turkey to find answer. I am immediately sending our Secretary of State to meet with King!,10/15/18,21273,83290
Will be leaving for Florida and Georgia with the First Lady to tour the hurricane damage and visit with FEMA First Responders and Law Enforcement. Maximum effort is taking place everyone is working very hard. Worst hit in 50 years!,10/15/18,11710,62217
The crowds at my Rallies are far bigger than they have ever been before including the 2016 election. Never an empty seat in these large venues many thousands of people watching screens outside. Enthusiasm &amp; Spirit is through the roof. SOMETHING BIG IS HAPPENING - WATCH!,10/15/18,28046,117484
“The only way to shut down the Democrats new Mob Rule strategy is to stop them cold at the Ballot Box. The fight for America’s future is never over!” Ben Shapiro,10/15/18,26942,100364
Thank you to NBC for the correction! https://t.co/L2mX3vREOl,10/14/18,18641,77749
Thank you! https://t.co/CrExOML9Mi,10/14/18,15753,74452
I will be interviewed on “60 Minutes” tonight at 7:00 P.M. after NFL game. Enjoy!,10/14/18,12126,71664
Will be interviewed tonight by @LesleyRStahl on @60Minutes @CBSNews at 7:30 P.M. Eastern. Enjoy! https://t.co/eUTAP0u0Uh,10/14/18,3645,14066
Princess Eugenie of York was a truly beautiful bride yesterday. She has been through so much and has come out a total winner!,10/14/18,10345,70726
NBC News has totally and purposely changed the point and  meaning of my story about General Robert E Lee and General Ulysses Grant. Was actually a shoutout to warrior Grant and the great state in which he was born. As usual dishonest reporting. Even mainstream media embarrassed!,10/14/18,30920,117653
Congratulations to Tucker Carlson on the great success of his book “Ship of Fools.” It just went to NUMBER ONE!,10/14/18,20295,100420
Big day! Pastor Andrew Brunson who could have spent 35 years in a Turkish prison was returned safely home to his family today. Met in Oval Office great people! Then off to Kentucky for a Rally for Congressman Andy Barr. Tremendous crowd &amp; spirit! Just returned to White House.,10/14/18,16885,87639
Thank you Kentucky! #MAGA🇺🇸https://t.co/iCUqrQ91gF https://t.co/xwsa1S2dIU,10/14/18,12754,55710
On my way to Richmond Kentucky for a MAKE AMERICA GREAT AGAIN rally at 7:00pmE. The crowds are once again massive. See everyone in a couple of hours! #MAGA https://t.co/D1FYNgW0nL https://t.co/d0VBFeePLk,10/13/18,9896,46627
WELCOME HOME PASTOR ANDREW BRUNSON! https://t.co/HijeAGU1gy,10/13/18,19823,86481
https://t.co/uIaENHQoPK,10/13/18,11524,50809
Heading to the Great State of Kentucky - Big Rally for Congressman Andy Barr - Fantastic guy need his vote for MAGA! Strong on Crime Tax Cuts Military Vets &amp; 2nd A. His opponent will NEVER vote for us only for Pelosi. Andy has my Strongest Endorsement!!! See you in Kentucky.,10/13/18,15940,72264
Highly respected Congressman Keith Rothfus (R) of Pennsylvania is in the fight of his life because the Dems changed the District Map. He must win. Strong on crime borders big tax &amp; reg cuts Military &amp; Vets. Opponent Lamb a Pelosi puppet-weak on crime. BIG ENDORSEMENT FOR KEITH,10/13/18,26519,91501
“From a Turkish prison to the White House in 24 hours.”  Kristin Fisher of @FoxNews   Very cool!,10/13/18,14849,73661
There was NO DEAL made with Turkey for the release and return of Pastor Andrew Brunson. I don’t make deals for hostages. There was however great appreciation on behalf of the United States which will lead to good perhaps great relations between the United States &amp; Turkey!,10/13/18,24261,101249
Pastor Andrew Brunson released by Turkey will be with me in the Oval Office at 2:30 P.M. (this afternoon). It will be wonderful to see and meet him. He is a great Christian who has been through such a tough experience. I would like to thank President @RT_Erdogan for his help!,10/13/18,16916,75130
Happy 243rd Birthday to our GREAT @USNavy! #243NavyBday https://t.co/m1YtoKSHFw,10/13/18,12713,57185
Beautiful MAKE AMERICA GREAT AGAIN rally in Lebanon Ohio. Thank you! #ICYMI watch here: https://t.co/UGQAmARPKR https://t.co/6nsoV8yTx3,10/13/18,10638,48028
The GREAT football (and lacrosse) player Jim Brown outside the West Wing of the @WhiteHouse. He is also a tremendous man and mentor to many young people! https://t.co/yo7MxoGL6C,10/12/18,21564,87883
https://t.co/HHTwwbuKa2,10/12/18,10396,45161
Happy #NationalFarmersDay! With the recent #USMCA our GREAT FARMERS will do better than ever before!! https://t.co/PMS4z2EScY,10/12/18,8398,38336
Don’t miss our GREAT @FLOTUS Melania on @ABC @ABC2020 tonight at 10pmE. Enjoy!,10/12/18,11251,57063
People have no idea how hard Hurricane Michael has hit the great state of Georgia. I will be visiting both Florida and Georgia early next week. We are working very hard on every area and every state that was hit - we are with you!,10/12/18,16976,82790
PROMISES MADE PROMISES KEPT! https://t.co/2lk8Fjspe4,10/12/18,18566,60597
REGISTER TO VOTE! https://t.co/0pWiwCHGbh https://t.co/EOCLoJJ24B,10/12/18,13815,43308
PASTOR BRUNSON JUST RELEASED. WILL BE HOME SOON!,10/12/18,27625,125672
My thoughts and prayers are with Pastor Brunson and we hope to have him safely back home soon!,10/12/18,13840,77930
So nice everyone wants Ivanka Trump to be the new United Nations Ambassador. She would be incredible but I can already hear the chants of Nepotism! We have great people that want the job.,10/12/18,14131,76446
Working very hard on Pastor Brunson!,10/12/18,12514,68058
https://t.co/xJ9QYGMJXa,10/11/18,9063,42377
https://t.co/rsxEwbFZht,10/11/18,8973,38898
https://t.co/h47S6T9u8V,10/11/18,8797,39414
Florida Highway Patrol Troopers are all en route to the Panhandle from all across the state of Florida - to help those affected by #HurricaneMichael. If you see them be sure to shake their hands and say THANK YOU! #LESM https://t.co/rB7uNBudY5,10/11/18,18518,83413
Thank you to @FEMA and all First Responders! #HurricaneMichael https://t.co/vwN8BbrkkJ,10/11/18,9842,48376
Thank you Jacksonville Sheriff’s Office! #HurricaneMichael https://t.co/fuy7stLMJI,10/11/18,10402,47413
Massive overflow crowd tonight in Erie Pennsylvania. THANK YOU to everyone who came out and joined us. Together we are MAKING AMERICA GREAT AGAIN! https://t.co/FkPNNVpccX,10/11/18,23802,92539
Thank you Erie Pennsylvania! Remember to get out and VOTE! #MAGA🇺🇸 https://t.co/X8IEW8h9qP,10/11/18,11285,46233
Couldn’t let these great people down. They have been lined up since last night - see you soon Pennsylvania! https://t.co/jSrsmncw85,10/10/18,11788,53981
Departing the @WhiteHouse for Erie Pennsylvania. I cannot disappoint the thousands of people that are there - and the thousands that are going. I look forward to seeing everyone this evening.,10/10/18,14890,80036
We are with you Florida! https://t.co/qzrVLeFbyFhttps://t.co/HVVhSmBg7S https://t.co/rcB6OCwLeH,10/10/18,12172,53793
Despite so many positive events and victories Media Reseach Center reports that 92% of stories on Donald Trump are negative on ABC CBS and ABC. It is FAKE NEWS! Don’t worry the Failing New York Times didn’t even put the Brett Kavanaugh victory on the Front Page yesterday-A17!,10/10/18,25499,93308
Walker Stapleton is running as the highly respected Republican Candidate for Governor of the Great State of Colorado. His credentials and talents are impeccable. He has my complete and total Endorsement!,10/10/18,14545,57022
THANK YOU IOWA &amp; NEBRASKA! VOTE VOTE VOTE! https://t.co/0pWiwCHGbh https://t.co/tzkiQ4IlEd,10/10/18,13172,54312
https://t.co/CPf3oxgdRX,10/10/18,8122,34233
Beautiful evening in Iowa. GOD BLESS THE U.S.A.! #MAGA🇺🇸 https://t.co/Zi0rwyajrz,10/10/18,18514,78472
.@FLGovScott has been relentless in securing the funding to fix the algae problem from Lake Okeechobee - we will solve this! Congress must follow through on the Government’s plan on the Everglades Reservoir. Bill Nelson has been no help!,10/9/18,14657,57361
“President Donald J. Trump Approves Florida Emergency Declaration” https://t.co/TnTDCvs41W,10/9/18,7724,34804
REGISTER TO VOTE! https://t.co/0pWiwCHGbh https://t.co/3vYfDmpqiH,10/9/18,17992,48430
FLORIDA - It is imperative that you heed the directions of your State and Local Officials. Please be prepared be careful and be SAFE! #HurricaneMichael https://t.co/VP6PBXfzm9 https://t.co/aKmaDNgZve,10/9/18,11483,45318
...Looks to be a Cat. 3 which is even more intense than Florence. Good news is the folks in the Pan Handle can take care of anything. @FEMA and First Responders are ready - be prepared! #HurricaneMichael,10/9/18,5960,28349
Hurricane on its way to the Florida Pan Handle with major elements arriving tomorrow. Could also hit in later stage parts of Georgia and unfortunately North Carolina and South Carolina again...,10/9/18,8742,37931
Big announcement with my friend Ambassador Nikki Haley in the Oval Office at 10:30am.,10/9/18,13417,66424
Will be going to Iowa tonight for Rally and more! The Farmers (and all) are very happy with USMCA!,10/9/18,11636,55642
Great evening last night at the White House honoring Justice Kavanaugh and family. Our country is very proud of them!,10/9/18,15959,89845
The paid D.C. protesters are now ready to REALLY protest because they haven’t gotten their checks - in other words they weren’t paid! Screamers in Congress and outside were far too obvious - less professional than anticipated by those paying (or not paying) the bills!,10/9/18,25502,94224
https://t.co/4ySIkmfllE,10/9/18,18081,74171
https://t.co/k2bOxapRtR,10/8/18,15092,58921
Great to see @AGPamBondi launch a cutting-edge statewide school safety APP in Florida today - named by Parkland Survivors. BIG PRIORITY and Florida is getting it done! #FortifyFL,10/8/18,11014,48534
Every day our police officers race into darkened allies deserted streets &amp; onto the doorsteps of the most hardened criminals. They see the worst of humanity &amp; they respond with the best of the American Spirit. America’s LEOs have earned the everlasting gratitude of our Nation! https://t.co/RquS91Vz7o,10/8/18,15026,61252
We thank you. We salute you. We honor you. And we promise you: we will ALWAYS have your BACK – now and FOREVER! #IACP2018 https://t.co/nvUUIuvouj,10/8/18,15246,66208
America’s police officers have earned the everlasting gratitude of our Nation. In moments of danger &amp; despair you are the reason we never lose hope – because there are men &amp; women in uniform who face down evil &amp; stand for all that is GOOD and JUST and DECENT and RIGHT! #IACP2018 https://t.co/N0Dq50DkbP,10/8/18,16053,70979
It was my great honor to address the International Association of Chiefs of Police Annual Convention in Orlando Florida. Thank you! #IACP2018 #LESM https://t.co/Z0nY5bSNr6,10/8/18,9518,44503
Departing Washington D.C. for the International Association of Chiefs of Police Annual Convention in Orlando Florida. Look forward to seeing everyone soon! #IACP2018 https://t.co/EwSd7IU9t1,10/8/18,8270,43063
Christopher Columbus’s spirit of determination &amp; adventure has provided inspiration to generations of Americans. On #ColumbusDay we honor his remarkable accomplishments as a navigator &amp; celebrate his voyage into the unknown expanse of the Atlantic Ocean. https://t.co/Mg3dxRfPuN,10/8/18,19213,76200
.@SecPompeo had a good meeting with Chairman Kim today in Pyongyang. Progress made on Singapore Summit Agreements! I look forward to seeing Chairman Kim again in the near future. https://t.co/bUa2pkq80s,10/7/18,19807,87311
You don’t hand matches to an arsonist and you don’t give power to an angry left-wing mob. Democrats have become too EXTREME and TOO DANGEROUS to govern. Republicans believe in the rule of law - not the rule of the mob. VOTE REPUBLICAN!,10/7/18,67746,228025
Beautiful evening in Topeka Kansas. VOTE VOTE VOTE! #MAGA https://t.co/bomRqsaYfm,10/7/18,15263,69247
Thank you Kansas - I love you! https://t.co/ymCFNr9WQY,10/7/18,15474,73059
