text,created_at,retweet_count,favorite_count
Texas &amp; Louisiana: We are w/ you today we are w/ you tomorrow &amp; we will be w/ you EVERY SINGLE DAY AFTER to restore recover &amp; REBUILD! https://t.co/YQb82K2VSB,8/30/17,27108,99389
Will be leaving for Missouri soon for a speech on tax cuts and tax reform - so badly needed!,8/30/17,14174,83586
After reading the false reporting and even ferocious anger in some dying magazines it makes me wonder WHY? All I want to do is #MAGA!,8/30/17,28527,109867
After witnessing first hand the horror &amp; devastation caused by Hurricane Harveymy heart goes out even more so to the great people of Texas!,8/30/17,24876,118782
The U.S. has been talking to North Korea and paying them extortion money for 25 years. Talking is not the answer!,8/30/17,14522,111271
.@foxandfriends   We are not looking to fill all of those positions. Don't need many of them - reduce size of government. @IngrahamAngle,8/29/17,17234,80437
Leaving now for Texas!,8/29/17,22210,143575
HISTORIC rainfall in Houston and all over Texas. Floods are unprecedented and more rain coming. Spirit of the people is incredible.Thanks!,8/27/17,22608,109527
Major rescue operations underway!,8/27/17,15578,84755
Going to a Cabinet Meeting (tele-conference) at 11:00 A.M. on #Harvey. Even experts have said they've never seen one like this!,8/27/17,11065,54940
We are in the NAFTA (worst trade deal ever made) renegotiation process with Mexico &amp; Canada.Both being very difficultmay have to terminate?,8/27/17,19214,82758
With Mexico being one of the highest crime Nations in the world we must have THE WALL. Mexico will pay for it through reimbursement/other.,8/27/17,26925,103497
Wow - Now experts are calling #Harvey a once in 500 year flood! We have an all out effort going and going well!,8/27/17,13312,62989
I will also be going to a wonderful state Missouri that I won by a lot in '16. Dem C.M. is opposed to big tax cuts. Republican will win S!,8/27/17,12499,68292
I will be going to Texas as soon as that trip can be made without causing disruption. The focus must be life and safety.,8/27/17,22982,112926
Many people are now saying that this is the worst storm/hurricane they have ever seen. Good news is that we have great talent on the ground.,8/27/17,10653,61923
Great coordination between agencies at all levels of government. Continuing rains and flash floods are being dealt with. Thousands rescued.,8/27/17,14243,79142
A great book by a great guy highly recommended! https://t.co/3jbDDN8YmJ,8/27/17,14066,56138
Wonderful coordination between Federal State and Local Governments in the Great State of Texas - TEAMWORK! Record setting rainfall.,8/26/17,18560,93444
THANK YOU to all of the great volunteers helping out with #HurricaneHarvey relief in Texas! https://t.co/Ds95oSgo8f,8/26/17,17056,74246
Closely monitoring #HurricaneHarvey from Camp David. We are leaving nothing to chance. City State and Federal Govs. working great together!,8/26/17,14595,78264
.@ChuckGrassley - got your message loud and clear. We have fantastic people on the ground got there long before #Harvey. So far so good!,8/26/17,11097,56514
You are doing a great job - the world is watching! Be safe. https://t.co/PJLdxy3hD9,8/26/17,8828,47886
We will remain fully engaged w/ open lines of communication as #HurricaneHarvey makes landfall. America is w/ you! @GovAbbott @FEMA @DHSgov https://t.co/PryIqRxgLr,8/26/17,12145,51941
I am pleased to inform you that I have just granted a full Pardon to 85 year old American patriot Sheriff Joe Arpaio. He kept Arizona safe!,8/26/17,35477,149540
At the request of the Governor of Texas I have signed the Disaster Proclamation which unleashes the full force of government help!,8/26/17,29500,140436
Storm turned Hurricane is getting much bigger and more powerful than projected. Federal Government is on site and ready to respond. Be safe!,8/25/17,21047,104230
Just arrived at Camp David where I am monitoring the path and doings of Hurricane Harvey (as it strengthens to a Class 3). 125 MPH winds!,8/25/17,11585,66588
Just arrived at Camp David where I am closely watching the path and doings of Hurricane Harvey as it strengthens to a Category 3. BE SAFE!,8/25/17,10741,61805
I encourage everyone in the path of #HurricaneHarvey to heed the advice &amp; orders of their local and state officials. https://t.co/N6uEWCZUrv,8/25/17,12935,52857
Received a #HurricaneHarvey briefing this morning from Acting @DHSgov Secretary Elaine Duke @FEMA_Brock @TomBossert45 and COS John Kelly. https://t.co/cnkRZd6D6Z,8/25/17,8523,39543
I have spoken w/ @GovAbbott of Texas and @LouisianaGov Edwards. Closely monitoring #HurricaneHarvey developments &amp; here to assist as needed.,8/25/17,12804,59752
Strange statement by Bob Corker considering that he is constantly asking me whether or not he should run again in '18. Tennessee not happy!,8/25/17,14378,62953
"Nick Adams ""Retaking America""  ""Best things of this presidency aren't reported about. Convinced this will be perhaps best presidency ever.""",8/25/17,15734,70475
Few if any Administrations have done more in just 7 months than the Trump A. Bills passed regulations killed border military ISIS SC!,8/25/17,15923,73282
General John Kelly is doing a fantastic job as Chief of Staff. There is tremendous spirit and talent in the W.H. Don't believe the Fake News,8/25/17,18519,86788
If Senate Republicans don't get rid of the Filibuster Rule and go to a 51% majority few bills will be passed. 8 Dems control the Senate!,8/25/17,17757,68559
A GREAT HONOR to spend time with our BRAVE HEROES at the @USMC Air Station Yuma. THANK YOU for your service to the United States of America! https://t.co/4lJ94nxODu,8/25/17,12389,61284
A great honor to spend time with our brave HEROES at the @USMC Air Station Yuma. THANK YOU for your service to the United Staes of America! https://t.co/FUtGBoTJLo,8/24/17,4894,21541
As #HurricaneHarvey intensifies - remember to #PlanAhead. ☑️https://t.co/FMdmvohypy☑️https://t.co/YL56ldeqoW ☑️https://t.co/t1s4AL3B47 https://t.co/tpXmOK70ug,8/24/17,15548,55955
On Tuesday I visited with the incredible men &amp; women of @ICEgov &amp; @DHSgov Border Patrol in Yuma AZ. Thank you. We respect &amp; cherish you! https://t.co/KSQddGqWzJ,8/24/17,12623,57465
The only problem I have with Mitch McConnell is that after hearing Repeal &amp; Replace for 7 years he failed!That should NEVER have happened!,8/24/17,25299,107399
James Clapper who famously got caught lying to Congress is now an authority on Donald Trump. Will he show you his beautiful letter to me?,8/24/17,22501,77757
..(enthusiastic dynamic and fun) and the American Legion - V.A. (respectful and strong). Too bad the Dems have no one who can change tones!,8/24/17,10967,55215
James Clapper who famously got caught lying to Congress is now an authority on Donald Trump. Will he show you his beautiful letter to me?,8/24/17,1027,3409
...(enthusiastic dynamic and fun) and the American Legion - V.A. (respectful and strong). To bad the Dems have no one who can change tones!,8/24/17,1014,4467
The Fake News is now complaining about my different types of back to back speeches. Well there was Afghanistan (somber) the big Rally.....,8/24/17,14865,69995
...(enthusiastic dynamic and fun) and the American Legion - V.A. (respectful and strong).To bad the Dems have no one who can change tones!,8/24/17,1815,7696
The Fake News is now complaining about my different types of back to back speeches. Well their was Afghanistan (somber) the big Rally.....,8/24/17,2763,11091
...didn't do it so now we have a big deal with Dems holding them up (as usual) on Debt Ceiling approval. Could have been so easy-now a mess!,8/24/17,13570,62462
I requested that Mitch M &amp; Paul R tie the Debt Ceiling legislation into the popular V.A. Bill (which just passed) for easy approval. They...,8/24/17,18169,66284
Donald E. Ballard on behalf of the people of the United States THANK YOU for your courageous service. YOU INSPIRE US ALL! #ALConv2017 https://t.co/46m20cJkLB,8/24/17,12692,59518
A great honor to sign the Veterans Appeals Improvement &amp; Modernization Act into law w/ @AmericanLegion @SecShulkin.🎥https://t.co/fr2sf9oRvd https://t.co/bICsRm1tQx,8/23/17,11164,49437
As long as we have faith in each other and confidence in our values then there is no challenge too great for us to conquer! #ALConv2017 https://t.co/tsIAgHbFM7,8/23/17,17285,72958
If Republican Senate doesn't get rid of the Filibuster Rule &amp; go to a simple majority which the Dems would do they are just wasting time!,8/23/17,20059,81165
Last night in Phoenix I read the things from my statements on Charlottesville that the Fake News Media didn't cover fairly. People got it!,8/23/17,19691,91085
Phoenix crowd last night was amazing - a packed house. I love the Great State of Arizona. Not a fan of Jeff Flake weak on crime &amp; border!,8/23/17,20194,96417
MAKE AMERICA GREAT AGAIN! https://t.co/RzePiucV3h,8/23/17,16193,68634
#DrainTheSwamp #PhoenixRally https://t.co/o7S6xoCBiC,8/23/17,11193,51696
Not only does the media give a platform to hate groups but the media turns a blind eye to the gang violence on our streets! https://t.co/Mau0B1qYIP,8/23/17,27775,98412
Thank you Arizona. Beautiful turnout of 15000 in Phoenix tonight! Full coverage of rally via my Facebook at: https://t.co/s0D12EFs40 https://t.co/WT4D9Vsen1,8/23/17,13248,58229
THANK YOU to all of the great men and women at the U.S. Customs and Border Protection facility in Yuma Arizona &amp; around the United States! https://t.co/tjFx8XjhDz,8/23/17,20358,91008
We will push onward to victory w/hope in our hearts courage in our souls &amp; everlasting pride in each &amp; every one of you. God Bless America. https://t.co/44QYFSq07a,8/22/17,16631,70736
See you at 7:00 P.M. tonight Phoenix Arizona! #MAGA🇺🇸Tickets: https://t.co/2kUQfKqbsx https://t.co/1w3LVkpESE,8/22/17,8768,42424
We pray for our fallen heroes who died while serving our country in the @USNavy aboard the  #USSJohnSMcCain and their families. https://t.co/t3kD8qj9Mt,8/22/17,16214,71070
Was with great people last night in Fort Myer Virginia. The future of our country is strong!,8/22/17,15407,90990
Address to the NationFull Video &amp; Transcript:https://t.co/FELdImTuUM https://t.co/6ly3fNatiX,8/22/17,13820,54577
Thank you to the men and women of Fort Myer and every member of the U.S. Military at home and abroad. #USA🇺🇸 https://t.co/ticezYKkhz,8/22/17,15249,75023
Join me live from Fort Myer in Arlington Virginia. ➡️https://t.co/LOV4StdJDj,8/22/17,6161,42590
Thank you the very dishonest Fake News Media is out of control! https://t.co/8J7y900VGK,8/21/17,20686,87097
Jerry Falwell of Liberty University was fantastic on @foxandfriends. The Fake News should listen to what he had to say. Thanks Jerry!,8/21/17,15972,76326
Thoughts &amp; prayers are w/ our @USNavy sailors aboard the #USSJohnSMcCain where search &amp; rescue efforts are underway. https://t.co/DQU0zTRXNU,8/21/17,20975,86029
Heading back to Washington after working hard and watching some of the worst and most dishonest Fake News reporting I have ever seen!,8/20/17,28832,130525
I want to applaud the many protestors in Boston who are speaking out against bigotry and hate. Our country will soon come together as one!,8/19/17,33075,158317
Our great country has been divided for decades. Sometimes you need protest in order to heal &amp; we will heal &amp; be stronger than ever before!,8/19/17,28852,142264
Our great country has been divided for decades. Sometimes you need protest in order to heel &amp; we will heel &amp; be stronger than ever before!,8/19/17,1958,6690
Great job by all law enforcement officers and Boston Mayor @Marty_Walsh.,8/19/17,15167,83507
Looks like many anti-police agitators in Boston. Police are looking tough and smart! Thank you.,8/19/17,25591,124513
Steve Bannon will be a tough and smart new voice at @BreitbartNews...maybe even better than ever before. Fake News needs the competition!,8/19/17,28313,106751
Important day spent at Camp David with our very talented Generals and military leaders. Many decisions made including on Afghanistan.,8/19/17,16128,85976
I want to thank Steve Bannon for his service. He came to the campaign during my run against Crooked Hillary Clinton - it was great! Thanks S,8/19/17,25380,119211
My thoughts and prayers are with the @KissimmeePolice and their loved ones. We are with you!#LESM,8/19/17,21668,95033
Today I signed the Global War on Terrorism War Memorial Act (#HR873.) The bill authorizes....cont➡️https://t.co/c3zIkdtowc https://t.co/re6n0MS0cj,8/19/17,14892,63149
Just returned to Bedminster NJ from Camp David. GREAT meeting on National Security the Border and the Military! #MAGA🇺🇸 https://t.co/Hjmcnnse9j,8/18/17,13916,70122
I have directed that U.S. Cyber Command be elevated to the status of a Unified Combatant Command focused on....cont: https://t.co/3iScfuMw9s,8/18/17,14281,57839
Heading to Camp David for major meeting on National Security the Border and the Military (which we are rapidly building to strongest ever).,8/18/17,16118,87960
Radical Islamic Terrorism must be stopped by whatever means necessary! The courts must give us back our protective rights. Have to be tough!,8/18/17,37669,144838
The Obstructionist Democrats make Security for our country very difficult. They use the courts and associated delay at all times. Must stop!,8/18/17,23407,98841
Homeland Security and law enforcement are on alert &amp; closely watching for any sign of trouble. Our borders are far tougher than ever before!,8/18/17,22669,112560
Study what General Pershing of the United States did to terrorists when caught. There was no more Radical Islamic Terror for 35 years!,8/17/17,30534,110455
The United States condemns the terror attack in Barcelona Spain and will do whatever is necessary to help. Be tough &amp; strong we love you!,8/17/17,66115,222216
...the beauty that is being taken out of our cities towns and parks will be greatly missed and never able to be comparably replaced!,8/17/17,27230,113707
...can't change history but you can learn from it. Robert E Lee Stonewall Jackson - who's next Washington Jefferson? So foolish! Also...,8/17/17,34360,137167
Sad to see the history and culture of our great country being ripped apart with the removal of our beautiful statues and monuments. You.....,8/17/17,34483,135039
Many meetings today in Bedminster including with Secretary Linda M and Small Business. Job numbers are looking great!,8/17/17,11830,66631
Great to see that Dr. Kelli Ward is running against Flake Jeff Flake who is WEAK on borders crime and a non-factor in Senate. He's toxic!,8/17/17,23199,86073
The public is learning (even more so) how dishonest the Fake News is. They totally misrepresent what I say about hate bigotry etc. Shame!,8/17/17,33033,129351
...and people like Ms. Heyer. Such a disgusting lie. He just can't forget his election trouncing.The people of South Carolina will remember!,8/17/17,15262,71481
Publicity seeking Lindsey Graham falsely stated that I said there is moral equivalency between the KKK neo-Nazis &amp; white supremacists......,8/17/17,20156,80998
THANK YOU @MayorGimenez for following the RULE OF LAW! Sanctuary cities make our country LESS SAFE! Full remarks: https://t.co/Kz2EsQ3f1v https://t.co/vD3BB3hyti,8/17/17,15690,64481
Join me at 7:00 P.M. on Tuesday August 22nd in Phoenix Arizona at the Phoenix Convention Center! Tickets at: https://t.co/2kUQfKqbsx https://t.co/5ua74dlVtq,8/17/17,13904,50974
Today in Bedminster I signed the Harry W. Colmery Veterans Educational Assistance Act of 2017 joined by @DeptVetAffairs @SecShulkin. https://t.co/oMUIZ8X7oB,8/16/17,13790,58663
Just landed in Bedminster New Jersey. #MAGA 🎥https://t.co/6EQfmRzrnv,8/16/17,6394,44529
Rather than putting pressure on the businesspeople of the Manufacturing Council &amp; Strategy &amp; Policy Forum I am ending both. Thank you all!,8/16/17,20229,87625
Memorial service today for beautiful and incredible Heather Heyer a truly special young woman. She will be long remembered by all!,8/16/17,17856,96750
Wow Senator Luther Strange picked up a lot of additional support since my endorsement. Now in September runoff. Strong on Wall &amp; Crime!,8/16/17,9986,57932
MAKE AMERICA GREAT AGAIN!,8/16/17,52766,175370
Kim Jong Un of North Korea made a very wise and well reasoned decision. The alternative would have been both catastrophic and unacceptable!,8/16/17,27363,119210
Congratulations John! https://t.co/vhmv7Qoutk,8/16/17,7291,37879
Congratulation to Roy Moore and Luther Strange for being the final two and heading into a September runoff in Alabama. Exciting race!,8/16/17,8973,52183
Amazon is doing great damage to tax paying retailers. Towns cities and states throughout the U.S. are being hurt - many jobs being lost!,8/16/17,18254,70636
For every CEO that drops out of the Manufacturing Council I have many to take their place. Grandstanders should not have gone on. JOBS!,8/15/17,25350,111590
Big day in Alabama. Vote for Luther Strange he will be great!,8/15/17,11425,61099
@foxandfriends According to report just out President Obama knew about Russian interference 3 years ago but he didn't want to anger Russia!,8/15/17,7462,17572
Senator Luther Strange who is doing a great job for the people of Alabama will be on @foxandfriends at 7:15. Tough on crime borders etc.,8/15/17,7983,47827
Feels good to be home after seven months but the White House is very special there is no place like it... and the U.S. is really my home!,8/15/17,20632,122211
Made additional remarks on Charlottesville and realize once again that the #Fake News Media will never be satisfied...truly bad people!,8/14/17,34084,129183
Leaving for New York City and meetings on military purchases and trade.,8/14/17,9402,63273
Big day in Washington D.C. even though White House &amp; Oval Office are being renovated. Great trade deals coming for American workers!,8/14/17,12759,70590
.@Merck Pharma is a leader in higher &amp; higher drug prices while at the same time taking jobs out of the U.S. Bring jobs back &amp; LOWER PRICES!,8/14/17,14503,65851
Now that Ken Frazier of Merck Pharma has resigned from President's Manufacturing Councilhe will have more time to LOWER RIPOFF DRUG PRICES!,8/14/17,22644,94838
The Obstructionist Democrats have given us (or not fixed) some of the worst trade deals in World History. I am changing that fast!,8/14/17,20505,97660
Luther Strange of the Great State of Alabama has my endorsement. He is strong on Border &amp; Wall the military tax cuts &amp; law enforcement.,8/14/17,11474,60284
Heading to Washington this morning. Much work to do. Focus on trade and military. #MAGA,8/14/17,12362,69555
Condolences to the family of the young woman killed today and best regards to all of those injured in Charlottesville Virginia. So sad!,8/12/17,23601,112225
Deepest condolences to the families &amp; fellow officers of the VA State Police who died today. You're all among the best this nation produces.,8/12/17,26774,127578
We will continue to follow developments in Charlottesville and will provide whatever assistance is needed. We are ready willing and able. https://t.co/mCTYBgUePi,8/12/17,15556,68383
We must remember this truth: No matter our color creed religion or political party we are ALL AMERICANS FIRST. https://t.co/FesMiQSKKn,8/12/17,33786,113556
What is vital now is a swift restoration of law and order and the protection of innocent lives.#Charlottesville https://t.co/DB22fgnu6L,8/12/17,17736,69710
Join me live from Bedminster New Jersey: https://t.co/P3cRVvE0cY,8/12/17,5263,32522
Am in Bedminster for meetings &amp; press conference on V.A. &amp; all that we have done and are doing to make it better-but Charlottesville sad!,8/12/17,11471,60599
We ALL must be united &amp; condemn all that hate stands for. There is no place for this kind of violence in America. Lets come together as one!,8/12/17,59652,195440
Press Conference - Following National Security Briefing in Bedminster New Jersey. 🎥https://t.co/v5O8GglOIK https://t.co/H1Zi5XRKEo,8/12/17,11145,49032
As promised on the campaign trail we will provide opportunity for Americans to gain skills needed to succeed &amp; thrive as the economy grows! https://t.co/ZycW4PPcU5,8/11/17,15708,70638
Consumer Comfort Reaches 16-Year High on U.S. Economic Optimism via Bloomberg https://t.co/X6KdszrxsS,8/11/17,11946,52445
We want to make sure that we have the workforce development programs we need to ensure these jobs are.... https://t.co/tyqbvvmBn4,8/11/17,11141,51823
Military solutions are now fully in placelocked and loadedshould North Korea act unwisely.  Hopefully Kim Jong Un will find another path!,8/11/17,60063,176749
Trump approval rebounds to 45% surges among Hispanics union homes men https://t.co/vvJMDv9Gjl,8/10/17,19993,79230
.@IvankaTrump will lead the U.S. delegation to India this fall supporting women’s entrepreneurship globally.#GES2017 @narendramodi,8/10/17,18303,87293
Mitch get back to work and put Repeal &amp; Replace Tax Reform &amp; Cuts and a great Infrastructure Bill on my desk for signing. You can do it!,8/10/17,31253,123211
Can you believe that Mitch McConnell who has screamed Repeal &amp; Replace for 7 years couldn't get it done. Must Repeal &amp; Replace ObamaCare!,8/10/17,24945,106233
#GodBlessTheUSA🇺🇸 https://t.co/Fkq2gJQOKk,8/9/17,22873,84971
"Senator Mitch McConnell said I had ""excessive expectations"" but I don't think so. After 7 years of hearing Repeal &amp; Replace why not done?",8/9/17,31529,122404
...Hopefully we will never have to use this power but there will never be a time that we are not the most powerful nation in the world!,8/9/17,30355,131370
My first order as President was to renovate and modernize our nuclear arsenal. It is now far stronger and more powerful than ever before....,8/9/17,25729,107542
Senator Luther Strange has done a great job representing the people of the Great State of Alabama. He has my complete and total endorsement!,8/9/17,13060,67083
After 200 days rarely has any Administration achieved what we have achieved..not even close! Don't believe the Fake News Suppression Polls!,8/8/17,25703,111343
E-mails show that the AmazonWashingtonPost and the FailingNewYorkTimes were reluctant to cover the Clinton/Lynch secret meeting in plane.,8/8/17,24056,85946
After many years of failurecountries are coming together to  finally address the dangers posed by North Korea. We must be tough &amp; decisive!,8/8/17,24362,110433
I will be holding a major briefing on the Opioid crisis a major problem for our country today at 3:00 P.M. in Bedminster N.J.,8/8/17,14799,72667
I think Senator Blumenthal should take a nice long vacation in Vietnam where he lied about his service so he can at least say he was there,8/7/17,29933,115856
How much longer will the failing nytimes with its big losses and massive unfunded liability (and non-existent sources) remain in business?,8/7/17,17551,82202
The Fake News Media will not talk about the importance of the United Nations Security Council's 15-0 vote in favor of sanctions on N. Korea!,8/7/17,20272,85330
On #PurpleHeartDay💜I thank all the brave men and women who have sacrificed in battle for this GREAT NATION! #USA🇺🇸 https://t.co/QmfdLSLp6p,8/7/17,15769,76310
...conquests how brave he was and it was all a lie. He cried like a baby and begged for forgiveness like a child. Now he judges collusion?,8/7/17,17375,74752
Never in U.S.history has anyone lied or defrauded voters like Senator Richard Blumenthal. He told stories about his Vietnam battles and....,8/7/17,19662,78666
Interesting to watch Senator Richard Blumenthal of Connecticut talking about hoax Russian collusion when he was a  phony Vietnam con artist!,8/7/17,20919,80581
Working hard from New Jersey while White House goes through long planned renovation. Going to New York next week for more meetings.,8/7/17,13164,66731
Hard to believe that with 24/7 #Fake News on CNN ABC NBC CBS NYTIMES &amp; WAPO the Trump base is getting stronger!,8/7/17,17420,74243
... Supreme Court pick economic enthusiasm deregulation &amp; so much more have driven the Trump base even closer together. Will never change!,8/7/17,14447,69591
...and West Virginia. The fact is the Fake News Russian collusion story record Stock Market border security military strength jobs.....,8/7/17,12005,59815
The Trump base is far bigger &amp;  stronger than ever before (despite some phony Fake News polling). Look at rallies in Penn Iowa Ohio.......,8/7/17,19426,90640
The failing @nytimes which has made every wrong prediction about me including my big election win (apologized) is totally inept!,8/7/17,13598,65244
Just completed call with President Moon of South Korea. Very happy and impressed with 15-0 United Nations vote on North Korea sanctions.,8/7/17,20422,100546
The Fake News refuses to report the success of the first 6 months: S.C. surging economy &amp; jobsborder &amp; military securityISIS &amp; MS-13 etc.,8/7/17,23061,95347
MAKE AMERICA GREAT AGAIN! https://t.co/g4ELhh9joH,8/6/17,34426,113900
United Nations Resolution is the single largest economic sanctions package ever on North Korea. Over one billion dollars in cost to N.K.,8/5/17,18347,83987
Thank you Nicole! https://t.co/KlWN05uFOx,8/5/17,10528,52192
After many years of LEAKS going on in Washington it is great to see the A.G. taking action! For National Security the tougher the better!,8/5/17,22371,103975
The United Nations Security Council just voted 15-0 to sanction North Korea. China and Russia voted with us. Very big financial impact!,8/5/17,25763,110129
Working in Bedminster N.J. as long planned construction is being done at the White House. This is not a vacation - meetings and calls!,8/5/17,19955,87982
