text,created_at,retweet_count,favorite_count
@SenateMajLdr @SenateGOP ...and Appeals Court Judges at a record clip! Our courts are rapidly changing for the better!,11/1/17,7193,35005
Thanks to @SenateMajLdr McConnell and the @SenateGOP we are appointing high-quality Federal District...,11/1/17,8476,42572
Thank you to the GREAT NYPD First Responders and all govt officials for having handled the terrible West Side attack so professionally! https://t.co/imPIdOzjAn,11/1/17,12354,57483
@NYGovCuomo @NYCMayor ...fully supports any and all of their efforts with respect to the West Side attack. #NYCStrong,11/1/17,5422,29360
Just spoke with @NYGovCuomo and @NYCMayor de Blasio to let them know that the federal government...,11/1/17,6516,35013
We mourn the horrifying terrorist attack in NYC. All of America is praying and grieving for the families who lost their precious loved ones. https://t.co/WZFHXoJE3K,11/1/17,12690,56307
....for the Middle Class. The House and Senate should consider ASAP as the process of final approval moves along. Push Biggest Tax Cuts EVER,11/1/17,11783,56219
Wouldn't it be great to Repeal the very unfair and unpopular Individual Mandate in ObamaCare and use those savings for further Tax Cuts.....,11/1/17,17634,83073
#NYCStrong #USA🇺🇸 https://t.co/6K3Xw5P87d,11/1/17,8926,40093
Senator Chuck Schumer helping to import Europes problems said Col.Tony Shaffer. We will stop this craziness!  @foxandfriends,11/1/17,21428,77686
We are fighting hard for Merit Based immigration no more Democrat Lottery Systems. We must get MUCH tougher (and smarter).  @foxandfriends,11/1/17,26172,102486
"The terrorist came into our country through what is called the ""Diversity Visa Lottery Program"" a Chuck Schumer beauty. I want merit based.",11/1/17,37718,132205
I have just ordered Homeland Security to step up our already Extreme Vetting Program. Being politically correct is fine but not for this!,11/1/17,37799,150010
The Republican House members are working hard (and late) toward the Massive Tax Cuts that they know you deserve. These will be biggest ever!,11/1/17,13721,69956
My thoughts condolences and prayers to the victims and families of the New York City terrorist attack. God and your country are with you!,10/31/17,26364,114627
We must not allow ISIS to return or enter our country after defeating them in the Middle East and elsewhere. Enough!,10/31/17,36362,143823
In NYC looks like another attack by a very sick and deranged person. Law enforcement is following this closely. NOT IN THE U.S.A.!,10/31/17,25707,111025
U.S. COAL PRODUCTIONUp📈7.8% past year. Down📉31.5% last 10 years. #EndingWarOnCoal https://t.co/xr20OBb2DV,10/31/17,11071,44437
“Home Prices Reach New All-Time Highs in August” Read more: https://t.co/XzJiZgGQ8R https://t.co/STBtR6mO2j,10/31/17,6526,29500
Consumer Confidence Hits Highest Level Since December 2000 Read more: https://t.co/w7WkcobFun https://t.co/nLo5XCnuIx,10/31/17,10456,41278
Wishing everyone a safe and Happy Halloween!#Halloween2017 https://t.co/BRpgXVRI8Y,10/31/17,14090,63082
Thank you @LuisRiveraMarin! https://t.co/BK7sDv9phU,10/31/17,6007,28402
“Statement by President Trump on the Apprehension of Mustafa al-Imam for His Alleged Role in Benghazi Attacks” https://t.co/2U7WJmfGlM,10/31/17,10034,37503
....earth shattering. He and his brother could Drain The Swamp which would be yet another campaign promise fulfilled. Fake News weak!,10/31/17,12677,53862
The biggest story yesterday the one that has the Dems in a dither is Podesta running from his firm. What he know about Crooked Dems is....,10/31/17,17892,68922
I hope people will start to focus on our Massive Tax Cuts for Business (jobs) and the Middle Class (in addition to Democrat corruption)!,10/31/17,17325,76775
....came to the campaign. Few people knew the young low level volunteer named George who has already proven to be a liar. Check the DEMS!,10/31/17,12889,56964
"The Fake News is working overtime. As Paul Manaforts lawyer said there was ""no collusion"" and events mentioned took place long before he...",10/31/17,14552,60002
....Also there is NO COLLUSION!,10/30/17,23347,93864
Sorry but this is years ago before Paul Manafort was part of the Trump campaign. But why aren't Crooked Hillary &amp; the Dems the focus?????,10/30/17,35801,123689
Great job by MichaelCaputo on @foxandfriends.,10/30/17,7775,44301
Report out that Obama Campaign paid $972000 to Fusion GPS. The firm also got $12400000 (really?) from DNC. Nobody knows who OK'd!,10/30/17,34730,110605
"All of this ""Russia"" talk right when the Republicans are making their big push for historic Tax Cuts &amp; Reform. Is this coincidental? NOT!",10/29/17,24182,94912
...are now fighting back like never before. There is so much GUILT by Democrats/Clinton and now the facts are pouring out. DO SOMETHING!,10/29/17,25711,103162
"...""collusion"" which doesn't exist. The Dems are using this terrible (and bad for our country) Witch Hunt for evil politics but the R's...",10/29/17,18343,76214
...the Uranium to Russia deal the  33000 plus deleted Emails the Comey fix and so much more. Instead they look at phony Trump/Russia....,10/29/17,24360,90215
Never seen such Republican ANGER &amp; UNITY as I have concerning the lack of investigation on Clinton made Fake Dossier (now $12000000?)....,10/29/17,30780,114789
As usual the ObamaCare premiums will be up (the Dems own it) but we will Repeal &amp; Replace and have great Healthcare soon after Tax Cuts!,10/29/17,14577,69208
JFK Files are released long ahead of schedule!,10/28/17,20238,95386
While not at all presidential I must point out that the Sloppy Michael Moore Show on Broadway was a TOTAL BOMB and was forced to close. Sad!,10/28/17,26297,118041
Happy #FirstRespondersDay to all of our HEROES out there. We are forever grateful to you for your service sacrifice and courage 24/7/365! https://t.co/vOcTlyOeyw,10/28/17,15183,64713
...in order to put any and all conspiracy theories to rest.,10/28/17,10859,55183
...addresses of any mentioned person who is still living. I am doing this for reasons of full disclosure transparency and...,10/28/17,10697,52263
After strict consultation with General Kelly the CIA and other Agencies I will be releasing ALL #JFKFiles other than the names and...,10/28/17,17357,73321
Today is National Prescription Drug Take Back Day. Everyone can help fight the #OpioidEpidemic by participating! https://t.co/ONObTWOaOn https://t.co/CYG11DnxH7,10/28/17,9296,42273
Just read the nice remarks by President Jimmy Carter about me and how badly I am treated by the press (Fake News). Thank you Mr. President!,10/28/17,24370,134020
Very little reporting about the GREAT GDP numbers announced yesterday (3.0 despite the big hurricane hits). Best consecutive Q's in years!,10/28/17,21327,90590
“WHAT HAPPENED”“How Team Hillary played the press for fools on Russia”➡️https://t.co/GqpIidk017NOW WE KNOW! https://t.co/SgWL1HZmkI,10/28/17,26272,70296
#JFKFiles https://t.co/AnPBSJFh3J,10/28/17,18025,67193
Happy Birthday @TheLeeGreenwood!#FlashbackFriday https://t.co/MCrMK6Eurm,10/27/17,10335,42936
People are anxiously awaiting my decision as to who the next head of the Fed will be....🎥https://t.co/PEj1KNYcAO,10/27/17,9029,45721
.@FoxNews Chris Wallace: “More evidence of Dem collusion with Russia than GOP” https://t.co/nACQerJSiu,10/27/17,13627,46350
We are inspired by the stories of everyday heroes who pull their communities from the depths of despair through leadership and love. https://t.co/DL3oan4Fm7,10/27/17,10359,49044
Diane Black of Tennessee the highly respected House Budget Committee Chairwoman did a GREAT job in passing Budget setting up big Tax Cuts,10/27/17,11952,62357
Thank you @FLGovScott. https://t.co/rgdU9plvFK,10/27/17,8302,40225
It is now commonly agreed after many months of COSTLY looking that there was NO collusion between Russia and Trump. Was collusion with HC!,10/27/17,28344,103090
Happy birthday to the great @TheLeeGreenwood. You and your beautiful song have made such a difference. MAKE AMERICA GREAT AGAIN!,10/27/17,10166,50517
JFK Files are being carefully released. In the end there will be great transparency. It is my hope to get just about everything to public!,10/27/17,20021,97067
Happy birthday to the great @leegreenwood83. You and your beautiful song have made such a difference. MAKE AMERICA GREAT AGAIN!,10/27/17,3138,15767
Good luck to @Joy_Villa on her decision to enter the wonderful world of politics. She has many fans!,10/27/17,10481,51214
Congratulations to @SpeakerRyan @GOPLeader @SteveScalise and to the Republican Party on Budget passage yesterday. Now for biggest Tax Cuts,10/27/17,8967,46606
Thank you @foxandfriends. Really great job and show!,10/27/17,7200,45149
Wacky &amp; totally unhinged Tom Steyer who has been fighting me and my Make America Great Again agenda from beginning never wins elections!,10/27/17,11822,55387
WORKING TOGETHER we will defeat this #OpioidEpidemic &amp; free our nation from the terrible affliction of drug abuse. https://t.co/iAZjqGMwav https://t.co/mZI5uQN4oZ,10/27/17,10237,46633
Effective today my administration officially declared the #OpioidCrisis a NATIONAL PUBLIC HEALTH EMERGENCY under federal law. https://t.co/YosOBurdCw,10/26/17,13409,57440
Big news - Budget just passed!,10/26/17,25656,136635
Do not underestimate the UNITY within the Republican Party!,10/26/17,13441,70024
Ed Gillespie will be a great Governor of Virginia. His opponent doesn't even show up to meetings/work and will be VERY weak on crime!,10/26/17,12226,54271
Ed Gillespie will turn the really bad Virginia economy #'s around and fast. Strong on crime he might even save our great statues/heritage!,10/26/17,13706,62710
Will be another Sean success! https://t.co/SlNTENvJLA,10/26/17,9450,40800
Together we will Make America Great Again!#AmericaFirst🇺🇸 https://t.co/ajiC3flNkI,10/26/17,13314,53869
This will be the biggest TAX CUT in the history of our country - and we need it! #TaxReform Read more: https://t.co/o3W9bJkz5k https://t.co/JYckXWEmLu,10/26/17,12028,51774
Interview with @LouDobbs coming up at 7pmE on @FoxBusiness. Enjoy! https://t.co/9V9z015kVl,10/25/17,5999,32028
Texas @GovAbbott &amp; Lt. Gov. @DanPatrickThank you for todays briefing on hurricane recovery efforts here in TX. Keep up the great work! https://t.co/rBel6IWrJl,10/25/17,7253,35466
The long anticipated release of the #JFKFiles will take place tomorrow. So interesting!,10/25/17,34480,125353
Melania and I look forward to being with President Xi &amp; Madame Peng Liyuan in China in two weeks for what will hopefully be a historic trip! https://t.co/uFMonzza7N,10/25/17,9115,46862
Spoke to President Xi of China to congratulate him on his extraordinary elevation. Also discussed NoKo &amp; trade two very important subjects!,10/25/17,9943,56132
Just interviewed by @LouDobbs. Will be aired tonight at 7pmE on @FoxBusiness. #Dobbs,10/25/17,7881,37609
Congrats to @Reince Priebus a really good and talented man. We’re proud of you Reince! https://t.co/7AsjAMrSnV,10/25/17,6074,33443
MAKE AMERICA GREAT AGAIN! https://t.co/CbEwJSQ1A3,10/25/17,13946,51452
"Jeff Flake with an 18% approval rating in Arizona said ""a lot of my colleagues have spoken out."" Really they just gave me a standing O!",10/25/17,15719,74229
Working hard on the biggest tax cut in U.S. history. Great support from so many sides. Big winners will be the middle class business &amp; JOBS,10/25/17,19051,95816
The meeting with Republican Senators yesterday outside of Flake and Corker was a love fest with standing ovations and great ideas for USA!,10/25/17,12264,60710
The reason Flake and Corker dropped out of the Senate race is very simple they had zero chance of being elected. Now act so hurt &amp; wounded!,10/25/17,15617,68524
Clinton campaign &amp; DNC paid for research that led to the anti-Trump Fake News Dossier. The victim here is the President. @FoxNews,10/25/17,23207,79929
So nice being with Republican Senators today. Multiple standing ovations! Most are great people who want big Tax Cuts and success for U.S.,10/24/17,17165,89407
“President Donald J. Trump Proclaims October 24 2017 as United Nations Day” Read more: https://t.co/cyRAQAKhy2 https://t.co/HVD0kLYlBk,10/24/17,6719,32038
Stock Market just hit another record high! Jobs looking very good.,10/24/17,19348,99849
...the entire World WAS laughing and taking advantage of us. People like liddle' Bob Corker have set the U.S. way back. Now we move forward!,10/24/17,15461,68553
Sen. Corker is the incompetent head of the Foreign Relations Committee &amp; look how poorly the U.S. has done. He doesn't have a clue as.....,10/24/17,14402,64328
Isn't it sad that lightweight Senator Bob Corker who couldn't get re-elected in the Great State of Tennessee will now fight Tax Cuts plus!,10/24/17,14306,60101
...Corker dropped out of the race in Tennesse when I refused to endorse him and now is only negative on anything Trump. Look at his record!,10/24/17,13673,61172
Bob Corker who helped President O give us the bad Iran Deal &amp; couldn't get elected dog catcher in Tennessee is now fighting Tax Cuts....,10/24/17,20849,83559
We will never forget the 241 American service members killed by Hizballah in Beirut. They died in service to our nation. https://t.co/BaQZDA3s2e,10/23/17,17642,73233
I had a very respectful conversation with the widow of Sgt. La David Johnson and spoke his name from beginning without hesitation!,10/23/17,17537,89997
Two dozen NFL players continue to kneel during the National Anthem showing total disrespect to our Flag &amp; Country.  No leadership in NFL!,10/23/17,25192,118167
There will be NO change to your 401(k). This has always been a great and popular middle class tax break that works and it stays!,10/23/17,25159,118075
It is finally sinking through. 46% OF PEOPLE BELIEVE MAJOR NATIONAL NEWS ORGS FABRICATE STORIES ABOUT ME. FAKE NEWS even worse! Lost cred.,10/22/17,27997,125751
Wacky Congresswoman Wilson is the gift that keeps on giving for the Republican Party a disaster for Dems. You watch her in action &amp; vote R!,10/22/17,23964,110087
Doing interview today with Maria Bartiromo at 10:00 A.M. on @FoxNews - ENJOY!,10/22/17,7956,48368
...2nd Amendment Strong Military ISIS historic VA improvement Supreme Court Justice Record Stock Market lowest unemployment in 17 yrs!,10/22/17,17602,79676
...9 months than this Administration. Over 50 Legislation approvals massive regulation cuts energy freedom pipelines border security....,10/22/17,16276,78893
I agree getting Tax Cuts approved  is important (we will also get HealthCare) but perhaps no Administration has done more in its first.....,10/21/17,13683,71314
"Just out but lightly reported: ""Fewest jobless claims since 1973 show firm U.S. Job Market"" Lowest since March 1973. @bpolitics",10/21/17,17376,67844
Crooked Hillary Clinton spent hundreds of millions of dollars more on Presidential Election than I did. Facebook was on her side not mine!,10/21/17,23221,102739
"Keep hearing about ""tiny"" amount of money spent on Facebook ads. What about the billions of dollars of Fake News on CNN ABC NBC &amp; CBS?",10/21/17,24336,101054
"Officials behind the now discredited ""Dossier"" plead the Fifth. Justice Department and/or FBI should immediately release who paid for it.",10/21/17,25360,84962
“Trump hails liberation of Raqqa as critical breakthrough in anti-ISIS campaign” https://t.co/2eoYXJB7h0,10/21/17,11255,48552
Stock Market hits another all time high on Friday. 5.3 trillion dollars up since Election. Fake News doesn't spent much time on this!,10/21/17,21391,96172
People get what is going on! https://t.co/Pdg7VqQv6M,10/21/17,16020,55439
Subject to the receipt of further information I will be allowing as President the long blocked and classified JFK FILES to be opened.,10/21/17,70990,213796
I hope the Fake News Media keeps talking about Wacky Congresswoman Wilson in that she as a representative is killing the Democrat Party!,10/21/17,20325,92789
Budget that just passed is a really big deal especially in terms of what will be the biggest tax cut in U.S. history - MSM barely covered!,10/21/17,15668,71126
"Great book just out ""A Place Called Heaven"" by Dr. Robert Jeffress - A wonderful man!",10/20/17,14079,72943
This is a once-in-a-generation opportunity to offer historic tax relief to the American people! Join me today: https://t.co/9czcJDbmVW https://t.co/s3kXpvbYih,10/20/17,16056,64941
Today it was an honor to have @UNSecretary-General @AntonioGuterres at the @WhiteHouse. Speaking for the U.S.A. we appreciate all you do! https://t.co/Sk0Jcazzxw,10/20/17,7177,36967
Thank you @GeraldoRivera @FoxandFriends. Agree! https://t.co/8cZLdAbgzw,10/20/17,13187,49511
"Just out report: ""United Kingdom crime rises 13% annually amid spread of Radical Islamic terror."" Not good we must keep America safe!",10/20/17,29854,109246
....This now allows for the passage of large scale Tax Cuts (and Reform) which will be the biggest in the history of our country!,10/20/17,15323,75640
The Budget passed late last night 51 to 49. We got ZERO Democrat votes with only Rand Paul (he will vote for Tax Cuts) voting against.....,10/20/17,16037,72214
Great news on the 2018 budget @SenateMajLdr McConnell - first step toward delivering MASSIVE tax cuts for the American people! #TaxReform https://t.co/aBzQR7KR0c,10/20/17,13058,55053
Big ratings getter @seanhannity and Apprentice Champion John Rich are right now going on stage in Las Vegas for #VegasStrong. Great Show!,10/20/17,9931,52376
The Fake News is going crazy with wacky Congresswoman Wilson(D) who was SECRETLY on a very personal call and gave a total lie on content!,10/20/17,21124,91586
"Keep up the GREAT work. I am with you 100%!""ISIS is losing its grip...""Army Colonel Ryan DillonCJTF–OIRhttps://t.co/jVGuvv5mzm https://t.co/PSCXg38CtS",10/20/17,12948,55541
It was great to have Governor @RicardoRossello of #PuertoRico🇵🇷with us at the @WhiteHouse today. We are with you! #PRStrong https://t.co/Op2xDZxvNc,10/19/17,11028,50193
".@foxandfriends ""Russia sent millions to Clinton Foundation""",10/19/17,23830,73035
Workers of firm involved with the discredited and Fake Dossier take the 5th. Who paid for it Russia the FBI or the Dems (or all)?,10/19/17,26139,88012
Uranium deal to Russia with Clinton help and Obama Administration knowledge is the biggest story that Fake Media doesn't want to follow!,10/19/17,40651,120166
Republicans are going for the big Budget approval today first step toward massive tax cuts. I think we have the votes but who knows?,10/19/17,13566,72482
46% of Americans think the Media is inventing stories about Trump &amp; his Administration. @FoxNews   It is actually much worse than this!,10/19/17,19268,84057
.@DanaPerino &amp; @BradThorThank you so much for the wonderful compliment. Working hard! #MAGA https://t.co/AKWlsMsCVH,10/18/17,10559,44591
20000📈21000📈22000📈 23000📈this year...FOUR one thousand milestones this year... #Dow23K #MAGA https://t.co/GQ5f2eVvEI,10/18/17,14454,57977
This is what REAL PRIDE in our COUNTRY is all about! #USA🇺🇸 https://t.co/kyv866prdE,10/18/17,18196,70464
.@NFL: Too much talk not enough action. Stand for the National Anthem.,10/18/17,23044,98961
Iran hides behind its assertion of technical compliance w/the nuclear deal while it brazenly violates the other limits..Amb. @NikkiHaley https://t.co/xvHgx7d1cT,10/18/17,11941,42384
It was an honor to welcome Republican and Democratic members of the Senate Finance Committee to the @WhiteHouse today. #TaxReform https://t.co/ge4Xic9fId,10/18/17,7511,36710
Our hearts are with all affected by the wildfires in California. God bless our brave First Responders and @FEMA team. We support you! https://t.co/YaoPbaVI5L,10/18/17,9044,44208
The current tax code is a burden on American taxpayers &amp; harmful to job-creators. Americans need #TaxReform! More: https://t.co/qXyiYiFWCO https://t.co/NGIjJOc3TP,10/18/17,10590,43710
I am supportive of Lamar as a person &amp; also of the process but I can never support bailing out ins co's who have made a fortune w/ O'Care.,10/18/17,13050,60949
Democrat Congresswoman totally fabricated what I said to the wife of a soldier who died in action (and I have proof). Sad!,10/18/17,25506,99764
The NFL has decided that it will not force players to stand for the playing of our National Anthem. Total disrespect for our great country!,10/18/17,24511,101633
As it has turned out James Comey lied and leaked and totally protected Hillary Clinton. He was the best thing that ever happened to her!,10/18/17,25384,94520
The Democrats will only vote for Tax Increases. Hopefully all Senate Republicans will vote for the largest Tax Cuts in U.S. history.,10/18/17,14109,60724
...people not interviewed including Clinton herself. Comey stated under oath that he didn't do this-obviously a fix? Where is Justice Dept?,10/18/17,19842,73678
Wow FBI confirms report that James Comey drafted letter exonerating  Crooked Hillary Clinton long before investigation was complete. Many..,10/18/17,24369,86318
The most important truth our FOUNDERS understood was: FREEDOM is NOT a gift from Govt. FREEDOM is a GIFT from GOD. 🎥https://t.co/rmAzGt8SuG https://t.co/SrPavwrt2R,10/18/17,17935,63961
Thank you @Heritage! This is our once-in-a-generation opportunity to revitalize our economy revive our industry &amp; renew the AMERICAN DREAM! https://t.co/HI30nojsGo,10/18/17,9709,42699
WOW! https://t.co/eKfRktNVuy,10/17/17,17165,63824
BORDER WALL prototypes underway! https://t.co/arFNO80zmO,10/17/17,31067,104601
"Any increase in ObamaCare premiums is the fault of the Democrats for giving us a ""product"" that never had a chance of working.",10/17/17,16808,72698
So much Fake News being put in dying magazines and newspapers. Only place worse may be @NBCNews @CBSNews @ABC and @CNN. Fiction writers!,10/17/17,16242,64187
It was my great honor to welcome Prime Minister Alexis Tsipras of Greece to the WH today! 🎥https://t.co/Bn1vM6fYW9 📸https://t.co/j0roMFT3YL https://t.co/MPe5HWFcZ1,10/17/17,6765,37587
Join me LIVE from the Rose Garden at 1:30pmE with Prime Minister Alexis Tsipras of Greece. ➡️https://t.co/Bn1vM6fYW9 https://t.co/dZB4mDBKpi,10/17/17,4373,25242
Dow Passes 23000 for the First Time Fueled by Strong Earnings#Dow23K📈https://t.co/wnkrddYlb9 https://t.co/wlP0NCNcou,10/17/17,11493,46070
Rep.Tom Marino has informed me that he is withdrawing his name from consideration as drug czar. Tom is a fine man and a great Congressman!,10/17/17,8702,50141
Always great to see the wonderful people of South Carolina. Thank you for the beautiful welcome at Greenville-Spartanburg Int'l Airport! https://t.co/maO9Nc0sTe,10/16/17,12313,65889
"I was recently asked if Crooked Hillary Clinton is going to run in 2020? My answer was ""I hope so!""",10/16/17,35069,152051
The U.S. has gained more than 5.2 trillion dollars in Stock Market Value since Election Day! Also record business enthusiasm.,10/16/17,19613,96816
Since Election Day on November 8 the Stock Market is up more than 25% unemployment is at a 17 year low &amp; companies are coming back to U.S.,10/16/17,20216,92771
Dem Senator Schumer hated the Iran deal made by President Obama but now that I am involved he is OK with it. Tell that to Israel Chuck!,10/16/17,21065,77093
The Democrats only want to increase taxes and obstruct. That's all they are good at!,10/16/17,12973,57644
Art Laffer just said that he doesn't know how a Democrat could vote against the big tax cut/reform bill and live with themselves!  @FoxNews,10/16/17,12938,58127
...approvals of The Keystone XL &amp; Dakota Access pipelines. Also look at the recent EPA cancelations &amp; our great new Supreme Court Justice!,10/15/17,14897,77543
The Failing @nytimes in a story by Peter Baker should have mentioned the rapid terminations by me of TPP &amp; The Paris Accord &amp; the fast....,10/15/17,12861,60798
The Democrats in the Southwest part of Virginia have been abandoned by their Party. Republican Ed Gillespie will never let you down!,10/14/17,16003,71175
Very proud of my Executive Order which will allow greatly expanded access and far lower costs for HealthCare. Millions of people benefit!,10/14/17,22827,118617
Health Insurance stocks which have gone through the roof during the ObamaCare years plunged yesterday after I ended their Dems windfall!,10/14/17,18450,84508
"Such a wonderful statement from the great @LouDobbs. ""We take up what may be the most accomplished presidency in modern American history.""",10/14/17,16039,68504
ObamaCare is causing such grief and tragedy for so many. It is being dismantled but in the meantime premiums &amp; deductibles are way up!,10/14/17,12409,61481
Money pouring into Insurance Companies profits under the guise of ObamaCare is over. They have made a fortune.Dems must get smart &amp; deal!,10/14/17,15845,69168
Many people talking with much agreement on my Iran speech today. Participants in the deal are making lots of money on trade with Iran!,10/14/17,11325,54519
Starting to develop a much better relationship with Pakistan and its leaders. I want to thank them for their cooperation on many fronts.,10/14/17,14106,70090
#WeeklyAddress🇺🇸 https://t.co/riqEiBNwk2,10/13/17,10666,41603
Today I announced our strategy to confront the Iranian regime’s hostile actions and to ensure that they never acquire a nuclear weapon. https://t.co/N4ISdjuEdC,10/13/17,17647,66875
Consumer confidence soars to highest level since 2004📈https://t.co/RvxCPAFI2A https://t.co/U8MS9K45fX,10/13/17,11415,48865
In America we don't worship government - we worship God. #ValuesVotersSummit https://t.co/YQ3iDlWylK,10/13/17,21151,80176
