text,created_at,retweet_count,favorite_count
"I guess I have reached yet another ""ceiling""  - 49.7% with four people. My highest Reuters poll yet! Thank you! https://t.co/k5Ft585Arp",3/19/16,6770,20295
Do you believe that Hillary Clinton now wants Obamacare for illegal immigrants? She should spend more time taking care of our great Vets!,3/19/16,11479,27840
Everybody should boycott the @megynkelly show. Never worth watching. Always a hit on Trump! She is sick &amp; the most overrated person on tv.,3/18/16,8539,27306
Thank you Arizona- I love you! #MakeAmericaGreatAgain #Trump2016 https://t.co/fTzaIvTX9b,3/18/16,5118,14521
Join me tomorrow! #Trump2016#MakeAmericaGreatAgain https://t.co/1Yak4I5B7b,3/18/16,2582,8089
Mitt Romney is a mixed up man who doesn't have a clue. No wonder he lost!,3/18/16,4197,14217
Failed Presidential Candidate Mitt Romney was campaigning with John Kasich &amp; Marco Rubio and now he is endorsing Ted Cruz. 1/2,3/18/16,3975,12598
"Failed presidential candidate Mitt Romney the man who ""choked"" and let us all down is now endorsing Lyin' Ted Cruz. This is good for me!",3/18/16,5816,21141
Going to Salt Lake City Utah for a big rally. Lyin' Ted Cruz should not be allowed to win there - Mormons don't like LIARS! I beat Hillary,3/18/16,4634,14626
Club for Growth letter- trying to extort $1000000.00 from me. Remember I said- NO! https://t.co/suIfdiMg0Q,3/18/16,4772,11635
Club For Growth tried to extort $1000000 from me. When I said NO they went hostile with negative ads. Disgraceful!,3/18/16,3284,9778
With millions of dollars of negative and phony ads against me by the establishment my numbers continue to go up. Can anyone explain this?,3/18/16,6316,18960
.@EWErickson got fired like a dog from RedStateand now he is the one leading opposition against me.,3/18/16,3058,8057
Senator @LindseyGrahamSC made horrible statements about @SenTedCruz – and then he endorsed him. No wonder nobody trusts politicians!,3/18/16,5156,13717
Lyin' Ted Cruz lost all five races on Tuesday-and he was just given the jinx - a Lindsey Graham endorsement. Also backed Jeb. Lindsey got 0!,3/18/16,5269,16508
Join us in Salt Lake City Utah- tonight!#MakeAmericaGreatAgain #Trump2016https://t.co/1cJ7OFbQiz,3/18/16,3262,9518
Hillary Clinton has been involved in corruption for most of her professional life!,3/18/16,14199,35299
MAKE AMERICA GREAT AGAIN!,3/17/16,14553,32671
Who should star in a reboot of Liar Liar- Hillary Clinton or Ted Cruz? Let me know. https://t.co/ESdiEftWGs,3/17/16,6460,11608
Highly overrated &amp; crazy @megynkelly is always complaining about Trump and yet she devotes her shows to me. Focus on others Megyn!,3/17/16,5920,21641
Looking like my 5 victories on Tuesday will be just as good as if I won Ohio. Two more days and Ohio was mine!,3/17/16,3354,13620
See you in Arizona on Friday and Saturday. https://t.co/HiOhRaTMbm,3/17/16,3668,10241
Please explain to the dummies at the @WSJ  Editorial Board that I love to debate and have won according to Drudge etc. all 11 of them!,3/17/16,4258,13816
.@WSJ is bad at math. The good news is nobody cares what they say in their editorials anymore especially me!,3/17/16,3855,13056
".@WSJ Editorial says ""Clinton primary vote total is 8646551.Trump's is 7533692""-a knock. But she had only 3 opponents-I had 16.Apologize",3/17/16,5364,16662
The reason lyin' Ted Cruz has lost so much of the evangelical vote is that they are very smart and just don't tolerate liars-a big problem!,3/17/16,4645,14786
Crazy @megynkelly is now complaining that  @oreillyfactor did not defend her against me - yet her bad show is a total hit piece on me.Tough!,3/17/16,4135,13732
Great news that @FoxNews has cancelled the additional debate. How many times can the same people ask the same question? I beat Cruz debating,3/17/16,5776,21511
Crazy @megynkelly supposedly had lyin' Ted Cruz on her show last night. Ted is desperate and his lying is getting worse. Ted can't win!,3/17/16,4361,14397
Stuart Stevens the failed campaign manager of Mitt Romney's historic loss is now telling the Republican Party what to do with Trump. Sad!,3/17/16,4413,13535
I will be interviewed on The O'Reilly Factor this evening at 8 pm on the Fox News Channel. @oreillyfactor,3/16/16,3191,12240
Thank you Missouri! #Trump2016 https://t.co/iOzGtcBbia,3/16/16,5051,17319
Wow just won Missouri!,3/16/16,7699,27688
I am making a big speech the night of the @FoxNews debate but I wish everyone well. Yesterday was a big day for me with 5 wins!,3/16/16,4864,18836
Thank you to the Governor of Florida Rick Scott for your endorsement. I greatly appreciate your support!,3/16/16,5713,19972
In the last 2 weeks I had $35M of negative ads against me in Florida &amp; I won in a massive landslide.The establishment should save their $$!,3/16/16,8189,25052
Yesterday was amazing—5 victories.  Lyin’ Ted Cruzhad zero. Things are going very well!,3/16/16,5330,17703
Is this what we want for a President? https://t.co/2yYy6Nyta9,3/16/16,7809,15930
.@RepTomMarino  Great job on television this morning. Glad to have you on my side!,3/16/16,2316,9299
.@pastormarkburns You were great last night and we all very much appreciate it! Thank you!,3/16/16,3002,10549
I will be interviewed on @foxandfriends at 8:30 A.M. ENJOY!,3/16/16,1436,7047
Will be interviewed on @Morning_Joe at 7:40. ENJOY!,3/16/16,1192,6016
Will be interviewed on @NewDay on @CNN at 7:15 A.M.,3/16/16,1273,6197
Will be interviewed on @GMA at 7:00 A.M. Big wins last night!,3/16/16,1321,6745
Thank you Marco I agree! https://t.co/PTfFzFno9p,3/16/16,15492,31772
I only wish my wonderful daughter Tiffany could have been with us at Mar-a-Lago for our great election victory. She is a winner!,3/16/16,3540,17574
Thank you Illinois! #SuperTuesday #MakeAmericaGreatAgain #Trump2016 https://t.co/vcfstc6Wnb,3/16/16,6350,17746
Thank you North Carolina! #Trump2016 #SuperTuesday  #MakeAmericaGreatAgain https://t.co/hd4wtDonIB,3/16/16,6532,18426
Watching other networks and local news. Really good night! Crazy @megynkelly is unwatchable.,3/16/16,5300,17297
Thank you Florida! #SuperTuesday #MakeAmericaGreatAgain #Trump2016 https://t.co/nzhnLQXrZg,3/16/16,10299,25099
Thank you Northern Mariana Islands!#SuperTuesday #Trump2016 #MakeAmericaGreatAgain https://t.co/OoP4mls4lp,3/16/16,4376,14103
Can't watch Crazy Megyn anymore. Talks about me at 43% but never mentions that there are four people in race. With two people big &amp; over!,3/16/16,4294,16631
Word is that despite a record amount spent on negative and phony ads I had a massive victory in Florida. Numbers out soon!,3/15/16,5939,20877
A lot of complaints from people saying my name is not on the ballot in various places in Florida? Hope this is false.,3/15/16,8034,20098
"I will bring our jobs back to the U.S. and keep our companies from leaving. Nobody else can do it. Our economy will ""sing"" again.",3/15/16,6382,17732
In presidential voting so far John Kasich is ZERO for 22. So why would he be a good candidate? Hillary would beat him I will beat Hillary!,3/15/16,4677,15511
Ohio is losing jobs to Mexico now losing Ford (and many others). Kasich is weak on illegal immigration. We need strong borders now!,3/15/16,5446,16359
Watching John Kasich being interviewed - acting so innocent and like such a nice guy. Remember him in second debate until I put him down.,3/15/16,3459,11891
#VoteTrump #SuperTuesday✅Florida✅Illinois✅Missouri✅North Carolina✅Ohio #TrumpTrain https://t.co/zyRctsFmSq https://t.co/kxrn0ev4UF,3/15/16,6735,15959
North Carolina lost 300000 manufacturing jobs and Ohio lost 400000 since 2000. Going to Mexico etc. NO MORE IF I WIN WE WILL BRING BACK!,3/15/16,6092,13952
Just in big news- I have been declared the winner of the CNMI Rep Caucus with 72.8% of the vote! Thank you! #SuperTuesday #VoteTrump,3/15/16,5496,15972
Good morning Ohio! Some additional information from my daughter @IvankaTrump! #VoteTrump #SuperTuesday https://t.co/H7sBEnSpYq,3/15/16,3323,8632
Don't reward Mitt Romney who let us all down in the last presidential race by voting for Kasich (who voted for NAFTA open borders etc.).,3/15/16,5259,14206
Please remember I am the ONLY candidate who is self-funding his campaign. Kasich Rubio and Cruz are all bought and paid for by lobbyists!,3/15/16,7489,19426
I will bring our jobs back to America fix our military and take care of our vets end Common Core and ObamaCare protect 2nd A build WALL,3/15/16,8086,19990
Rubio is weak on illegal immigration with the worst voting record in the U.S. Senate in many years. He will never MAKE AMERICA GREAT AGAIN!,3/15/16,4120,12261
Kasich voted for NAFTA a disaster for Ohio and now wants the even worse TPP approved. Vote Trump and end this madness!,3/15/16,5020,12813
Sadly this kind of stuff even happened to Ronald Reagan. There is nothing nice about it! #MakeAmericaGreatAgain https://t.co/jC7cn1v18u,3/15/16,13818,23559
THANK YOU - Youngstown Ohio! I love you! Get out &amp; #VoteTrump tomorrow. #Trump2016 https://t.co/OReGiIS6TF,3/15/16,4707,13521
Kasich has helped decimate the coal and steel industries in Ohio. I will bring them back! #MakeAmericaGreatAgain,3/14/16,5758,13020
Gov Kasich voted for NAFTA which devastated Ohio and is now pushing TPP hard- bad for American workers!,3/14/16,4870,10780
Leaving the great people of North Carolina. Amazing event. Heading to Tampa now! #VoteTrump,3/14/16,3338,12242
Look forward to being in Tampa this afternoon. Wonderful crowds. Thank you Florida!,3/14/16,3248,12177
We don't have a country- if we don't have borders. #VoteTrump Video: https://t.co/wG4RgOi1bW https://t.co/oAXBvcKIsr,3/14/16,7392,18006
Just received from @PeteRose_14. Thank you Pete! #VoteTrump on Tuesday Ohio! #Trump2016#MakeAmericaGreatAgain https://t.co/UvP03n7dQq,3/14/16,11689,30282
LYIN' TED https://t.co/Q0qXDGCN1l,3/13/16,7101,14390
The failing @nytimes is truly one of the worst newspapers. They knowingly write lies and never even call to fact check. Really bad people!,3/13/16,5505,15350
Because Gov. Kasich cannot run in the state of Pennsylvania-he cannot win the nomination- &amp; should not be allowed to compete in Ohio on Tue.,3/13/16,5732,15224
Carly Fiorina- I agree! Ted Cruz is just another politician. All talk- no action!https://t.co/08xkEBD8Be,3/13/16,6490,14233
Thank you Kevin. With unification of the party Republican wins will be massive! https://t.co/1rmyCGSlsV,3/13/16,4182,10422
Gov.Kasich of Ohio just stated on a morning show that he doesn't watch politics or anything on television he only watches the @GolfChannel,3/13/16,4289,12231
Ohio Gov.Kasich voted for NAFTA from which Ohio has never recovered. Now he wants TPP which will be even worse. Ohio steel and coal dying!,3/13/16,5977,12897
Bernie Sanders is lying when he says his disruptors aren't told to go to my events. Be careful Bernie or my supporters will go to yours!,3/13/16,13754,34539
Wow Kasich didn't qualify to run in the state of Pennsylvania not enough signatures. Big problem!,3/13/16,6427,17343
USSS did an excellent job stopping the maniac running to the stage. He has ties to ISIS. Should be in jail! https://t.co/tkzbHg7wyD?ssr=true,3/12/16,10882,20991
Do the people of Ohio know that John Kasich is STRONGLY in favor of Common Core! In other words education of your children from D.C. No way,3/12/16,6874,16571
#EndCommonCore #Trump2016Video: https://t.co/krYK2DiAlh https://t.co/RAH45igqJI,3/12/16,4381,11737
Just finished my second speech. 20K in Dayton &amp; 25K in Cleveland- perfectly behaved crowd. Thanks- I love you Ohio! https://t.co/IDmwG5FQsw,3/12/16,9784,29203
It is Clinton and Sanders people who disrupted my rally in Chicago - and then they say I must talk to my people. Phony politicians!,3/12/16,12953,30095
The last person that Hillary or Bernie want to run against is Donald Trump --- and that is fact!,3/12/16,7478,20991
We are asking law enforcement to check for dishonest early voting in Florida- on behalf of little Marco Rubio. No way to run a country!,3/12/16,6473,16606
Word is-early voting in FL is very dishonest. Little Marco his State Chairman &amp; their minions are working overtime-trying to rig the vote.,3/12/16,6593,14216
The rally in Cincinnati is ON. Media put out false reports that it was cancelled! #MakeAmericaGreatAgain #Trump2016,3/12/16,4309,11750
Thank you Dayton Ohio! 20000 supporters- largest in airport history! #MakeAmericaGreatAgain #Trump2016 https://t.co/ry2p5qGcFt,3/12/16,6545,18296
MAKE AMERICA GREAT AGAIN!,3/12/16,13449,28283
On my way to Dayton Ohio. Will be there soon!,3/12/16,2938,12239
The rally in Cincinnati is ON. Media put out false reports that it was cancelled. Will be great - love you Ohio!,3/12/16,5544,15531
Ohio had the biggest budget increase in the U.S. If it were not for striking oil they would be bust! Governor Kasich in favor of TPP fraud!,3/12/16,4366,11599
Absentee Governor Kasich voted for NAFTA and NAFTA devastated Ohio - a disaster from which it never recovered. Kasich is good for Mexico!,3/12/16,5939,13689
The organized group of people many of them thugs who shut down our First Amendment rights in Chicago have totally energized America!,3/12/16,24371,40909
I just got off the phone with the great people of Guam! Thank you for your support! #VoteTrump today! #Trump2016,3/12/16,4835,17335
Great news! Thank you Governor Ralph DLG Torres! #Trump2016  https://t.co/hXwAK3iyPk,3/11/16,3903,10618
It means so much to me- receiving an endorsement from Phyllis Schlafly. A truly great woman &amp; conservative. https://t.co/11rEMu99qc,3/11/16,6873,20100
Thank you St. Louis Missouri! #MakeAmericaGreatAgain #Trump2016https://t.co/qM1Mwq05j2 https://t.co/MxVFHvHfS3,3/11/16,3851,11492
Rumor has it that @politico is going out of business. Losing too much money. Great news! Likewise dopey Mort Zuckerman's @NYDailyNews,3/11/16,3246,9977
https://t.co/ZQ0osiFEJQ,3/11/16,4923,10424
"Dr. Ben Carson- I concur. ""I believe in God who can change people- he can make any of us better.""@RealBenCarson",3/11/16,7147,19756
Thank you! #GOPDebate https://t.co/BuJ1YFkjvm,3/11/16,5184,13652
Thank you America! #Trump2016#MakeAmericaGreatAgain https://t.co/8B0J8Xt3dh,3/11/16,4719,13768
Thank you Mark. #GOPDebate  https://t.co/jeaiAvgEEC,3/11/16,2394,7322
Wow you are all correct about @FoxNews - totally biased and disgusting reporting.,3/10/16,6483,18064
Another Dishonest Politician #LightweightSenatorMarcoRubio https://t.co/w7G5vJ511O,3/9/16,4893,11625
Keep lightweight Marco and his friends out of the White House. #MakeAmericaGreatAgain #Trump2016 https://t.co/hNkkRx66Hc,3/9/16,5296,13741
Phony Club For Growth tried to shake me down for one million dollars &amp; is now putting out nasty negative ads on me. They are total losers!,3/9/16,4856,13859
Thank you Hawaii! #Trump2016,3/9/16,5725,20297
This was a great evening- I would like to thank everyone for their wonderful support.,3/9/16,6041,23418
Thank you Michigan! #Trump2016,3/9/16,7288,21027
Thank you Mississippi! #Trump2016,3/9/16,6133,18849
Thank you! #Trump2016 https://t.co/WvTkL8mMHY,3/9/16,3673,11212
Thank you America! #Trump2016https://t.co/jOD54EGGmG,3/9/16,4279,12414
Word is I am doing very well in Michigan and Mississippi! Wow and with all that money spent against me! Will be going to Trump Jupiter now!,3/8/16,4951,19408
I hear @NBCNews / @WSJ came out with another one of their phony polls. While I am leading they are totally discredited after last S.C. poll,3/8/16,2750,9130
The negative television commercials about me paid for by the politicians bosses are a total #Mediafraud. When you watch remember!,3/8/16,5649,14840
Hawaii:https://t.co/MnIlk2l9hPIdaho:https://t.co/7y5RxLpZRQMississippi:https://t.co/n43cPeJIqaMichigan:https://t.co/GL5JiZbqIc,3/8/16,2974,7003
#VoteTrumpID! #Trump2016https://t.co/c6NHn6d6jX,3/8/16,2219,6485
#VoteTrumpHI! #Trump2016https://t.co/cCCLxnisSO,3/8/16,2004,5912
#VoteTrumpMI! #Trump2016https://t.co/IWMxISjH6L,3/8/16,2099,6162
#VoteTrumpMS! #Trump2016https://t.co/KaHD0uENla,3/8/16,2049,6047
Mitt Romney had his chance and blew it. Lindsey Graham ran for president got ZERO and quit! Why are they now spokesmen against me? Sad!,3/8/16,5366,16655
Remember I am the only one who is self-funding my campaign. All of the other candidates are bought and paid for by special interests!,3/8/16,7344,19104
Sun Sentinel says: Rubio lacks the experience work ethic and gravitas needed to be president. HE HAS NOT EARNED YOUR VOTE!,3/8/16,3923,10984
MAKE AMERICA GREAT AGAIN!,3/8/16,9542,18495
Thank you @EricTrump! https://t.co/U1iTLmcbAc,3/8/16,2150,7689
Michigan Mississippi Idaho &amp; Hawaii: Get out to VOTE and join the movement today! Video: https://t.co/fJw8Ax7E8P https://t.co/ZDbarevYAc,3/8/16,4550,10791
The Club for Growth is a very dishonest group. They represent conservative values terribly &amp; are bad for America. https://t.co/rnGoaprYuA,3/8/16,3335,7882
People forget it was Club for Growth that asked me for $1 million. I said no &amp; they went negative. Extortion! https://t.co/oq8jmoep7i,3/8/16,3794,8827
Ted Cruz Was For Welcoming Syrian Refugees Before He Was Against Ithttps://t.co/zw4o1DJgfB,3/8/16,4638,8790
I employ many people in Hawaii at my great hotel in Honolulu. I’ll be there very soon. Vote for me Hawaii!,3/8/16,4247,13906
Cruz came to Mississippi there was nobody there he left the state. I had a rally in Madison MS with 10000! Thank you!,3/8/16,5393,16394
I will be interviewed by @SeanHannity tonight at 10pm EST on @FoxNews! Enjoy!,3/8/16,2539,8467
New ad concerning lightweight Senator Marco Rubio: https://t.co/cNe0skpB5i,3/7/16,3061,7483
Thank you Idaho! I love your potatoes- nobody grows them better. As President I will protect your market. https://t.co/kqx8un1jnw,3/7/16,5151,14484
"Lightweight Senator Marco Rubio features Trump Univ. students in FL. attack ads- who submitted ""excellent"" reviews. https://t.co/JGTD590pKE",3/7/16,2795,6691
It was great being in Michigan. Remember I am the only presidential candidate who will bring jobs back to the U.S.and protect car industry!,3/7/16,4651,13917
Don't believe the millions of dollars of phony television ads by lightweight Rubio and the R establishment. Dishonest people!,3/7/16,5818,17152
Leaving for North Carolina. Big crowd will be fun!,3/7/16,3385,11993
Congratulation to Adam Scott and all of the folks at Trump National Doral on producing a really great WGC Tournament. Amazing finish!,3/7/16,1990,8475
I will be using Facebook and Twitter to expose dishonest lightweight Senator Marco Rubio. A record no-show in Senate he is scamming Florida,3/7/16,5682,15537
We cannot let the failing REPUBLICAN ESTABLISHMENT who could not stop Obama (twice) ruin the MOVEMENT with millions of  $'s in false ads!,3/7/16,7247,18683
Lindsey Graham is all over T.V. much like failed 47% candidate Mitt Romney. These nasty angry jealous  failures have ZERO credibility!,3/7/16,5028,14751
Failed presidential candidate Lindsey Graham should respect me. I destroyed his run brought him from 7% to 0% when he got out. Now nasty!,3/7/16,3026,10493
How do you fight millions of dollars of fraudulent commercials pushing for crooked politicians? I will be using Facebook &amp; Twitter. Watch!,3/7/16,9070,26299
All of the phony T.V. commercials against me are bought and payed for by SPECIAL INTEREST GROUPS the bandits that tell your pols what to do,3/7/16,7112,19503
.@meetthepress and @chucktodd did a 1 hour hit job on me today – totally biased and mostly false. Dishonest media!,3/6/16,3529,10152
I am at Trump National Doral-best resort in U.S. Rory and Adam Scott are doing great! Watch on NBC at 3:00 P.M.  MAKE AMERICA GREAT AGAIN!,3/6/16,2149,8336
Thank you to @jdickerson and @FaceTheNation for a very fair and professional interview this morning. No wonder you are #1 in the ratings!,3/6/16,2927,9837
Fraud lightweight Marco made a TV ad on TrumpU featuring 2 people who signed these letters: https://t.co/tSpFBn6Ruxhttps://t.co/KFmotmqfnN,3/6/16,3124,7279
The primary plaintiff in the phony Trump University suit wants to abandon the case. Disgraceful!,3/6/16,3181,8994
Nancy Reagan the wife of a truly great President was an amazing woman. She will be missed!,3/6/16,8284,27015
David Brooks of the New York Times is closing in on being the dumbest of them all. He doesn’t have a clue.,3/6/16,2367,8004
Thank you Michigan! #Trump2016 https://t.co/ttwwvrTjwE,3/6/16,4214,11693
FLORIDA: Do not miss this opportunity to #MakeAmericaGreatAgain! Thank you @IvankaTrump: https://t.co/LHRNDKsoKh https://t.co/7cnWT9RGSr,3/6/16,4078,9902
I will be interviewed on @FaceTheNation this morning. Enjoy!  @jdickerson,3/6/16,1482,6554
.@FoxNews is devastated that lightweight Senator Marco Rubio got trounced tonight and is the big loser. I won the two big states great!,3/6/16,5472,19409
Thank you Kentucky! #Trump2016#SuperSaturday,3/6/16,5331,16967
Thank you Louisiana! #Trump2016#SuperSaturday,3/6/16,5102,16726
I will be at the Cadillac World Golf Championship @TrumpDoral in Miami tomorrow! Rory Phil Bubba Adam and Dustin all at the top!,3/5/16,2110,8035
Thank you Willie Robertson! #VoteTrump #MakeAmericaGreatAgain  https://t.co/0TUpaNfUmR,3/5/16,3996,12001
I would love to be at the Cadillac World Golf Championship @TrumpDoral in Miami- but even more so in Orlando with the #TrumpTrain!,3/5/16,1921,7306
I am watching two clown announcers on @FoxNews as they try to build up failed presidential candidate #LittleMarco. Fox News is in the bag!,3/5/16,4522,13221
Romney's failed advisors like campaign mgr Stuart Stevens are all over TV telling people how to win. But they lost- don't know how to win!,3/5/16,3360,10527
.@MittRomney was a disaster candidate who had no guts and choked! Romney is a total joke and everyone knows it!,3/5/16,3814,11867
Thank you Kansas! The line going into the Orlando event is over a mile long. Massive crowd expected. Leaving Kansas now be there soon!,3/5/16,2905,10226
#CaucusForTrump #Trump2016  https://t.co/pTUlDXgPkP,3/5/16,2000,7175
Getting ready to make my speech at #KansasCaucus. A great honor! #MakeAmericaGreatAgain #Trump2016,3/5/16,1756,7192
Thank you Kansas! Thousands of people inside- and thousands outside who couldn't get into the hall. Really amazing! #CaucusForTrump,3/5/16,2284,9997
To the people of Kentucky Rand Paul didn't want you. Now he runs back due to his presidential failure. #VoteTrump #MakeAmericaGreatAgain,3/5/16,2074,7232
Why would anyone in Kentucky listen to failed presidential candidate Rand Paul re: caucus. Made a fool of himself (1%.)KY his 2nd choice!,3/5/16,1943,7586
Will be in Orlando Florida this afternoon. 25000 people expected. This is a movement like our GREAT COUNTRY has never seen before!,3/5/16,4257,13018
Wow big lines in Kansas.,3/5/16,2374,9069
For all of today's voters please remember that I am the only candidate that is self funding my campaign I am not bought and paid for!,3/5/16,6864,20499
Great time last night in Louisiana. Big and energetic crowd. Go out and vote now polls open. MAKE AMERICA GREAT AGAIN!,3/5/16,2812,9475
I am in Kansas. Will be an exciting day. Big speech this morning in Wichita and then go to caucus. Sorry CPAC (the format was fine!).,3/5/16,2746,10249
Join me in Wichita Kansas tomorrow morning! Looking forward to it!#MakeAmericaGreatAgain #Trump2016https://t.co/HtVKgLdKcp,3/5/16,2433,8283
Thank you New Orleans Louisiana!#MakeAmericaGreatAgain #VoteTrumphttps://t.co/tI1h9xT9GX https://t.co/0bf7BOlWEj,3/5/16,3601,10448
Join me in Wichita Kansas tomorrow morning! Looking forward to it!#MakeAmericaGreatAgain #Trump2016https://t.co/HtVKgLvlAZ,3/4/16,2680,8198
Thank you Cadillac Michigan! #VoteTrumpMI on 3/8/2016. We will MAKE AMERICA GREAT AGAIN!https://t.co/8RDmQCbHce https://t.co/94mFPx0EgH,3/4/16,3205,9689
#VoteTrumpKS #Trump2016March 5 2016 | Wichita Kansas: https://t.co/BkvBzvsJ12 https://t.co/Q8eZU9yi6W,3/4/16,3076,8388
U.S. Senator Bob Corker (R-Tenn.) issued the following statement today regarding the 2016 presidential election: https://t.co/79y1KgC7S4,3/4/16,4075,9294
Thank you Macomb County Michigan! #MakeAmericaGreatAgain #Trump2016 https://t.co/9TBvy6obcE,3/4/16,3877,11407
Thank you America! #Trump2016 https://t.co/fNMPlXpkFf https://t.co/W1biUNTvFk,3/4/16,5957,13993
MY POSITION ON VISAS#MakeAmericaGreatAgain #Trump2016https://t.co/JGmOd5gr5z https://t.co/OLg6N3Ug9U,3/4/16,6269,13179
The Better Business Bureau report with an A rating for Trump University. #GOPDebate https://t.co/ldJ5EFp3HM https://t.co/1K9u09CFQQ,3/4/16,8490,18466
Rubio puts out ad that my pilot was a drug dealer- not true not my pilot! Guy owned helicopter company- don't think I ever even used.,3/4/16,3886,13065
Senator Sessions will serve as the Chairman of my National Security Advisory Committee. https://t.co/jQed1P6SD9 https://t.co/n83Cbs4jtA,3/4/16,6229,14095
THANK YOU PORTLAND Maine!#MakeAmericaGreatAgain #Trump2016https://t.co/6lMFR6z8xO https://t.co/eKGxNbG6wD,3/3/16,3823,12669
On my way to see the great people of Maine. Will be landing in Portland in 2 hours. Look forward to it! #Trump2016,3/3/16,3538,14721
Will miss @RealBenCarson tonight at the #GOPDebate. I hope all of Ben's followers will join the #TrumpTrain. We will never forget.,3/3/16,7864,23210
Go to Trump Doral in Miami and watch the World Golf Championship! On NOW!,3/3/16,1893,7703
The phony lawsuit against Trump U could have been easily settled by me but I want  to go to court. 98% approval rating by students. Easy win,3/3/16,3857,12072
Why did Mitt Romney BEG me for my endorsement four years ago?,3/3/16,8029,20602
"I am the only one who can beat Hillary Clinton. I am not a Mitt Romney who doesn't know how to win. Hillary wants no part of ""Trump""",3/3/16,9569,25358
