text,created_at,retweet_count,favorite_count
John James is a potential Republican Star who has a Senate primary election tomorrow in Michigan. If he becomes the Republican candidate he will beat the Open Borders weak on Crime Democrat Debbie Stabenow. Vote for John James and Make America Great Again!,8/6/18,20720,75321
Governor Jerry Brown must allow the Free Flow of the vast amounts of water coming from the North and foolishly being diverted into the Pacific Ocean. Can be used for fires farming and everything else. Think of California with plenty of Water - Nice! Fast Federal govt. approvals.,8/6/18,19515,75138
Kris Kobach a strong and early supporter of mine is running for Governor of the Great State of Kansas.  He is a fantastic guy who loves his State and our Country - he will be a GREAT Governor and has my full &amp; total Endorsement! Strong on Crime Border &amp; Military. VOTE TUESDAY!,8/6/18,18391,76717
Great financial numbers being announced on an almost daily basis. Economy has never been better jobs at best point in history. Fixing our terrible Trade Deals is a priority-and going very well. Immigration on Merit Based System to take care of the companies coming back to U.S.A.,8/6/18,17792,74883
....a law firm eventually Kremlin connected sources to gather info on Donald Trump. Collusion is very real with Russia but only with Hillary and the Democrats and we should demand a full investigation.” Dan Bongino on @foxandfriends  Looking forward to the new IG Report!,8/6/18,18269,70555
“Collusion with Russia was very real. Hillary Clinton and her team 100% colluded with the Russians and so did Adam Schiff who is on tape trying to collude with what he thought was Russians to obtain compromising material on DJT. We also know that Hillary Clinton paid through....,8/6/18,25103,86757
California wildfires are being magnified &amp; made so much worse by the bad environmental laws which aren’t allowing massive amount of readily available water to be properly utilized. It is being diverted into the Pacific Ocean. Must also tree clear to stop fire   spreading!,8/5/18,21984,86101
Presidential Approval numbers are very good - strong economy military and just about everything else. Better numbers than Obama at this point by far. We are winning on just about every front and for that reason there will not be a Blue Wave but there might be a Red Wave!,8/5/18,29214,135598
Too bad a large portion of the Media refuses to report the lies and corruption having to do with the Rigged Witch Hunt - but that is why we call them FAKE NEWS!,8/5/18,22057,93211
...Why aren’t Mueller and the 17 Angry Democrats looking at the meetings concerning the Fake Dossier and all of the lying that went on in the FBI and DOJ? This is the most one sided Witch Hunt in the history of our country. Fortunately the facts are all coming out and fast!,8/5/18,26382,104190
Fake News reporting a complete fabrication that I am concerned about the meeting my wonderful son Donald had in Trump Tower. This was a meeting to get information on an opponent totally legal and done all the time in politics - and it went nowhere. I did not know about it!,8/5/18,20549,83174
..Because of Tariffs we will be able to start paying down large amounts of the $21 Trillion in debt that has been accumulated much by the Obama Administration while at the same time reducing taxes for our people. At minimum we will make much better Trade Deals for our country!,8/5/18,19789,81856
Tariffs are working big time. Every country on earth wants to take wealth out of the U.S. always to our detriment. I say as they comeTax them. If they don’t want to be taxed let them make or build the product in the U.S. In either event it means jobs and great wealth.....,8/5/18,16604,75150
The Fake News hates me saying that they are the Enemy of the People only because they know it’s TRUE. I am providing a great service by explaining this to the American People. They purposely cause great division &amp; distrust. They can also cause War! They are very dangerous &amp; sick!,8/5/18,33755,124918
...Danny O’Connor is a total puppet for Nancy Pelosi and Maxine Waters – Danny wants to raise your taxes open your borders and take away your 2nd Amendment. Vote for Troy on Tuesday!,8/5/18,15195,63195
A great night in Ohio’s 12th Congressional District with Troy Balderson! Troy loves Ohio and he loves the people of Ohio. He will be fighting for you all the way...,8/5/18,16505,78784
Thank you Ohio. I love you! https://t.co/HYSaQOB6GW,8/5/18,13891,61483
Iran and it’s economy is going very bad and fast! I will meet or not meet it doesn’t matter - it is up to them!,8/4/18,18571,87241
Heading to Ohio!,8/4/18,9075,64584
....China which is for the first time doing poorly against us is spending a fortune on ads and P.R. trying to convince and scare our politicians to fight me on Tariffs- because they are really hurting their economy. Likewise other countries. We are Winning but must be strong!,8/4/18,16553,69589
....Tariffs will make our country much richer than it is today. Only fools would disagree. We are using them to negotiate fair trade deals and if countries are still unwilling to negotiate they will pay us vast sums of money in the form of Tariffs. We win either way......,8/4/18,17819,81002
....Tariffs have had a tremendous positive impact on our Steel Industry. Plants are opening all over the U.S. Steelworkers are working again and big dollars are flowing into our Treasury. Other countries use Tariffs against but when we use them foolish people scream!,8/4/18,13722,61221
Tariffs are working far better than anyone ever anticipated. China market has dropped 27% in last 4months and they are talking to us. Our market is stronger than ever and will go up dramatically when these horrible Trade Deals are successfully renegotiated. America First.......,8/4/18,20071,86527
HAPPY BIRTHDAY @USCG! https://t.co/cQo41jcoKn,8/4/18,12303,60706
Troy Balderson running for Congress from Ohio is in a big Election fight with a candidate who just got caught lying about his relationship with Nancy Pelosi who is weak on Crime Borders &amp; your 2nd Amendment-and wants to raise your Taxes (by a lot). Vote for Troy on Tuesday!,8/4/18,19899,76470
Will be going to Ohio tonight to campaign for Troy Balderson for the big Congressional Special Election on Tuesday. Early voting is on. Troy is strong on Crime the Border &amp; loves our Military Vets &amp; 2nd Amendment. His opponent is a puppet of Nancy Pelosi/high taxes.,8/4/18,15637,70696
Lebron James was just interviewed by the dumbest man on television Don Lemon. He made Lebron look smart which isn’t easy to do. I like Mike!,8/4/18,49313,180381
...Dianne is the person leading our Nation on “Collusion” with Russia (only done by Dems). Will she now investigate herself? https://t.co/OG6l04bBwg,8/4/18,18732,57212
Congratulations to Gregg Jarrett on his book “THE RUSSIA HOAX THE ILLICIT SCHEME TO CLEAR HILLARY CLINTON AND FRAME DONALD TRUMP” going to #1 on @nytimes and Amazon. It is indeed a HOAX and WITCH HUNT illegally started by people who have already been disgraced. Great book!,8/4/18,13932,60344
Great photo from Ocean City Maryland. Thank you. MAKE AMERICA GREAT AGAIN! https://t.co/kILZz31yDJ,8/4/18,21640,86511
Almost 500000 Manufacturing Jobs created since I won the Election. Remember when my opponents were saying that we couldn’t create this type of job anymore. Wrong in fact these are among our best and most important jobs!,8/3/18,22625,98844
“The media are good news fire extinguishers!” @greggutfeld @TheFive,8/3/18,10310,46532
NASA which is making a BIG comeback under the Trump Administration has just named 9 astronauts for Boeing and Spacex space flights. We have the greatest facilities in the world and we are now letting the private sector pay to use them. Exciting things happening. Space Force!,8/3/18,17608,81570
July is just the ninth month since 1970 that unemployment has fallen below 4%. Our economy has added 3.7 million jobs since I won the Election. 4.1 GDP. More than 4 million people have received a pay raise due to tax reform. $400 Billion brought back from “overseas.” @FoxNews,8/3/18,18443,77998
Marsha Blackburn had a BIG win last night in the Tennessee primary for U.S. Senate. She is an outstanding person &amp; great supporter of mine. Congratulations Marsha we need you very badly in the Senate to vote for our agenda. Your next opponent will vote against all we are doing!,8/3/18,15808,70395
“Pastor praises Trump as 'pro-black' at prison reform event” https://t.co/xFKf1arebx,8/3/18,15398,60075
Congratulations Marsha! https://t.co/JSMiOWfbxa,8/3/18,8647,41383
Congratulations to Bill Lee of Tennessee on his big primary win for Governor last night.  He ran a great campaign and now will finish off the job in November. Bill has my total and enthusiastic Endorsement!,8/3/18,16043,77708
Thank you Pennsylvania. I love you! https://t.co/qoswnBZb3f,8/3/18,18236,80610
They asked my daughter Ivanka whether or not the media is the enemy of the people. She correctly said no. It is the FAKE NEWS which is a large percentage of the media that is the enemy of the people!,8/2/18,34404,145812
Looking forward to being in the Great State of Ohio on Saturday night where I will be campaigning hard for a truly talented future Congressman @Troy_Balderson. See you all then! Tickets: https://t.co/8UOykaI8uf https://t.co/jHdtAy5fgj,8/2/18,9501,40419
When the House and Senate meet on the very important Farm Bill – we love our farmers - hopefully they will be able to leave the WORK REQUIREMENTS FOR FOOD STAMPS PROVISION that the House approved. Senate should go to 51 votes!,8/2/18,13769,63019
Pennsylvania has to love Trump because unlike all of the others before me I am bringing STEEL BACK in a VERY BIG way. Plants opening up in Pennsylvania and all over the Country and Congressman Lou Barletta who is running for the Senate in Pennsylvania is really helping!,8/2/18,17076,80304
Looking forward to being in the Great State of Pennsylvania where we had a tremendous victory in the Election. Will be campaigning hard for an original supporter Lou Barletta to replace a weak an ineffective Senator Bob Casey. Lou is tough and smart loves PA and our Country!,8/2/18,13812,64860
Congressman Steve Stivers of Ohio has done a fantastic job as Chairman of the @NRCC. He is a great Congressman who is tough on crime &amp; borders &amp; an inspiration to our Military &amp; Vets. Big on 2nd Amendment. Get out and vote for Steve on Aug 7th. He has my full &amp; total endorsement!,8/2/18,1508,5746
Working hard thank you! https://t.co/pNXbFNcf8z,8/2/18,21721,92481
Wow @foxandfriends is blowing away the competition in the morning ratings. Morning Joe is a dead show with very few people watching and sadly Fake News CNN is also doing poorly. Too much hate and inaccurately reported stories - too predictable!,8/2/18,21829,97812
Charles Koch of Koch Brothers who claims to be giving away millions of dollars to politicians even though I know very few who have seen this (?) now makes the ridiculous statement that what President Trump is doing is unfair to “foreign workers.” He is correct AMERICA FIRST!,8/2/18,25836,102889
Thank you to Chairman Kim Jong Un for keeping your word &amp; starting the process of sending home the remains of our great and beloved missing fallen! I am not at all surprised that you took this kind action. Also thank you for your nice letter - l look forward to seeing you soon!,8/2/18,26299,130250
Congratulations to  @GreggJarrett on The TREMENDOUS success of his just out book “The Russia Hoax The Illicit Scheme To Clear Hillary Clinton &amp; Frame Donald Trump.” Already number one on Amazon. Hard work from a brilliant guy. It’s the Real Story of the Rigged Witch Hunt!,8/2/18,17180,70597
Incredibly beautiful ceremony as U.S. Korean War remains are returned to American soil. Thank you to Honolulu and all of our great Military participants on a job well done. A special thanks to Vice President Mike Pence on delivering a truly magnificent tribute!,8/2/18,17350,86814
“Private payrolls boom in July increasing by 219000 vs 185000 estimate: ADP” https://t.co/SeU9kGpima,8/1/18,14477,59365
Join me tomorrow night at 7pmE in Wilkes-Barre Township Pennsylvania for a MAKE AMERICA GREAT AGAIN RALLY! Tickets: https://t.co/dR6EzS3Q8L https://t.co/c52kIxvdF7,8/1/18,11284,45573
#PledgeToAmericasWorkers https://t.co/qIJQfQ3bos,8/1/18,11876,50277
It was my great honor to be joined by leading pastors and faith leaders from across our Nation today at the @WhiteHouse! https://t.co/6sS1zGA1p7,8/1/18,15638,65957
“We already have a smoking gun about a campaign getting dirt on their opponent it was Hillary Clinton. How is it OK for Hillary Clinton to proactively seek dirt from the Russians but the Trump campaign met at the Russians request and that is bad?” Marc Thiessen Washington Post,8/1/18,21566,79041
Looking back on history who was treated worse Alfonse Capone legendary mob boss killer and “Public Enemy Number One” or Paul Manafort political operative &amp; Reagan/Dole darling now serving solitary confinement - although convicted of nothing? Where is the Russian Collusion?,8/1/18,18537,71912
“We already have a smocking gun about a campaign getting dirt on their opponent it was Hillary Clinton. How is it OK for Hillary Clinton to proactively seek dirt from the Russians but the Trump campaign met at the Russians request and that is bad?” Marc Thiessen Washington Post,8/1/18,4448,15030
Russian Collusion with the Trump Campaign one of the most successful in history is a TOTAL HOAX. The Democrats paid for the phony and discredited Dossier which was along with Comey McCabe Strzok and his lover the lovely Lisa Page used to begin the Witch Hunt. Disgraceful!,8/1/18,22187,84988
Paul Manafort worked for Ronald Reagan Bob Dole and many other highly prominent and respected political leaders. He worked for me for a very short time. Why didn’t government tell me that he was under investigation. These old charges have nothing to do with Collusion - a Hoax!,8/1/18,23314,89238
..This is a terrible situation and Attorney General Jeff Sessions should stop this Rigged Witch Hunt right now before it continues to stain our country any further. Bob Mueller is totally conflicted and his 17 Angry Democrats that are doing his dirty work are a disgrace to USA!,8/1/18,25318,96678
.....remain in the FBI while he himself was being investigated. This is a real issue. It won’t go into a Mueller Report because Mueller is going to protect these guys. Mueller has an interest in creating the illusion of objectivity around his investigation.” ALAN DERSHOWITZ....,8/1/18,16547,64593
“FBI Agent Peter Strzok (on the Mueller team) should have recused himself on day one. He was out to STOP THE ELECTION OF DONALD TRUMP. He needed an insurance policy. Those are illegal improper goals trying to influence the Election. He should never ever been allowed to........,8/1/18,20828,82452
Thank you Florida. I love you!https://t.co/M5T81DZVUU,8/1/18,17690,75106
On my way to Tampa Florida. Look forward to seeing everyone soon! https://t.co/BSB6IjBK7r,7/31/18,8441,50791
“Worker pay rate hits highest level since 2008” https://t.co/pMDxHQqcg9,7/31/18,18921,74178
...Border Security is National Security and National Security is the long-term viability of our Country. A Government Shutdown is a very small price to pay for a safe and Prosperous America!,7/31/18,17024,74147
I don’t care what the political ramifications are our immigration laws and border security have been a complete and total disaster for decades and there is no way that the Democrats will allow it to be fixed without a Government Shutdown...,7/31/18,26354,107985
.@SenJohnBarrasso has a Primary on August 21st. He doesn’t need any help because he is absolutely outstanding in every way but I hope the great people of Wyoming will go out and show their support anyway. John is absolutely top of the line &amp; has my Complete &amp; Total Endorsement!,7/31/18,11264,46723
Congressman David Kustoff has been a champion for the Trump Agenda - I greatly appreciate his support. David is strong on crime and borders loves our Military Vets and Second Amendment. Get out and vote for David on Thursday August 2nd. He has my Full and Total Endorsement!,7/31/18,13301,56547
The Fake News Media is going CRAZY! They are totally unhinged and in many ways after witnessing first hand the damage they do to so many innocent and decent people I enjoy watching. In 7 years when I am no longer in office their ratings will dry up and they will be gone!,7/31/18,24610,102238
Will be in Tampa tonight. A big year for @RepDeSantis who will be a great governor for Florida. Strong on Crime Borders and our 2nd Amendment. Big help on Tax &amp; Regulation Cuts. Loves our Military &amp; our Vets. Has my Full &amp; Total Endorsement!,7/31/18,13410,56186
I am looking into 3-D Plastic Guns being sold to the public. Already spoke to NRA doesn’t seem to make much sense!,7/31/18,10376,52390
Collusion is not a crime but that doesn’t matter because there was No Collusion (except by Crooked Hillary and the Democrats)!,7/31/18,19514,86389
One of the reasons we need Great Border Security is that Mexico’s murder rate in 2017 increased by 27% to 31174 people killed a record! The Democrats want Open Borders. I want Maximum Border Security and respect for ICE and our great Law Enforcement Professionals! @FoxNews,7/31/18,24687,91904
Rush Limbaugh is a great guy who truly gets it!,7/31/18,15348,74560
....them richer. Their network is highly overrated I have beaten them at every turn. They want to protect their companies outside the U.S. from being taxed I’m for America First &amp; the American Worker - a puppet for no one. Two nice guys with bad ideas. Make America Great Again!,7/31/18,16864,74917
The globalist Koch Brothers who have become a total joke in real Republican circles are against Strong Borders and Powerful Trade. I never sought their support because I don’t need their money or bad ideas. They love my Tax &amp; Regulation Cuts Judicial picks &amp; more. I made.....,7/31/18,22095,88242
MAKING AMERICA GREAT AGAIN! https://t.co/OnMGXvldVT,7/31/18,36406,110155
A highly respected Federal judge today stated that the “Trump Administration gets great credit” for reuniting illegal families. Thank you and please look at the previous administrations record - not good!,7/31/18,21905,88708
Congratulations to our new @DeptVetAffairs Secretary Robert Wilkie! https://t.co/6erqWJzuiK,7/30/18,8963,42660
Thank you to @RandPaul for your YES on a future great Justice of the Supreme Court Brett Kavanaugh. Your vote means a lot to me and to everyone who loves our Country!,7/30/18,16807,79854
...that Open Borders large scale Crime and abolishing ICE is good for them we must get smart and finally do what must be done for the Safety and Security of our Country!,7/30/18,13975,62004
Illegal immigration is a top National Security problem. After decades of playing games with the whole World laughing at the stupidity of our immigration laws and with Democrats thinking...,7/30/18,19050,80965
Congratulations to Judge Jeanine on the tremendous success of her new #1 best-selling book “Liars Leakers and Liberals – The Case Against the Anti-Trump Conspiracy!”,7/30/18,18383,90837
...your Social Security and Medicare! Cast your early vote or vote on August 7th Election Day. He has my full and total Endorsement!,7/30/18,5871,29448
.@Troy_Balderson of Ohio is running for Congress - so important to the Republican Party. Troy is strong on crime and Borders loves our Military our Vets and our Second Amendment. Troy will strongly protect...,7/30/18,8773,38263
Congratulations to General John Kelly. Today we celebrate his first full year as @WhiteHouse Chief of Staff! https://t.co/JWCaJ3GhHV,7/30/18,12906,67743
🇺🇸🇮🇹 https://t.co/1SSUCRtMEE,7/30/18,11916,53581
It is my great honor to welcome Prime Minister @GiuseppeConteIT of Italy to the @WhiteHouse! Join us at 2:00pmE for our joint press conference: https://t.co/XAchZ3zUSe https://t.co/5t4QVsKKqH,7/30/18,10545,49097
We must have Border Security get rid of Chain Lottery Catch &amp; Release Sanctuary Cities - go to Merit based Immigration. Protect ICE and Law Enforcement and of course keep building but much faster THE WALL!,7/30/18,29494,116486
....Also why is Mueller only appointing Angry Dems some of whom have worked for Crooked Hillary others including himself have worked for Obama....And why isn’t Mueller looking at all of the criminal activity &amp; real Russian Collusion on the Democrats side-Podesta Dossier?,7/29/18,25755,96234
Is Robert Mueller ever going to release his conflicts of interest with respect to President Trump including the fact that we had a very nasty &amp; contentious business relationship I turned him down to head the FBI (one day before appointment as S.C.) &amp; Comey is his close friend..,7/29/18,24839,87857
There is No Collusion! The Robert Mueller Rigged Witch Hunt headed now by 17 (increased from 13 including an Obama White House lawyer) Angry Democrats was started by a fraudulent Dossier paid for by Crooked Hillary and the DNC. Therefore the Witch Hunt is an illegal Scam!,7/29/18,31048,115212
...and the Amazon Washington Post do nothing but write bad stories even on very positive achievements - and they will never change!,7/29/18,14594,66480
...accurately. 90% of media coverage of my Administration is negative despite the tremendously positive results we are achieving it’s no surprise that confidence in the media is at an all time low! I will not allow our great country to be sold out by anti-Trump haters in the...,7/29/18,13322,44052
...dying newspaper industry. No matter how much they try to distract and cover it up our country is making great progress under my leadership and I will never stop fighting for the American people! As an example the failing New York Times...,7/29/18,15209,68586
When the media - driven insane by their Trump Derangement Syndrome - reveals internal deliberations of our government it  truly puts the lives of many not just journalists at risk! Very unpatriotic! Freedom of the press also comes with a responsibility to report the news...,7/29/18,22434,91737
I would be willing to “shut down” government if the Democrats do not give us the votes for Border Security which includes the Wall! Must get rid of Lottery Catch &amp; Release etc. and finally go to system of Immigration based on MERIT! We need great people coming into our Country!,7/29/18,34842,135850
The biggest and best results coming out of the good GDP report was that the quarterly Trade Deficit has been reduced by $52 Billion and of course the historically low unemployment numbers especially for African Americans Hispanics Asians and Women.,7/29/18,21443,88751
Had a very good and interesting meeting at the White House with A.G. Sulzberger Publisher of the New York Times. Spent much time talking about the vast amounts of Fake News being put out by the media &amp; how that Fake News has morphed into phrase “Enemy of the People.” Sad!,7/29/18,18359,75592
Please understand there are consequences when people cross our Border illegally whether they have children or not - and many are just using children for their own sinister purposes. Congress must act on fixing the DUMBEST &amp; WORST immigration laws anywhere in the world! Vote “R”,7/29/18,33183,127626
Do you think the Fake News Media will ever report on this tweet from Michael? https://t.co/kXLCKZO5Fr,7/29/18,14368,50407
Wow highest Poll Numbers in the history of the Republican Party. That includes Honest Abe Lincoln and Ronald Reagan. There must be something wrong please recheck that poll!,7/29/18,22102,102444
Tom Homan fmr ICE Director: “There is nobody that has done more for border security &amp; public safety than President Trump. I’ve worked for six presidents and I respect them all but nobody has done more than this Administration &amp; President Trump that’s just a stone cold fact!”,7/29/18,22644,87009
https://t.co/E3xvdUGZqa,7/28/18,23122,85655
Join me in Tampa Florida next Tuesday July 31st at 7:00pmE for a #MAGA Rally! Tickets: https://t.co/Q2PMyTACl8 https://t.co/URjvN8Owoe,7/28/18,15188,55585
The only things the Democrats do well is “Resist” which is their campaign slogan and “Obstruct.” Cryin’ Chuck Schumer has almost 400 great American people that are waiting “forever” to serve our Country! A total disgrace. Mitch M should not let them go home until all approved!,7/28/18,30440,118530
Democrats who want Open Borders and care little about Crime are incompetent but they have the Fake News Media almost totally on their side!,7/27/18,29051,118933
Congressman David Kustoff has been a champion for the Trump Agenda - I greatly appreciate his support. David is strong on crime and borders loves our Military Vets and Second Amendment. Get out and vote for David on Thursday August 2nd. He has my full and total Endorsement!,7/27/18,17754,72793
Private business investment has surged from 1.8 percent the year BEFORE I came into office to 9.4 percent this year -- that means JOBS JOBS JOBS! https://t.co/evO63CpqPP,7/27/18,16058,59904
The @USNavy’s first female Admiral Alene Duerk once said: “It was a nice distinction to have and to be recognized as the first but I wanted to make certain that I used that notoriety to do as much positive as I could.” Alene did just that and America is forever grateful! https://t.co/tOqkzqGVG7,7/27/18,12594,54602
We have accomplished an economic turnaround of HISTORIC proportions! https://t.co/vnmMtPv0kk,7/27/18,17193,67318
