text,created_at,retweet_count,favorite_count
“Trump Rally: Stocks put 2017 in the record books” https://t.co/0foQGaFjMh,12/31/17,13096,58549
Jobs are kicking in and companies are coming back to the U.S. Unnecessary regulations and high taxes are being dramatically Cut and it will only get better. MUCH MORE TO COME!,12/30/17,24332,117013
I use Social Media not because I like to but because it is the only way to fight a VERY dishonest and unfair “press” now often referred to as Fake News Media. Phony and non-existent “sources” are being used more often than ever. Many stories &amp; reports a pure fiction!,12/30/17,50342,195754
On Taxes: “This is the biggest corporate rate cut ever going back to the corporate income tax rate of roughly 80 years ago.This is a huge pro-growth stimulus for the economy. Every year the Obama WH overstated how the economy would grow. Now real economics and jobs.” @WSJ Report,12/30/17,16703,73325
Oppressive regimes cannot endure forever and the day will come when the Iranian people will face a choice. The world is watching! https://t.co/kvv1uAqcZ9,12/30/17,23270,78932
The entire world understands that the good people of Iran want change and other than the vast military power of the United States that Iran’s people are what their leaders fear the most.... https://t.co/W8rKN9B6RT,12/30/17,23532,77986
Many reports of peaceful protests by Iranian citizens fed up with regime’s corruption &amp; its squandering of the nation’s wealth to fund terrorism abroad. Iranian govt should respect their people’s rights including right to express themselves. The world is watching! #IranProtests,12/30/17,60821,138901
The Democrats have been told and fully understand that there can be no DACA without the desperately needed WALL at the Southern Border and an END to the horrible Chain Migration &amp; ridiculous Lottery System of Immigration etc. We must protect our Country at all cost!,12/29/17,35208,142106
Why is the United States Post Office which is losing many billions of dollars a year while charging Amazon and others so little to deliver their packages making Amazon richer and the Post Office dumber and poorer? Should be charging MUCH MORE!,12/29/17,27652,118765
While the Fake News loves to talk about my so-called low approval rating @foxandfriends just showed that my rating on Dec. 28 2017 was approximately the same as President Obama on Dec. 28 2009 which was 47%...and this despite massive negative Trump coverage &amp; Russia hoax!,12/29/17,23184,98172
In the East it could be the COLDEST New Year’s Eve on record. Perhaps we could use a little bit of that good old Global Warming that our Country but not other countries was going to pay TRILLIONS OF DOLLARS to protect against. Bundle up!,12/29/17,65929,204151
Together we are MAKING AMERICA GREAT AGAIN! https://t.co/OeyTdFyl1Q https://t.co/wdLQkfdy4m,12/28/17,15516,67092
I've been saying it for a long long time. #NoKo https://t.co/LQl7tGhMdO,12/28/17,26402,73657
Caught RED HANDED - very disappointed that China is allowing oil to go into North Korea. There will never be a friendly solution to the North Korea problem if this continues to happen!,12/28/17,31963,124997
Retail sales are at record numbers. We’ve got the economy going better than anyone ever dreamt - and you haven’t seen anything yet!,12/28/17,21499,108370
Vanity Fair which looks like it is on its last legs is bending over backwards in apologizing for the minor hit they took at Crooked H. Anna Wintour who was all set to be Amb to Court of St James’s &amp; a big fundraiser for CH is beside herself in grief &amp; begging for forgiveness!,12/28/17,14587,65832
“Arrests of MS-13 Members Associates Up 83% Under Trump” https://t.co/70iPHy2Yqn,12/28/17,21183,84891
“On 1/20 - the day Trump was inaugurated - an estimated 35000 ISIS fighters held approx 17500 square miles of territory in both Iraq and Syria. As of 12/21 the U.S. military est the remaining 1000 or so fighters occupy roughly 1900 square miles..” @jamiejmcintyre @dcexaminer https://t.co/OgYEuDgzD2,12/28/17,19706,68505
Just left West Palm Beach Fire &amp; Rescue #2. Met with great men and women as representatives of those who do so much for all of us. Firefighters paramedics first responders - what amazing people they are!,12/27/17,18464,108614
“On 1/20 - the day Trump was inaugurated - an estimated 35000 ISIS fighters held approx 17500 square miles of territory in both Iraq and Syria. As of 12/21 the U.S. military estimates the remaining 1000 or so fighters occupy roughly 1900 square miles...” via @jamiejmcintyre https://t.co/0lXKMUoPE9,12/27/17,12128,38520
All signs are that business is looking really good for next year only to be helped further by our Tax Cut Bill. Will be a great year for Companies and JOBS! Stock Market is poised for another year of SUCCESS!,12/26/17,25344,130759
WOW @foxandfrlends  “Dossier is bogus. Clinton Campaign DNC funded Dossier. FBI CANNOT (after all of this time) VERIFY CLAIMS IN DOSSIER OF RUSSIA/TRUMP COLLUSION. FBI TAINTED.” And they used this Crooked Hillary pile of garbage as the basis for going after the Trump Campaign!,12/26/17,35628,119478
Based on the fact that the very unfair and unpopular Individual Mandate has been terminated as part of our Tax Cut Bill which essentially Repeals (over time) ObamaCare the Democrats &amp; Republicans will eventually come together and develop a great new HealthCare plan!,12/26/17,20656,110208
I hope everyone is having a great Christmas then tomorrow it’s back to work in order to Make America Great Again (which is happening faster than anyone anticipated)!,12/25/17,34926,199932
MERRY CHRISTMAS!!! https://t.co/mYtV5GNdLl,12/25/17,49883,203792
MERRY CHRISTMAS!! https://t.co/xa2qxcisVV,12/25/17,34038,151030
People are proud to be saying Merry Christmas again. I am proud to have led the charge against the assault of our cherished and beautiful phrase. MERRY CHRISTMAS!!!!!,12/25/17,55103,232320
The Tax Cut/Reform Bill including Massive Alaska Drilling and the Repeal of the highly unpopular Individual Mandate brought it all together as to what an incredible year we had. Don’t let the Fake News convince you otherwise...and our insider Polls are strong!,12/24/17,23221,111414
The Fake News refuses to talk about how Big and how Strong our BASE is. They show Fake Polls just like they report Fake News. Despite only negative reporting we are doing well - nobody is going to beat us. MAKE AMERICA GREAT AGAIN!,12/24/17,33220,140299
.@FoxNews-FBI’s Andrew McCabe “in addition to his wife getting all of this money from M (Clinton Puppet) he was using allegedly his FBI Official Email Account to promote her campaign. You obviously cannot do this. These were the people who were investigating Hillary Clinton.”,12/24/17,29754,99677
Remember the Republicans are 5-0 in Congressional races this year. In Senate I said Roy M would lose in Alabama and supported Big Luther Strange - and Roy lost. Virginia candidate was not a “Trumper” and he lost.  Good Republican candidates will win BIG!,12/23/17,16929,85348
The Stock Market is setting record after record and unemployment is at a 17 year low. So many things accomplished by the Trump Administration perhaps more than any other President in first year. Sadly will never be reported correctly by the Fake News Media!,12/23/17,22728,101231
Wow “FBI lawyer James Baker reassigned” according to @FoxNews.,12/23/17,16794,66132
FBI Deputy Director Andrew McCabe is racing the clock to retire with full benefits. 90 days to go?!!!,12/23/17,20991,73110
How can FBI Deputy Director Andrew McCabe the man in charge along with leakin’ James Comey of the Phony Hillary Clinton investigation (including her 33000 illegally deleted emails) be given $700000 for wife’s campaign by Clinton Puppets during investigation?,12/23/17,36175,121354
Remember the most hated part of ObamaCare is the Individual Mandate which is being terminated under our just signed Tax Cut Bill.,12/22/17,25757,121704
Today it was my great honor to sign the largest TAX CUTS and reform in the history of our country. Full remarks: https://t.co/kMxoxEB68G https://t.co/OeAoA0sLfx,12/22/17,15999,69047
The United Nations Security Council just voted 15-0 in favor of additional Sanctions on North Korea. The World wants Peace not Death!,12/22/17,19186,91106
Congressman Ron DeSantis is a brilliant young leader Yale and then Harvard Law who would make a GREAT Governor of Florida. He loves our Country and is a true FIGHTER!,12/22/17,16490,73124
95% of Americans will pay less or at worst the same amount of taxes (mostly far less). The Dems only want to raise your taxes!,12/22/17,21759,104354
Will be signing the biggest ever Tax Cut and Reform Bill in 30 minutes in Oval Office. Will also be signing a much needed 4 billion dollar missile defense bill.,12/22/17,19465,103281
With all my Administration has done on Legislative Approvals (broke Harry Truman’s Record) Regulation Cutting Judicial Appointments Building Military VA TAX CUTS &amp; REFORM Record Economy/Stock Market and so much more I am sure great credit will be given by mainstream news?,12/22/17,20014,92096
“The President has accomplished some absolutely historic things during this past year.” Thank you Charlie Kirk of Turning Points USA. Sadly the Fake Mainstream Media will NEVER talk about our accomplishments in their end of year reviews. We are compiling a long &amp; beautiful list.,12/22/17,19035,86380
At some point and for the good of the country I predict we will start working with the Democrats in a Bipartisan fashion. Infrastructure would be a perfect place to start. After having foolishly spent $7 trillion in the Middle East it is time to start rebuilding our country!,12/22/17,28082,122524
So true! https://t.co/1c8hu6O5t9,12/22/17,10295,47792
Our big and very popular Tax Cut and Reform Bill has taken on an unexpected new source of “love” - that is big companies and corporations showering their workers with bonuses. This is a phenomenon that nobody even thought of and now it is the rage. Merry Christmas!,12/22/17,22316,95312
THANK YOU to everyone who joined me at the @WhiteHouse yesterday. Together we are MAKING AMERICA GREAT AGAIN! https://t.co/9HgcBKDSxo https://t.co/dTMU8OwmWB,12/21/17,14158,68696
House Democrats want a SHUTDOWN for the holidays in order to distract from the very popular just passed Tax Cuts. House Republicans don’t let this happen. Pass the C.R. TODAY and keep our Government OPEN!,12/21/17,21002,89128
Home Sales hit BEST numbers in 10 years! MAKE AMERICA GREAT AGAIN,12/21/17,18335,86356
Was @foxandfriends just named the most influential show in news? You deserve it - three great people! The many Fake News Hate Shows should study your formula for success!,12/21/17,19332,92315
The Massive Tax Cuts which the Fake News Media is desperate to write badly about so as to please their Democrat bosses will soon be kicking in and will speak for themselves. Companies are already making big payments to workers. Dems want to raise taxes hate these big Cuts!,12/21/17,25744,111795
WE ARE MAKING AMERICA GREAT AGAIN! https://t.co/HY353gXV0R,12/20/17,24389,101666
We are delivering HISTORIC TAX RELIEF for the American people!#TaxCutsandJobsAct https://t.co/lLgATrCh5o,12/20/17,20933,83357
Together we are MAKING AMERICA GREAT AGAIN! https://t.co/47k9i4p3J2,12/20/17,15625,68588
I would like to congratulate @SenateMajLdr on having done a fantastic job both strategically &amp; politically on the passing in the Senate of the MASSIVE TAX CUT &amp; Reform Bill. I could have not asked for a better or more talented partner. Our team will go onto many more VICTORIES!,12/20/17,18100,88704
The Tax Cuts are so large and so meaningful and yet the Fake News is working overtime to follow the lead of their friends the defeated Dems and only demean. This is truly a case where the results will speak for themselves starting very soon. Jobs Jobs Jobs!,12/20/17,18212,79155
The United States Senate just passed the biggest in history Tax Cut and Reform Bill. Terrible Individual Mandate (ObamaCare)Repealed. Goes to the House tomorrow morning for final vote. If approved there will be a News Conference at The White House at approximately 1:00 P.M.,12/20/17,32062,140937
Congratulations to Paul Ryan Kevin McCarthy Kevin Brady Steve Scalise Cathy McMorris Rodgers and all great House Republicans who voted in favor of cutting your taxes!,12/19/17,24855,128188
A  story in the @washingtonpost that I was close to “rescinding” the nomination of Justice Gorsuch prior to confirmation is FAKE NEWS. I never even wavered and am very proud of him and the job he is doing as a Justice of the U.S. Supreme Court. The unnamed sources don’t exist!,12/19/17,25350,97388
Stocks and the economy have a long way to go after the Tax Cut Bill is totally understood and appreciated in scope and size. Immediate expensing will have a big impact. Biggest Tax Cuts and Reform EVER passed. Enjoy and create many beautiful JOBS!,12/19/17,14541,69898
DOW RISES 5000 POINTS ON THE YEAR FOR THE FIRST TIME EVER - MAKE AMERICA GREAT AGAIN!,12/19/17,24588,114285
Together our task is to strengthen our families to build up our communities to serve our citizens and to celebrate AMERICAN GREATNESS as a shining example to the world.... https://t.co/ds6tZlgJpA,12/19/17,16843,66927
With the strategy that I announced today we are declaring that AMERICA is in the game and AMERICA is DETERMINED to WIN!OUR FOUR PILLARS OF NATIONAL SECURITY STRATEGY: https://t.co/B3POaMVID8,12/18/17,15917,61370
70 Record Closes for the Dow so far this year! We have NEVER had 70 Dow Records in a one year period. Wow!,12/18/17,21796,98285
Thank you Maria B! https://t.co/v1UR63CqLK,12/18/17,8803,40224
So true Ivanka! https://t.co/BNGUJG69Ki,12/18/17,8878,44123
As the world watches we are days away from passing HISTORIC TAX CUTS for American families and businesses. It will be the BIGGEST TAX CUT and TAX REFORM in the HISTORY of our country! https://t.co/EvcAkjuf8w,12/18/17,10165,48643
When the American People speak ALL OF US should listen. Just over one year ago you spoke loud and clear. On November 8 2016 you voted to MAKE AMERICA GREAT AGAIN! https://t.co/3AOv53S0PU,12/18/17,10464,48706
Over the past 11 months I have travelled tens of thousands of miles to visit 13 countries. I have met with more than 100 world leaders and everywhere I traveled it was my highest privilege and greatest honor to represent the AMERICAN PEOPLE! https://t.co/7SDsEeIhJH,12/18/17,13160,64290
Our deepest sympathies and most heartfelt prayers are with the victims of the train derailment in Washington State. We are closely monitoring the situation and coordinating with local authorities... https://t.co/Gyf5BdVm4G,12/18/17,8892,42983
My thoughts and prayers are with everyone involved in the train accident in DuPont Washington. Thank you to all of our wonderful First Responders who are on the scene. We are currently monitoring here at the White House.,12/18/17,15241,83134
The train accident that just occurred in DuPont WA shows more than ever why our soon to be submitted infrastructure plan must be approved quickly. Seven trillion dollars spent in the Middle East while our roads bridges tunnels railways (and more) crumble! Not for long!,12/18/17,23417,106936
Ivanka Trump will be interviewed on @foxandfriends.,12/18/17,6350,44244
Remember Republicans are 5-0 in Congressional Races this year. The media refuses to mention this. I said Gillespie and Moore would lose (for very different reasons) and they did. I also predicted  “I” would win. Republicans will do well in 2018 very well! @foxandfriends,12/18/17,19207,88208
More than a century after conquering flight the #WrightBrothers continue to motivate &amp; inspire Americans who never tire of exploration &amp; innovation. This GREAT AMERICAN SPIRIT can be found in the design of every new supersonic jet and next generation: https://t.co/NeKPMgkdg8 https://t.co/pODjl00lAy,12/18/17,13230,61029
Wonderful weekend at Camp David. A very special place. A lot of very important work done. Heading back to the @WhiteHouse now. https://t.co/cKxlsdr1ut,12/17/17,11081,63898
As a candidate I promised we would pass a massive TAX CUT for the everyday working American families who are the backbone and the heartbeat of our country. Now we are just days away... https://t.co/MADTGUMktX,12/17/17,18452,85511
WEEKLY ADDRESS🇺🇸 https://t.co/1sH20Hb33x,12/16/17,13171,52608
TAX CUTS will increase investment in the American economy and in U.S. workers leading to higher growth higher wages and more JOBS! https://t.co/4GxM8psMU1,12/16/17,15385,70108
Congratulations to two great and hardworking guys Corey Lewandowski and David Bossie on the success of their just out book “Let Trump Be Trump.” Finally people with real knowledge are writing about our wonderful and exciting campaign!,12/16/17,22536,110560
Great job Kevin we are all proud of you! https://t.co/K6hEEaOxKt,12/16/17,13977,65484
DOW S&amp;P 500 and NASDAQ close at record highs! #MAGA https://t.co/hvqwnqSGuG,12/16/17,13049,57542
Today it was my tremendous honor to visit Marine Helicopter Squadron One (HMX-1) at the Marine Corps Air Facility in Quantico Virginia. I am honored to serve as your Commander-in-Chief. On behalf of an entire Nation THANK YOU for your sacrifice and service. We love you! https://t.co/eLOTc7do52,12/15/17,18380,78203
You are always there for us – THE MEN AND WOMEN IN BLUE.Thank you to our police thank you to our sheriffs and thank you to our law enforcement families. God Bless you all and GOD BLESS AMERICA! #LESM https://t.co/9ejiddVL9h,12/15/17,17043,72595
To each member of the graduating class from the National Academy at Quantico CONGRATULATIONS! https://t.co/bGT8S33ZLU,12/15/17,10079,52942
It was my honor. THANK YOU! https://t.co/1LvqbRQ1bi,12/15/17,14133,69299
“Manufacturing Optimism Rose to Another All-Time High in the Latest @ShopFloorNAM Outlook Survey” https://t.co/LuV4BMp0Xc,12/14/17,9007,38758
In 1960 there were approximately 20000 pages in the Code of Federal Regulations. Today there are over 185000 pages as seen in the Roosevelt Room.Today we CUT THE RED TAPE! It is time to SET FREE OUR DREAMS and MAKE AMERICA GREAT AGAIN! https://t.co/teAVNzjvcx,12/14/17,26104,88904
When Americans are free to thrive innovate &amp; prosper there is no challenge too great no task too large &amp; no goal beyond our reach. We are a nation of explorers pioneers innovators &amp; inventors. We are nation of people who work hard dream big &amp; who never ever give up... https://t.co/9LVdp6zOgZ,12/14/17,16849,69650
Today we gathered in the Roosevelt Room for one single reason: to CUT THE RED TAPE! For many decades an ever-growing maze of regs rules and restrictions has cost our country trillions of dollars millions of jobs countless American factories &amp; devastated entire industries. https://t.co/ostXOVnckf,12/14/17,12854,57441
As a candidate I promised we would pass a massive tax cut for the everyday working Americans. If you make your voices heard this moment will be forever remembered as a great new beginning – the dawn of a brilliant American future shining with PATRIOTISM PROSPERITY AND PRIDE! https://t.co/exsBzrlCdw,12/14/17,18400,77121
Republican Tax Cuts are looking very good. All are working hard. In the meantime the Stock Market hit another record high!,12/14/17,17274,92795
Thank you Omarosa for your service! I wish you continued success.,12/13/17,13915,86535
If last night’s election proved anything it proved that we need to put up GREAT Republican candidates to increase the razor thin margins in both the House and Senate.,12/13/17,20081,101999
Wow more than 90% of Fake News Media coverage of me is negative with numerous forced retractions of untrue stories. Hence my use of Social Media the only way to get the truth out. Much of Mainstream Meadia has become a joke! @foxandfriends,12/13/17,29405,120149
The reason I originally endorsed Luther Strange (and his numbers went up mightily) is that I said Roy Moore will not be able to win the General Election.  I was right! Roy worked hard but the deck was stacked against him!,12/13/17,15235,75633
Congratulations to Doug Jones on a hard fought victory. The write-in votes played a very big factor but a win is a win. The people of Alabama are great and the Republicans will have another shot at this seat in a very short period of time. It never ends!,12/13/17,24939,123062
Wishing all of those celebrating #Hanukkah around the world a happy and healthy eight nights in the company of those they love. https://t.co/A5W0PDWBxp https://t.co/D9MVVPq39x,12/12/17,17237,76040
Consumer Confidence is at an All-Time High along with a Record High Stock Market. Unemployment is at a 17 year low. MAKE AMERICA GREAT AGAIN! Working to pass MASSIVE TAX CUTS (looking good).,12/12/17,20179,92234
The people of Alabama will do the right thing. Doug Jones is Pro-Abortion weak on Crime Military and Illegal Immigration Bad for Gun Owners and Veterans and against the WALL. Jones is a Pelosi/Schumer Puppet. Roy Moore will always vote with us. VOTE ROY MOORE!,12/12/17,21590,81386
Lightweight Senator Kirsten Gillibrand a total flunky for Chuck Schumer and someone who would come to my office “begging” for campaign contributions not so long ago (and would do anything for them) is now in the ring fighting against Trump. Very disloyal to Bill &amp; Crooked-USED!,12/12/17,23666,88993
Despite thousands of hours wasted and many millions of dollars spent the Democrats have been unable to show any collusion with Russia - so now they are moving on to the false accusations and fabricated stories of women who I don’t know and/or have never met. FAKE NEWS!,12/12/17,38156,147886
Another false story this time in the Failing @nytimes that I watch 4-8 hours of television a day - Wrong!  Also I seldom if ever watch CNN or MSNBC both of which I consider Fake News. I never watch Don Lemon who I once called the “dumbest man on television!” Bad Reporting.,12/11/17,34018,138768
Very little discussion of all the purposely false and defamatory stories put out this week by the Fake News Media. They are out of control - correct reporting means nothing to them. Major lies written then forced to be withdrawn after they are exposed...a stain on America!,12/10/17,30872,120303
Getting closer and closer on the Tax Cut Bill. Shaping up even better than projected. House and Senate working very hard and smart. End result will be not only important but SPECIAL!,12/10/17,18268,95820
Things are going really well for our economy a subject the Fake News spends as little time as possible discussing! Stock Market hit another RECORD HIGH unemployment is now at a 17 year low and companies are coming back into the USA. Really good news and much more to come!,12/10/17,28859,127436
No American should be separated from their loved ones because of preventable crime committed by those illegally in our country. Our cities should be Sanctuaries for Americans – not for criminal aliens! https://t.co/CvtkCG1pln,12/10/17,35354,125611
Great Army - Navy Game. Army wins 14 to 13 and brings home the COMMANDER-IN-CHIEF’S TROPHY! Congratulations!,12/9/17,15390,93901
Great Army - Navy Game. Army wins 14 to 13 and brings home the COMMANDER-IN-CHIEF’S TROPHY (last time was 1996). Wow! Congratulations!,12/9/17,1657,7867
.@daveweigel of the Washington Post just admitted that his picture was a FAKE (fraud?) showing an almost empty arena last night for my speech in Pensacola when in fact he knew the arena was packed (as shown also on T.V.). FAKE NEWS he should be fired.,12/9/17,24272,89981
.@DaveWeigel @WashingtonPost put out a phony photo of an empty arena hours before I arrived @ the venue w/ thousands of people outside on their way in. Real photos now shown as I spoke. Packed house many people unable to get in. Demand apology &amp; retraction from FAKE NEWS WaPo! https://t.co/XAblFGh1ob,12/9/17,24536,77219
Have a great game today @USArmy and @USNavy - I will be watching. We love our U.S. Military. On behalf of an entire Nation THANK YOU for your sacrifice and service! #ArmyNavyGame #USA🇺🇸 https://t.co/8m1W9rFwIh,12/9/17,10992,53589
It was my great honor to celebrate the opening of two extraordinary museums-the Mississippi State History Museum &amp; the Mississippi Civil Rights Museum. We pay solemn tribute to our heroes of the past &amp; dedicate ourselves to building a future of freedom equality justice &amp; peace. https://t.co/5AkgVpV8aa,12/9/17,14844,66079
Heading to the great state of Mississippi at the invitation of their popular and respected Governor @PhilBryantMS. Look forward to seeing the new Civil Rights Museum!,12/9/17,10642,59761
CNN’S slogan is CNN THE MOST TRUSTED NAME IN NEWS. Everyone knows this is not true that this could in fact be a fraud on the American Public. There are many outlets that are far more trusted than Fake News CNN. Their slogan should be CNN THE LEAST TRUSTED NAME IN NEWS!,12/9/17,37477,148043
Fake News CNN made a vicious and purposeful mistake yesterday. They were caught red handed just like lonely Brian Ross at ABC News (who should be immediately fired for his “mistake”). Watch to see if @CNN fires those responsible or was it just gross incompetence?,12/9/17,23857,92778
A big contingent of very enthusiastic Roy Moore fans at the rally last night. We can’t have a Pelosi/Schumer Liberal Democrat Jones in that important Alabama Senate seat. Need your vote to Make America Great Again! Jones will always vote against what we must do for our Country.,12/9/17,13914,60349
